{"job_id": "jzY6GujADIS_JsjBAAAAAA==", "employer_name": "Boston Consulting Group", "employer_logo": "https://www.underconsideration.com/brandnew/archives/boston_consulting_group_logo_monogram.png", "employer_website": "http://www.bcg.com", "employer_company_type": "Consulting", "job_publisher": "Jobs.brassring.com", "job_employment_type": "FULLTIME", "job_title": "Client Development Senior Manager", "job_apply_link": "https://sjobs.brassring.com/TGnewUI/Search/home/HomeWithPreLoad?partnerid=25811&siteid=5185&PageType=JobDetails&jobid=849089", "job_apply_is_direct": false, "job_apply_quality_score": 0.7635, "apply_options": [{"publisher": "Jobs.brassring.com", "apply_link": "https://sjobs.brassring.com/TGnewUI/Search/home/HomeWithPreLoad?partnerid=25811&siteid=5185&PageType=JobDetails&jobid=849089", "is_direct": false}, {"publisher": "RevFinders", "apply_link": "https://revfinders.com/career/36243/Client-Development-Senior-Manager-Washington", "is_direct": false}], "job_description": "Client Development Senior Managers (CDSMs) work at the intersection of business development, account management, marketing, and client engagement within BCG\u2019s most strategic accounts. In this role, you will be embedded as a key member of a BCG account team in order to support the full range of activities required to support the client and the account team. You will serve as a thought partner and become the \"chief of staff\" to the lead Partner(s) on the account, including the Chief Coordinating Officer (CCO), or lead BCG relationship partner. CDSMs should be self-starters with outstanding organization and communication skills, who are excited about working in an entrepreneurial environment and who are adept at building relationships.\n\nThe objective of the Client Development Senior Manager role is to provide strategic support to Client Coordinating Officers (CCOs) and client account teams for our largest and most complex clients, supporting the account's business development priorities. You will become an expert on the client, acting as a Chief of Staff to the CCO, identifying client development and growth opportunities, and ensuring strong account performance. Examples of what you will do include driving the account planning process, managing the business pipeline, developing the account marketing strategy, overseeing pricing and contracting, and supporting financial and market analysis. In this role, you will also become an integrated team member of the client account team, coordinating strategic case team activities to ensure effective teaming across Partner teams, non-Partner teams, and supporting functions.\n\nLeading and supporting the full cycle process of account planning:\n\u2022 Constructing a comprehensive client account plan in partnership with the account team to guide the team's activities and priorities. Ensuring that the day-to-day execution of the account plan, driving action behind the team ambitions through active project management\n\u2022 Developing and maintaining the client relationship map and ensure a robust engagement strategy for key relationships is in place, helping the account leadership drive the development of deep and personal client relationships\n\u2022 Managing the account marketing plan, including event invitation strategy and management and distribution of thought leadership\n\nServing as an expert client resource and maintaining robust client information and knowledge:\n\u2022 Maintaining baseline/background client information (proposal tracking, investor presentations, marketing information, investment history, client references, etc). Monitor client news, earnings/ analyst views, financial information and derive actionable insights\n\u2022 Tracking broader industry trends and changes to help the account leadership understand the broader market landscape\n\u2022 Identifying potential white space opportunities for the account and conduct quantitative analysis as needed\n\u2022 Attending and actively participating in internal practice areas and functional topic conferences to stay on top of relevant industry trends and BCG offerings, and be the account lead on bringing the best of BCG to the client\n\nCreating and measuring value on the account:\n\u2022 Coordinating and managing feedback from clients, including analysis of surveys and senior leadership interviews\n\u2022 Examples can include managing a rate card negotiation, developing an account dashboard, or conducting post-case value measurement\n\u2022 Selectively engaging with the client directly, as appropriate, and at the discretion of the BCG account team.\n\nLeading and orchestrating quality account teaming:\n\u2022 Serving as a thought partner to the CCO and Partner team, providing insights and constructive feedback on existing account tools and processes, as well as identifying opportunities to team better\n\u2022 Ensuring effective communication and coordination of various Partners and consulting team members (examples can include facilitating regular account meetings, driving account communications, on-boarding new team members and enhancing and facilitating case wrap up processes)\n\u2022 Identifying and engaging the right internal, expert resources for functional, industry and global BCG support\n\u2022 Crafting and developing proposal ready materials, including a solid repository of ready-to-use CVs and resumes\n\nCultivating close partnerships with internal, functional supporting teams:\n\u2022 Acting as key account team liaison across BCG's internal functions, including marketing, finance, staffing, practice area management, alumni, and more\n\u2022 Becoming embedded within the respective industry and functional practice areas\n\u2022 Teaming with finance to understand account economics, engagement pricing, investments, and to optimize expenses, leading efforts to optimize spending where necessary and appropriate\n\u2022 Working closely with EA team to ensure coordination and communication across broader case team\n\u2022 Championing best practice sharing and insights across the CDSM Team\n\u2022 Acting as a key catalyst for collaboration across the full CDSM team by actively sharing account insights, tools, and creative ideas\n\u2022 Seeking out opportunities to scale successes beyond your own account to have a broader enterprise level impact\n\u2022 Performing other duties or special projects as assigned or required\n\u2022 10+ years of working in a professional services firm with experience in account management and client development; consulting background preferred\n\u2022 Bachelor\u2019s degree required; Advanced degree/MBA preferred\n\u2022 Strong Excel and PowerPoint skills; strong computer literacy and facility with numbers\n\u2022 Comfortable communicating in direct client interactions\n\u2022 Strong verbal and written communication skills and entrepreneurial drive\n\u2022 Ability to work effectively with all levels and functions of the organization\n\u2022 Good organizational skills and effective management skills to manage multiple parallel tasks, ability to set priorities\n\u2022 Performed successfully in a fast-paced, global, intellectually intense, service-oriented environment with people at all organizational levels\n\u2022 Proactive, creative, self-starter\n\u2022 Able to prioritize, able to tolerate ambiguity\n\u2022 Exercises judgment in handling confidential/sensitive information; trustworthy", "job_is_remote": false, "job_posted_at_timestamp": 1706630780, "job_posted_at_datetime_utc": "2024-01-30T16:06:20.000Z", "job_city": null, "job_state": null, "job_country": "US", "job_latitude": 37.09024, "job_longitude": -95.71289, "job_benefits": null, "job_google_link": "https://www.google.com/search?gl=us&hl=en&rciv=jb&q=senior+manager+of+brand+partnerships&start=30&ibp=htl;jobs#fpstate=tldetail&htivrt=jobs&htiq=senior+manager+of+brand+partnerships&htidocid=jzY6GujADIS_JsjBAAAAAA%3D%3D", "job_offer_expiration_datetime_utc": "2024-04-29T23:59:59.000Z", "job_offer_expiration_timestamp": 1714435199, "job_required_experience": {"no_experience_required": false, "required_experience_in_months": 120, "experience_mentioned": true, "experience_preferred": true}, "job_required_skills": null, "job_required_education": {"postgraduate_degree": false, "professional_certification": false, "high_school": false, "associates_degree": false, "bachelors_degree": false, "degree_mentioned": true, "degree_preferred": true, "professional_certification_mentioned": false}, "job_experience_in_place_of_education": false, "job_min_salary": null, "job_max_salary": null, "job_salary_currency": null, "job_salary_period": null, "job_highlights": {"Qualifications": ["Strong Excel and PowerPoint skills; strong computer literacy and facility with numbers", "Comfortable communicating in direct client interactions", "Strong verbal and written communication skills and entrepreneurial drive", "Ability to work effectively with all levels and functions of the organization", "Good organizational skills and effective management skills to manage multiple parallel tasks, ability to set priorities", "Performed successfully in a fast-paced, global, intellectually intense, service-oriented environment with people at all organizational levels", "Proactive, creative, self-starter", "Able to prioritize, able to tolerate ambiguity", "Exercises judgment in handling confidential/sensitive information; trustworthy"], "Responsibilities": ["Client Development Senior Managers (CDSMs) work at the intersection of business development, account management, marketing, and client engagement within BCG\u2019s most strategic accounts", "In this role, you will be embedded as a key member of a BCG account team in order to support the full range of activities required to support the client and the account team", "You will serve as a thought partner and become the \"chief of staff\" to the lead Partner(s) on the account, including the Chief Coordinating Officer (CCO), or lead BCG relationship partner", "The objective of the Client Development Senior Manager role is to provide strategic support to Client Coordinating Officers (CCOs) and client account teams for our largest and most complex clients, supporting the account's business development priorities", "You will become an expert on the client, acting as a Chief of Staff to the CCO, identifying client development and growth opportunities, and ensuring strong account performance", "Examples of what you will do include driving the account planning process, managing the business pipeline, developing the account marketing strategy, overseeing pricing and contracting, and supporting financial and market analysis", "In this role, you will also become an integrated team member of the client account team, coordinating strategic case team activities to ensure effective teaming across Partner teams, non-Partner teams, and supporting functions", "Leading and supporting the full cycle process of account planning:", "Constructing a comprehensive client account plan in partnership with the account team to guide the team's activities and priorities", "Ensuring that the day-to-day execution of the account plan, driving action behind the team ambitions through active project management", "Developing and maintaining the client relationship map and ensure a robust engagement strategy for key relationships is in place, helping the account leadership drive the development of deep and personal client relationships", "Managing the account marketing plan, including event invitation strategy and management and distribution of thought leadership", "Serving as an expert client resource and maintaining robust client information and knowledge:", "Maintaining baseline/background client information (proposal tracking, investor presentations, marketing information, investment history, client references, etc)", "Monitor client news, earnings/ analyst views, financial information and derive actionable insights", "Tracking broader industry trends and changes to help the account leadership understand the broader market landscape", "Identifying potential white space opportunities for the account and conduct quantitative analysis as needed", "Attending and actively participating in internal practice areas and functional topic conferences to stay on top of relevant industry trends and BCG offerings, and be the account lead on bringing the best of BCG to the client", "Creating and measuring value on the account:", "Coordinating and managing feedback from clients, including analysis of surveys and senior leadership interviews", "Examples can include managing a rate card negotiation, developing an account dashboard, or conducting post-case value measurement", "Selectively engaging with the client directly, as appropriate, and at the discretion of the BCG account team", "Leading and orchestrating quality account teaming:", "Serving as a thought partner to the CCO and Partner team, providing insights and constructive feedback on existing account tools and processes, as well as identifying opportunities to team better", "Ensuring effective communication and coordination of various Partners and consulting team members (examples can include facilitating regular account meetings, driving account communications, on-boarding new team members and enhancing and facilitating case wrap up processes)", "Identifying and engaging the right internal, expert resources for functional, industry and global BCG support", "Crafting and developing proposal ready materials, including a solid repository of ready-to-use CVs and resumes", "Cultivating close partnerships with internal, functional supporting teams:", "Becoming embedded within the respective industry and functional practice areas", "Teaming with finance to understand account economics, engagement pricing, investments, and to optimize expenses, leading efforts to optimize spending where necessary and appropriate", "Working closely with EA team to ensure coordination and communication across broader case team"]}, "job_job_title": "Senior manager", "job_posting_language": "en", "job_onet_soc": "11202100", "job_onet_job_zone": "4", "job_naics_code": "541613", "job_naics_name": "Marketing Consulting Services"}