{"job_id": "HHffIbgHpbDqJmzPAAAAAA==", "employer_name": "MARS Solutions Group", "employer_logo": null, "employer_website": "http://marssg.com", "employer_company_type": null, "job_publisher": "Salary.com", "job_employment_type": "FULLTIME", "job_title": "Senior Data Scientist", "job_apply_link": "https://www.salary.com/job/mars-solutions-group/senior-data-scientist/j202401161200305742136", "job_apply_is_direct": false, "job_apply_quality_score": 0.6209, "apply_options": [{"publisher": "Salary.com", "apply_link": "https://www.salary.com/job/mars-solutions-group/senior-data-scientist/j202401161200305742136", "is_direct": false}, {"publisher": "LazyApply", "apply_link": "https://lazyapply.com/jobpreview/job_99334dc715748111", "is_direct": true}, {"publisher": "SaluteMyJob", "apply_link": "https://salutemyjob.com/jobs/senior-data-scientist-frisco-texas/1258525625-2/", "is_direct": false}, {"publisher": "JobServe", "apply_link": "https://www.jobserve.com/us/en/extjob/SENIOR-DATA-SCIENTIST-in-Frisco-Texas-USA-9B0F5FB89CBABE25B5/", "is_direct": false}, {"publisher": "Talentify", "apply_link": "https://www.talentify.io/job/data-scientist-frisco-texas-united-software-group-inc-us-west-8cdfa310a4be9e093e59ae737d4172de", "is_direct": false}, {"publisher": "Big Country Jobs", "apply_link": "https://jobs.bigcountryhomepage.com/jobs/senior-data-scientist-frisco-texas/1258525625-2/", "is_direct": false}, {"publisher": "Jobs Trabajo.org", "apply_link": "https://us.trabajo.org/job-1842-20240228-cb09ff364bb923313f0b8e18dde3c31c", "is_direct": false}, {"publisher": "ComputerJobs", "apply_link": "https://www.computerjobs.com/us/en/search-jobs-in-Texas,-USA/SENIOR-DATA-SCIENTIST-0BA4284C9C23DCE3E2/", "is_direct": false}], "job_description": "MARS Solutions Group is looking for a Senior Data Scientist\n\nfor a client. Our client is a well-known and highly respected organization seeking bright, tech-savvy talent.\n\nDescription:\n\nAs a Senior Data Scientist in this role, you will work as the primary modeler for our in-house Marketing Attribution (MMM) and Optimization model. You will be responsible for ensuring input data fidelity, and producing results that are statistically sound. In addition to your primary function, you will work with Principal Data Scientists to research and implement econometric/statistical and mathematical optimization solutions to strengthen and enhance the Attribution and Optimization model.\n\nYou will work with Data Engineers, Machine Learning Engineers, and Front-End Designers/Developers to ensure quality of data and results and debug errors as necessary. The Senior Data Scientist is expected to be a strong team-player and take on a player-coach role within the team. You must possess the desire to: (1) train junior data scientists on modeling procedure; (2) coach junior data scientists on understanding, shaping, and validating data; (3) ensure requirements are met or communicate roadblocks; and (4) train junior data scientists to execute, tune, and validate the model.\n\nWhat you will do:\n\u2022 Independently execute the Attribution and Optimization model balancing accuracy\n\u2022 Communicate and translate results in the context of the business and quantify uncertainty\n\u2022 Help Decision Scientists, Business Analysts, and Data Science leadership recommend strategies and operational tactics under uncertainty\n\u2022 Develop compelling measurement plans and model/forecast scoring methods to track predictions against actuals (while considering the cumulative and delayed effects of marketing efforts and uncertainty)\n\u2022 Design, develop and program methods, processes, and systems to consolidate and analyze unstructured, diverse \"big data\" sources to generate actionable insights and solutions to generate business impact\n\u2022 Work across multi-disciplinary teams to translate business needs into testable hypotheses and design experiments to test said hypotheses\n\u2022 Collaborate with other members of the team to support investigation across a variety of topics\n\u2022 Research, recommend, and apply appropriate statistical, econometric, mathematical, and computational modeling concepts across domains\n\u2022 Work with Machine Learning Engineers to convert experimental code to production code\n\u2022 Unit test production model code to ensure quality\n\u2022 Take an active role in recruiting, training, guiding, and mentoring junior team members\n\u2022 Ensure data and code integrity by conducting documentation and code reviews\n\u2022 Implement strategic analyses with the know-how to balance getting the details right, while still moving at the speed of business\n\nYou have:\n\u2022 A quantitative MS/PhD and minimum of 3 years of demonstrated success in Data Science\n\u2022 3 years of experience in deploying data science in a business environment and fact-based evidence/anecdotes of implementation and impact from such deployments\n\u2022 Experience in Time Series modeling and the complexity of Time Series\n\u2022 Expertise in Bayesian modeling and Bayesian inference\n\u2022 An understanding of uncertainty principles in modeling and leverage distributional predictions to represent uncertainty and risk\n\u2022 The ability to accurately scope modeling projects and estimate levels of effort in sprint planning\n\u2022 Collaboration skills and experience working with cross-functional teams and effectively communicate findings and recommendations to non-technical stakeholders\n\u2022 A team-player and a team-first mentality\n\u2022 Excellent oral and written communication skills\n\u2022 Excellent Data Story telling skills\n\u2022 A highly detail-oriented and organized working style-ensuring model documentation excellence\n\u2022 Strong business, economic, and financial acumen\n\nYou will stand out if you have one or more of the following:\n\u2022 The ability to quantify indirect effect of treatments utilizing Bayesian/Causal Networks or Halo Effects\n\u2022 Experience with Bayesian Belief Networks\n\u2022 Experience incorporating expert qualitative business knowledge and A/B test results to adjust and tune model results\n\u2022 Familiarity and experience with conformal prediction, and diffusion methods is a plus\n\u2022 Demonstrated experience with applying integer and linear optimization methods to drive business goals/KPI outcomes\n\u2022 Strong working knowledge of causal inference techniques\n\u2022 Familiarity of advanced optimization methods\n\u2022 Demonstrated success in Data Science within the Marketing Domain\n\u2022 Experience working in CPG, Media, or Retail on the client or agency side\n\u2022 Domain knowledge on marketing and/or Market Mix Models\n\u2022 Up to date and passion for staying current with various modeling techniques and a demonstrated history of utilizing champion challenger principles to ensure model\n\u2022 2 years of demonstrated experience working directly or indirectly with Python in a full-stack Data Science product environment\n\u2022 Experience working with engineers to convert prototype code into production ready code\n\u2022 Experience working with Bit Bucket, Git, Google Cloud Platform\n\u2022 Experience working in an agile setting and the familiarity of agile principles\n\nMARS Solutions Group is an IT staffing firm with access to a wide variety of jobs at various clients across the country. We operate with the consultant's best interests in mind and align them with roles that match their skills, aspirations, and interests.\n\nMARS values our relationships with consultants. Therefore, we will stay in touch throughout the duration of the contract to ensure the job is going well and that the role meets their career development needs.", "job_is_remote": false, "job_posted_at_timestamp": 1710374400, "job_posted_at_datetime_utc": "2024-03-14T00:00:00.000Z", "job_city": "Frisco", "job_state": "TX", "job_country": "US", "job_latitude": 33.150673, "job_longitude": -96.82361, "job_benefits": null, "job_google_link": "https://www.google.com/search?gl=us&hl=en&rciv=jb&q=senior+data+scientist&start=60&ibp=htl;jobs#fpstate=tldetail&htivrt=jobs&htiq=senior+data+scientist&htidocid=HHffIbgHpbDqJmzPAAAAAA%3D%3D", "job_offer_expiration_datetime_utc": "2024-04-13T00:00:00.000Z", "job_offer_expiration_timestamp": 1712966400, "job_required_experience": {"no_experience_required": false, "required_experience_in_months": 36, "experience_mentioned": true, "experience_preferred": true}, "job_required_skills": null, "job_required_education": {"postgraduate_degree": false, "professional_certification": false, "high_school": false, "associates_degree": false, "bachelors_degree": false, "degree_mentioned": true, "degree_preferred": false, "professional_certification_mentioned": false}, "job_experience_in_place_of_education": false, "job_min_salary": null, "job_max_salary": null, "job_salary_currency": null, "job_salary_period": null, "job_highlights": {"Qualifications": ["A quantitative MS/PhD and minimum of 3 years of demonstrated success in Data Science", "3 years of experience in deploying data science in a business environment and fact-based evidence/anecdotes of implementation and impact from such deployments", "Experience in Time Series modeling and the complexity of Time Series", "Expertise in Bayesian modeling and Bayesian inference", "An understanding of uncertainty principles in modeling and leverage distributional predictions to represent uncertainty and risk", "The ability to accurately scope modeling projects and estimate levels of effort in sprint planning", "Collaboration skills and experience working with cross-functional teams and effectively communicate findings and recommendations to non-technical stakeholders", "A team-player and a team-first mentality", "Excellent oral and written communication skills", "Excellent Data Story telling skills", "A highly detail-oriented and organized working style-ensuring model documentation excellence", "Strong business, economic, and financial acumen", "The ability to quantify indirect effect of treatments utilizing Bayesian/Causal Networks or Halo Effects", "Experience with Bayesian Belief Networks", "Experience incorporating expert qualitative business knowledge and A/B test results to adjust and tune model results", "Demonstrated experience with applying integer and linear optimization methods to drive business goals/KPI outcomes", "Strong working knowledge of causal inference techniques", "Familiarity of advanced optimization methods", "Demonstrated success in Data Science within the Marketing Domain", "Experience working in CPG, Media, or Retail on the client or agency side", "Domain knowledge on marketing and/or Market Mix Models", "Up to date and passion for staying current with various modeling techniques and a demonstrated history of utilizing champion challenger principles to ensure model", "2 years of demonstrated experience working directly or indirectly with Python in a full-stack Data Science product environment", "Experience working with engineers to convert prototype code into production ready code", "Experience working with Bit Bucket, Git, Google Cloud Platform", "Experience working in an agile setting and the familiarity of agile principles"], "Responsibilities": ["As a Senior Data Scientist in this role, you will work as the primary modeler for our in-house Marketing Attribution (MMM) and Optimization model", "You will be responsible for ensuring input data fidelity, and producing results that are statistically sound", "In addition to your primary function, you will work with Principal Data Scientists to research and implement econometric/statistical and mathematical optimization solutions to strengthen and enhance the Attribution and Optimization model", "You will work with Data Engineers, Machine Learning Engineers, and Front-End Designers/Developers to ensure quality of data and results and debug errors as necessary", "The Senior Data Scientist is expected to be a strong team-player and take on a player-coach role within the team", "Independently execute the Attribution and Optimization model balancing accuracy", "Communicate and translate results in the context of the business and quantify uncertainty", "Help Decision Scientists, Business Analysts, and Data Science leadership recommend strategies and operational tactics under uncertainty", "Develop compelling measurement plans and model/forecast scoring methods to track predictions against actuals (while considering the cumulative and delayed effects of marketing efforts and uncertainty)", "Design, develop and program methods, processes, and systems to consolidate and analyze unstructured, diverse \"big data\" sources to generate actionable insights and solutions to generate business impact", "Work across multi-disciplinary teams to translate business needs into testable hypotheses and design experiments to test said hypotheses", "Collaborate with other members of the team to support investigation across a variety of topics", "Research, recommend, and apply appropriate statistical, econometric, mathematical, and computational modeling concepts across domains", "Work with Machine Learning Engineers to convert experimental code to production code", "Unit test production model code to ensure quality", "Take an active role in recruiting, training, guiding, and mentoring junior team members", "Ensure data and code integrity by conducting documentation and code reviews", "Implement strategic analyses with the know-how to balance getting the details right, while still moving at the speed of business"]}, "job_job_title": "Data scientist", "job_posting_language": "en", "job_onet_soc": "15111100", "job_onet_job_zone": "5"}