{"job_id": "mCx7hOxLJ8yHuAEEAAAAAA==", "employer_name": "Prodport", "employer_logo": null, "employer_website": "http://prodport.com", "employer_company_type": null, "job_publisher": "Prodport", "job_employment_type": "FULLTIME", "job_title": "Partner Manager", "job_apply_link": "https://prodport.com/jobs/partner-manager/", "job_apply_is_direct": false, "job_apply_quality_score": 0.7853, "apply_options": [{"publisher": "Prodport", "apply_link": "https://prodport.com/jobs/partner-manager/", "is_direct": false}], "job_description": "At Prodport, we value the unique backgrounds, experiences and perspectives each one of us brings. We are built as a remote first team from all over the globe, and believe in creativity, innovation, impact and team work. We\u2019re all coming from unique and diverse backgrounds, love for technology and passion for what we do.\n\nAs a Partner Manager, you will be responsible for developing and building a long term, deep, and mutually-beneficial relationship with Prodport\u2019s partners. You will leverage strong consultative skills to understand your partners\u2019 business model and growth strategy so that you can create ways to increase value from collaborative work to our clients, partners and to ourselves - a true win-win-win.\n\nIn this role you are responsible for managing relationships with partners, explaining the value, differentiating, managing business development opportunities (and co-selling) to/from your partners, driving co-marketing alongside the ecosystem marketing team, acting as a thought leader in our space, and coaching your partners on how to grow their business, including their profitability.\n\nThe nature of the role:\n\u2022 Become a trusted advisor to the 40-60 partner relationships you manage with key leaders & decision makers at these orgs + build relationships with those managing front line teams.\n\u2022 Build and manage a lead referral pipeline with your partner portfolio.\n\u2022 Work to understand a partner\u2019s organization structure and business goals.\n\u2022 Develop a long-term strategy with your partner to help them meet their business goals alongside.\n\u2022 Act as a consultant to help our partners build or optimize their offerings around.\n\u2022 Become a product expert on Prodport and present how Pordport services and software can help a partner improve their business.\n\u2022 Be comfortable operating with and exceeding revenue-focused goals.\n\u2022 Bring your creative thinking, strategies, and ideas to advance our values, build our culture, and execute on our vision for the future.\n\u2022 Have an opportunity to own projects and collaborate with a highly driven team to create new partner enablement and process.\n\u2022 Drive co-marketing with our partners.\n\u2022 Travel: up to 25%, to meet and develop relationships with our agency partners / events.\n\nWho you are:\n\u2022 Are adept at influencing and relationship building.\n\u2022 Experience and network within the e-commerce, marketing eco-system\n\u2022 Have partnerships, sales, or account management experience.\n\u2022 Are thoughtful, engaging, and energetic.\n\u2022 Obsessed with understanding your customer or partner.\n\u2022 Comfortable operating independently.\n\u2022 Comfortable presenting in large groups & showcasing yourself as a thought leader in our industry.\n\u2022 Proactively solicit and act on feedback from your customers, partners, and peers.\n\u2022 Are excited to be a part of and have an impact on a rapidly-growing, profitable startup.\n\u2022 Have a positive outlook and excellent written and verbal communication skills.\n\u2022 Have 3-6 years of SaaS account management, channel and/or sales experience.\n\u2022 Work collaboratively with enablement, CS, Marketing and Product to introduce and educate agency partners on our platform and new releases.\n\u2022 Bring your thinking, strategies, and ideas to advance our company\u2019s values, unique culture, and vision for the future.\n\nAbout Prodport\n\nWe aim to become the most innovative product intelligence company in the world, enabling brands to deliver the best product content and experience to every customer with our platform. We deliver solutions around the products our clients sell as the center of our technology. By combining deep learning and data analysis with product page optimization and collaborative atomic content creation, we enable our clients to achieve better business outcomes", "job_is_remote": false, "job_posted_at_timestamp": 1646434930, "job_posted_at_datetime_utc": "2022-03-04T23:02:10.000Z", "job_city": null, "job_state": null, "job_country": "US", "job_latitude": 37.09024, "job_longitude": -95.71289, "job_benefits": null, "job_google_link": "https://www.google.com/search?gl=us&hl=en&rciv=jb&q=manager+of+brand+partnerships&start=30&ibp=htl;jobs#fpstate=tldetail&htivrt=jobs&htiq=manager+of+brand+partnerships&htidocid=mCx7hOxLJ8yHuAEEAAAAAA%3D%3D", "job_offer_expiration_datetime_utc": null, "job_offer_expiration_timestamp": null, "job_required_experience": {"no_experience_required": false, "required_experience_in_months": 36, "experience_mentioned": true, "experience_preferred": false}, "job_required_skills": null, "job_required_education": {"postgraduate_degree": false, "professional_certification": false, "high_school": false, "associates_degree": false, "bachelors_degree": false, "degree_mentioned": false, "degree_preferred": false, "professional_certification_mentioned": false}, "job_experience_in_place_of_education": false, "job_min_salary": null, "job_max_salary": null, "job_salary_currency": null, "job_salary_period": null, "job_highlights": {"Qualifications": ["Are adept at influencing and relationship building", "Experience and network within the e-commerce, marketing eco-system", "Are thoughtful, engaging, and energetic", "Obsessed with understanding your customer or partner", "Comfortable operating independently", "Comfortable presenting in large groups & showcasing yourself as a thought leader in our industry", "Have a positive outlook and excellent written and verbal communication skills", "Have 3-6 years of SaaS account management, channel and/or sales experience", "Work collaboratively with enablement, CS, Marketing and Product to introduce and educate agency partners on our platform and new releases"], "Responsibilities": ["You will leverage strong consultative skills to understand your partners\u2019 business model and growth strategy so that you can create ways to increase value from collaborative work to our clients, partners and to ourselves - a true win-win-win", "In this role you are responsible for managing relationships with partners, explaining the value, differentiating, managing business development opportunities (and co-selling) to/from your partners, driving co-marketing alongside the ecosystem marketing team, acting as a thought leader in our space, and coaching your partners on how to grow their business, including their profitability", "Become a trusted advisor to the 40-60 partner relationships you manage with key leaders & decision makers at these orgs + build relationships with those managing front line teams", "Build and manage a lead referral pipeline with your partner portfolio", "Work to understand a partner\u2019s organization structure and business goals", "Develop a long-term strategy with your partner to help them meet their business goals alongside", "Act as a consultant to help our partners build or optimize their offerings around", "Become a product expert on Prodport and present how Pordport services and software can help a partner improve their business", "Be comfortable operating with and exceeding revenue-focused goals", "Bring your creative thinking, strategies, and ideas to advance our values, build our culture, and execute on our vision for the future", "Have an opportunity to own projects and collaborate with a highly driven team to create new partner enablement and process", "Travel: up to 25%, to meet and develop relationships with our agency partners / events", "Proactively solicit and act on feedback from your customers, partners, and peers"]}, "job_job_title": "Partner manager", "job_posting_language": "en", "job_onet_soc": "11202100", "job_onet_job_zone": "4"}