{"job_id": "asrGURAH2bPYrsFnAAAAAA==", "employer_name": "Teachstone", "employer_logo": "https://mma.prnewswire.com/media/693063/Teachstone_Logo.jpg", "employer_website": "https://teachstone.com", "employer_company_type": null, "job_publisher": "The Org", "job_employment_type": "FULLTIME", "job_title": "Senior Manager Of Sponsored Events", "job_apply_link": "https://theorg.com/org/teachstone/jobs/senior-manager-of-sponsor-5ec03c14", "job_apply_is_direct": false, "job_apply_quality_score": 0.5614, "apply_options": [{"publisher": "The Org", "apply_link": "https://theorg.com/org/teachstone/jobs/senior-manager-of-sponsor-5ec03c14", "is_direct": false}, {"publisher": "Chuspinfo.net", "apply_link": "https://chuspinfo.net/?refId=CwLzM5SXc74CZcomxGwx3Q%3D%3D&trackingId=jdVJ%2BMo1bbtX0megSECq2A%3D%3D&position=10&pageNum=0&trk=public_jobs_jserp-result_search-card&_=%2Fjobs%2Fview%2Fsenior-manager-of-sponsored-events-at-teachstone-3825312014%23KJWqMdlUlBn8PPpbXBTujI7xcY8uGFCs", "is_direct": false}], "job_description": "Company Overview:\n\nDo you enjoy making a difference in a child's life, transforming education, and evolving learning? Come join Teachstone, the interactions company! Teachstone\u00ae was founded in 2008 to deliver the Classroom Assessment Scoring System\u00ae (CLASS\u00ae) nationwide and around the globe. Developed through years of research, the CLASS system measures and improves the interactions between educators and children, which have been shown to drive learning and lifelong achievement. Our online subscription service, myTeachstone, simplifies CLASS implementation by combining observation data with a robust library of CLASS resources and professional development.\n\nAt Teachstone, everything we do is about improving the ways educators interact with children. We train instructional coaches and observers, build and deliver online support programs, and design professional development for educators \u2014 all of it proven to improve children\u2019s social, emotional, and academic success. By helping educators focus, measure, and improve their interactions and relationships with children, Teachstone is transforming education nationwide, one interaction at a time.\n\nRole Overview:\n\nThe Senior Manager of Sponsored Events will collaborate with the event team to develop and implement event strategy and playbooks for internal and external events by aligning event strategy with Teachstone\u2019s business strategy. This leader will determine event goals and objectives in consultation with senior management and the Senior Manager of Teachstone Hosted Events to deliver annual and quarterly plans. The Senior Manager will ensure each event realizes its full business potential through a defined event development process owned and implemented by the team.\n\nThis role will collaborate with sales leaders to optimize event opportunities including building relationships with associations and event partners and identify new ways to sponsor and participate. Working with the broader team, this leader will build out an events playbook, reporting framework, and quarterly analysis of the effectiveness of our event investments. The manager will establish and grow partnerships with key event stakeholders, strategic partners and suppliers using excellent verbal and written communication skills to build regular cadence of communication, feedback and opportunity\n\n\u2014----------------------------------------------------------\n\nRole Responsibilities:\n\u2022 Lead the strategic planning of sponsored/paid events, delivering an annual plan and communication strategy to make sure the value, objectives, expectation, and outcomes of our event investments are well understood\n\u2022 Oversee the planning, coordination, and execution of events and partner/sponsor relationships, including conferences, meetings, trade shows, and other unique opportunities to give Teachstone visibility\n\u2022 Manage event budgets, including tracking expenses and ROI against the objectives for participation and sponsoring\n\u2022 Negotiate contracts and sponsorships\n\u2022 Source and manage exhibit services vendors\n\u2022 Develop and maintain ongoing relationships with event partners, sponsors, and vendors throughout the year\n\u2022 Create and distribute event materials, including invitations, programs, and promotional materials\n\u2022 Monitor event activities to ensure compliance with applicable laws and regulations\n\u2022 Supervise and train event staff, including volunteers\n\u2022 Evaluate event success and prepare post-event reports\n\u2022 Stay up-to-date on event industry trends and best practices\n\u2022 Excellent verbal and written communication skills to build regular cadence of communication and feedback.\n\u2022 Extremely organized with great attention to detail\n\u2022 Change Management\n\u2022 Bachelor\u2019s degree in business, marketing, education or related field.\n\u2022 7 or more years of business, marketing, or PreK-12 education industry experience managing paid events and sponsorships.\n\u2022 Demonstrable ability to strategize approaches to events that maximize brand, lead gen and partnership development.\n\u2022 Excellent project management skills and ability to define a process for event management that will drive measurable results\n\u2022 Physical Requirements: Prolonged periods sitting at a desk and working on a computer. Must be able to lift up to 15 pounds at times.\n\nRole Preferred Qualifications:\n\u2022 Experience in the education market is preferred, with an emphasis on early education.\n\u2022 Digital marketing and analytics experience.\n\nTeachstone is an Equal Opportunity Employer. We consider all applicants without regard to race, religion, color, national origin, gender, sexual orientation, gender identity or expression, age, marital status, veteran status, disability status, pregnancy, parental status, genetic data, political affiliation, or any other status protected by law. We are dedicated to fostering an inclusive and diverse culture.", "job_is_remote": false, "job_posted_at_timestamp": 1709328641, "job_posted_at_datetime_utc": "2024-03-01T21:30:41.000Z", "job_city": null, "job_state": null, "job_country": "US", "job_latitude": 37.09024, "job_longitude": -95.71289, "job_benefits": ["retirement_savings"], "job_google_link": "https://www.google.com/search?gl=us&hl=en&rciv=jb&q=senior+sponsorships+director&start=0&ibp=htl;jobs#fpstate=tldetail&htivrt=jobs&htiq=senior+sponsorships+director&htidocid=asrGURAH2bPYrsFnAAAAAA%3D%3D", "job_offer_expiration_datetime_utc": null, "job_offer_expiration_timestamp": null, "job_required_experience": {"no_experience_required": false, "required_experience_in_months": null, "experience_mentioned": true, "experience_preferred": true}, "job_required_skills": null, "job_required_education": {"postgraduate_degree": false, "professional_certification": false, "high_school": false, "associates_degree": false, "bachelors_degree": false, "degree_mentioned": true, "degree_preferred": true, "professional_certification_mentioned": false}, "job_experience_in_place_of_education": false, "job_min_salary": null, "job_max_salary": null, "job_salary_currency": null, "job_salary_period": null, "job_highlights": {"Qualifications": ["7 or more years of business, marketing, or PreK-12 education industry experience managing paid events and sponsorships", "Physical Requirements: Prolonged periods sitting at a desk and working on a computer", "Must be able to lift up to 15 pounds at times"], "Responsibilities": ["We train instructional coaches and observers, build and deliver online support programs, and design professional development for educators \u2014 all of it proven to improve children\u2019s social, emotional, and academic success", "By helping educators focus, measure, and improve their interactions and relationships with children, Teachstone is transforming education nationwide, one interaction at a time", "The Senior Manager of Sponsored Events will collaborate with the event team to develop and implement event strategy and playbooks for internal and external events by aligning event strategy with Teachstone\u2019s business strategy", "This leader will determine event goals and objectives in consultation with senior management and the Senior Manager of Teachstone Hosted Events to deliver annual and quarterly plans", "The Senior Manager will ensure each event realizes its full business potential through a defined event development process owned and implemented by the team", "This role will collaborate with sales leaders to optimize event opportunities including building relationships with associations and event partners and identify new ways to sponsor and participate", "Working with the broader team, this leader will build out an events playbook, reporting framework, and quarterly analysis of the effectiveness of our event investments", "The manager will establish and grow partnerships with key event stakeholders, strategic partners and suppliers using excellent verbal and written communication skills to build regular cadence of communication, feedback and opportunity", "Lead the strategic planning of sponsored/paid events, delivering an annual plan and communication strategy to make sure the value, objectives, expectation, and outcomes of our event investments are well understood", "Oversee the planning, coordination, and execution of events and partner/sponsor relationships, including conferences, meetings, trade shows, and other unique opportunities to give Teachstone visibility", "Manage event budgets, including tracking expenses and ROI against the objectives for participation and sponsoring", "Negotiate contracts and sponsorships", "Source and manage exhibit services vendors", "Develop and maintain ongoing relationships with event partners, sponsors, and vendors throughout the year", "Create and distribute event materials, including invitations, programs, and promotional materials", "Monitor event activities to ensure compliance with applicable laws and regulations", "Supervise and train event staff, including volunteers", "Evaluate event success and prepare post-event reports", "Stay up-to-date on event industry trends and best practices", "Extremely organized with great attention to detail", "Change Management", "Demonstrable ability to strategize approaches to events that maximize brand, lead gen and partnership development", "Excellent project management skills and ability to define a process for event management that will drive measurable results"]}, "job_job_title": "Senior", "job_posting_language": "en", "job_onet_soc": "13112100", "job_onet_job_zone": "4"}