{"job_id": "-8YRxrQs_A2ZxFNHAAAAAA==", "employer_name": "Modernized Marketing", "employer_logo": "https://encrypted-tbn0.gstatic.com/images?q=tbn:ANd9GcTbmSFFjQgF0EXqrbE-FO9gcS4qR1aktVgoU8O9&s=0", "employer_website": null, "employer_company_type": null, "job_publisher": "LinkedIn", "job_employment_type": "FULLTIME", "job_title": "Director of Development and Partnerships", "job_apply_link": "https://www.linkedin.com/jobs/view/director-of-development-and-partnerships-at-modernized-marketing-3797993526", "job_apply_is_direct": false, "job_apply_quality_score": 0.6372, "apply_options": [{"publisher": "LinkedIn", "apply_link": "https://www.linkedin.com/jobs/view/director-of-development-and-partnerships-at-modernized-marketing-3797993526", "is_direct": false}], "job_description": "Title: Director of Development and Partnerships\n\nCompany: Modernized Marketing\n\nType: Full-time, Remote (9-6 pm EST)\n\nSalary:$80K Base + Performance Based Incentives of $110K+ OTE\n\nModernized Marketing Team Overview:\n\nAt Modernized Marketing, we are a leading digital marketing agency, known for transforming ads into dynamic assets for business growth. Our expertise spans across creating impactful sales funnels, branding, content creation, PPC advertising, SEO, CRO, and email marketing. We leverage advanced AI tools for enhanced copywriting, analytics, and optimization, ensuring we stay at the forefront of marketing trends and technologies.\n\nJob Description:\n\nWe are seeking a highly skilled and experienced Director of Development and Partnerships to lead our efforts in expanding our client portfolio and nurturing strategic partnerships. As a digital marketing agency known for driving business growth through innovative strategies, we are looking for a dynamic and results-oriented professional to join our team.\n\nKey Responsibilities:\n\u2022 Develop and execute a strategic plan for business growth, including identifying new markets and opportunities.\n\u2022 Lead the acquisition of new clients, nurturing leads, and managing the sales pipeline.\n\u2022 Collaborate with the marketing team to create effective marketing campaigns and strategies for client acquisition.\n\u2022 Identify and establish strategic partnerships with industry leaders, technology providers, and complementary businesses.\n\u2022 Maintain and nurture relationships with strategic partners\n\u2022 Negotiate partnership agreements and develop mutually beneficial relationships.\n\u2022 Leverage partnerships to enhance our service offerings and drive business growth.\n\u2022 Build and maintain strong relationships with existing clients, ensuring high client satisfaction and retention.\n\u2022 Understand clients' needs and work with Account Managers to provide insights and solutions to drive their success.\n\u2022 Act as a trusted advisor to clients, offering guidance on digital marketing strategies.\n\u2022 Work with Account Managers to upsell clients and provide additional services.\n\u2022 Stay up-to-date with industry trends, market conditions, and competitive landscape.\n\u2022 Conduct market research to identify emerging opportunities and threats.\n\u2022 Use data and insights to make informed decisions and recommendations.\n\nQualifications:\n\u2022 Bachelor's degree in business, marketing, or a related field; MBA is a plus.\n\u2022 Proven experience in business development, sales, and partnership management in the digital marketing industry.\n\u2022 Strong network of industry contacts and partners.\n\u2022 Exceptional communication and negotiation skills.\n\u2022 Strategic thinking and a track record of achieving revenue targets.\n\u2022 Leadership and team management experience.\n\nBenefits:\n\u2022 Competitive salary and performance-based bonuses.\n\u2022 Health benefits.\n\u2022 Opportunities for career growth and advancement.\n\u2022 A dynamic and collaborative work environment.", "job_is_remote": true, "job_posted_at_timestamp": 1704378122, "job_posted_at_datetime_utc": "2024-01-04T14:22:02.000Z", "job_city": null, "job_state": null, "job_country": "US", "job_latitude": 37.09024, "job_longitude": -95.71289, "job_benefits": ["health_insurance"], "job_google_link": "https://www.google.com/search?gl=us&hl=en&rciv=jb&q=vice+president+of+brand+partnerships&start=40&ibp=htl;jobs#fpstate=tldetail&htivrt=jobs&htiq=vice+president+of+brand+partnerships&htidocid=-8YRxrQs_A2ZxFNHAAAAAA%3D%3D", "job_offer_expiration_datetime_utc": "2024-07-02T14:21:31.000Z", "job_offer_expiration_timestamp": 1719930091, "job_required_experience": {"no_experience_required": false, "required_experience_in_months": null, "experience_mentioned": true, "experience_preferred": false}, "job_required_skills": null, "job_required_education": {"postgraduate_degree": false, "professional_certification": false, "high_school": false, "associates_degree": false, "bachelors_degree": true, "degree_mentioned": true, "degree_preferred": true, "professional_certification_mentioned": false}, "job_experience_in_place_of_education": false, "job_min_salary": null, "job_max_salary": null, "job_salary_currency": null, "job_salary_period": null, "job_highlights": {"Qualifications": ["Proven experience in business development, sales, and partnership management in the digital marketing industry", "Strong network of industry contacts and partners", "Exceptional communication and negotiation skills", "Strategic thinking and a track record of achieving revenue targets", "Leadership and team management experience"], "Responsibilities": ["Type: Full-time, Remote (9-6 pm EST)", "Develop and execute a strategic plan for business growth, including identifying new markets and opportunities", "Lead the acquisition of new clients, nurturing leads, and managing the sales pipeline", "Collaborate with the marketing team to create effective marketing campaigns and strategies for client acquisition", "Identify and establish strategic partnerships with industry leaders, technology providers, and complementary businesses", "Maintain and nurture relationships with strategic partners", "Negotiate partnership agreements and develop mutually beneficial relationships", "Leverage partnerships to enhance our service offerings and drive business growth", "Build and maintain strong relationships with existing clients, ensuring high client satisfaction and retention", "Understand clients' needs and work with Account Managers to provide insights and solutions to drive their success", "Act as a trusted advisor to clients, offering guidance on digital marketing strategies", "Work with Account Managers to upsell clients and provide additional services", "Stay up-to-date with industry trends, market conditions, and competitive landscape", "Conduct market research to identify emerging opportunities and threats", "Use data and insights to make informed decisions and recommendations"], "Benefits": ["Salary:$80K Base + Performance Based Incentives of $110K+ OTE", "Competitive salary and performance-based bonuses", "Health benefits", "Opportunities for career growth and advancement", "A dynamic and collaborative work environment"]}, "job_job_title": null, "job_posting_language": "en", "job_onet_soc": "11203100", "job_onet_job_zone": "4"}