{"job_id": "5BtMPC6kdiYUFGtFAAAAAA==", "employer_name": "The People Brand", "employer_logo": null, "employer_website": null, "employer_company_type": null, "job_publisher": "Lever", "job_employment_type": "FULLTIME", "job_title": "Full-Time Contract - Brand Marketing Manager (GTM/Digital)", "job_apply_link": "https://jobs.lever.co/thepeoplebrand/a30f9202-6b8f-43d6-92f9-f9a1a4c8c81d", "job_apply_is_direct": false, "job_apply_quality_score": 0.7548, "apply_options": [{"publisher": "Lever", "apply_link": "https://jobs.lever.co/thepeoplebrand/a30f9202-6b8f-43d6-92f9-f9a1a4c8c81d", "is_direct": false}, {"publisher": "Jobgether", "apply_link": "https://jobgether.com/offer/65d42b71fa6c8bac88bdbefb-full-time-contract---brand-marketing-manager-gtm-digital", "is_direct": false}], "job_description": "POSITION PURPOSE/SUMMARY STATEMENT (defines the major functions/purpose of the position):\n\nWhat we\u2019re looking for is a Sr. Marketing Manager with the mindset and passion to solve problems, lead a team, and elevate the brand through insightful and outstanding Marketing execution.\n\nUnder the strategic direction of the Sr. Marketing Manager , the Brand Maarketing Manager will be responsible for leading the go-to-market and digital execution across all channels and markets. The position is responsible for developing seasonal launch plans, including advertising, digital brand marketing (ecomm, social media, mobile, content, emerging media), brand partnerships, events, and .com. These responsibilities are inclusive, but not limited to leading media planning, contract negotiations, launch initiatives, and working cross-functionally with team to influence and execute premium brand collaborations and public relations.\n\nDUTIES AND RESPONSIBILITIES:\n\n\u00b7 Execution of seasonal and product launch go-to-market initiatives including both sell-in and sell through tools. Core responsibilities include digital/social, advertising, partnerships, events, and content strategy.\n\n\u00b7 Key stakeholder to the creative development & production of tools with the creative team \u2013 including briefing all GTM and Digital needs for brand assets/photoshoots/etc for seasonal campaigns, brand content needs, launch initiatives and ongoing programs/products.\n\n\u00b7 Leverage consumer insight as well as digital know-how to recommend brand building digital executions. Develop and implement strategy across multiple digital disciplines including social media, digital creative, content production, eCRM, mobile and emerging spaces. Partner with the Head of Marketing to drive content strategy & calendar based on consumer & digital insights. Collaborate with entire brand team and brand partners to collect and develop content to disseminate on social media, digital advertising, .com, wholesale ecomm sites and online partners/influencers.\n\n\u00b7 Concepts and assists in production (with support from creative group and outside agencies) to manage and execute delivery of brand content to deliver on the brand \u2018storyteller\u2019 promise.\n\n\u00b7 Collaborate with producer for .com to ensure the brand\u2019s digital presence is consistent and correct across digital platforms with regard to web design, email campaigns and content. Lead team in development of content calendars for .com to create seamless integration of digital marketing and ecommerce.\n\n\u00b7 Leverages media partners, influencers, ambassadors, brand partners, etc. to collect and develop content to support our digital/PR/media syndication strategy.\n\n\u00b7 Manages programs through to delivery in market in partnership with Head of Marketing and Retail Marketing Manager\n\n\u00b7 Communicates and coordinates with internal stakeholders (product, sales, marketing, and design) to gather requirements and develop project plans for the digital and go to market campaigns.\n\n\u00b7 Manages multiple interdependent timelines and distributes ongoing documentation of project plans with cross functional teams.\n\n\u00b7 Integrated in strategic planning of seasonal campaigns and launch initiatives with Head of Marketing.\n\n\u00b7 Monitors best in class activities for adoption into the brand\u2019s plan.\n\n\u00b7 Manages global campaign development in partnership with Brand Design and/or outside agencies.\n\n\u00b7 Budgetary management.\n\n\u00b7 Train and develop team members based on individual talents. As the team grows, support internal career path and development for full time employees.\n\nSUPERVISORY RESPONSIBILITIES:\n\nThis role will manage various agencies and contractors. As the team grows, so will supervisory responsibilities.\n\nREQUIRED QUALIFICATIONS:\n\nEducation/Experience:\n\n\u00b7 Bachelor\u2019s degree with marketing focus preferred, or related work experience.\n\n\u00b7 4-6 years marketing experience, preferably in footwear, apparel or related consumer goods industry\n\n\u00b7 Digital/Social marketing knowledge necessary\n\n\u00b7 Proven, successful track record in effective marketing and team management\n\n\u00b7 Must have the ability to work effectively in a management role across digital marketing disciplines\n\n\u00b7 Must have presentation, communication, interpersonal, and organizational skills\n\n\u00b7 Must be proficient in Microsoft Office \u2013 Outlook, Word, Excel, PowerPoint\n\n\u00b7 Should have a positive, energetic working style\n\n\u00b7 Effective team player with experience managing direct reports, or agencies\n\nSkills/Programs/Knowledge/Behavior:\n\n\u00b7 Proficient in Microsoft Applications\n\n\u00b7 Proven track record of fiscal responsibility and knowledge\n\n\u00b7 Proven track record of success\n\n\u00b7 Knowledgeable in current trends\n\n\u00b7 Innovative manager with people & processes\n\n\u00b7 Experience working effectively in complex global organizations and often working under the pressure of competing and sometimes conflicting priorities\n\n\u00b7 Ability to use independent judgment in performing all duties of the position\n\n\u00b7 Ability to travel domestically and abroad\n\n\u00b7 Ability to assist with event and promotional execution\n\n\u00b7 Strong written and verbal communication skills to professionally and effectively interact with team, colleagues and leadership\n\n\u00b7 High degree of integrity with the ability to handle confidential and sometimes highly sensitive matters in the appropriate manner\n\n$42 - $44 an hour", "job_is_remote": false, "job_posted_at_timestamp": 1708300800, "job_posted_at_datetime_utc": "2024-02-19T00:00:00.000Z", "job_city": null, "job_state": null, "job_country": "US", "job_latitude": 37.09024, "job_longitude": -95.71289, "job_benefits": null, "job_google_link": "https://www.google.com/search?gl=us&hl=en&rciv=jb&q=manager+of+brand+partnerships&start=60&ibp=htl;jobs#fpstate=tldetail&htivrt=jobs&htiq=manager+of+brand+partnerships&htidocid=5BtMPC6kdiYUFGtFAAAAAA%3D%3D", "job_offer_expiration_datetime_utc": null, "job_offer_expiration_timestamp": null, "job_required_experience": {"no_experience_required": false, "required_experience_in_months": 48, "experience_mentioned": true, "experience_preferred": false}, "job_required_skills": null, "job_required_education": {"postgraduate_degree": false, "professional_certification": false, "high_school": false, "associates_degree": false, "bachelors_degree": false, "degree_mentioned": true, "degree_preferred": false, "professional_certification_mentioned": false}, "job_experience_in_place_of_education": false, "job_min_salary": null, "job_max_salary": null, "job_salary_currency": null, "job_salary_period": null, "job_highlights": {"Qualifications": ["4-6 years marketing experience, preferably in footwear, apparel or related consumer goods industry", "Digital/Social marketing knowledge necessary", "Proven, successful track record in effective marketing and team management", "Must have the ability to work effectively in a management role across digital marketing disciplines", "Must have presentation, communication, interpersonal, and organizational skills", "Must be proficient in Microsoft Office \u2013 Outlook, Word, Excel, PowerPoint", "Should have a positive, energetic working style", "Effective team player with experience managing direct reports, or agencies", "Proficient in Microsoft Applications", "Proven track record of fiscal responsibility and knowledge", "Knowledgeable in current trends", "Innovative manager with people & processes", "Experience working effectively in complex global organizations and often working under the pressure of competing and sometimes conflicting priorities", "Ability to use independent judgment in performing all duties of the position", "Ability to travel domestically and abroad", "Ability to assist with event and promotional execution", "Strong written and verbal communication skills to professionally and effectively interact with team, colleagues and leadership", "High degree of integrity with the ability to handle confidential and sometimes highly sensitive matters in the appropriate manner"], "Responsibilities": ["Marketing Manager with the mindset and passion to solve problems, lead a team, and elevate the brand through insightful and outstanding Marketing execution", "Marketing Manager , the Brand Maarketing Manager will be responsible for leading the go-to-market and digital execution across all channels and markets", "The position is responsible for developing seasonal launch plans, including advertising, digital brand marketing (ecomm, social media, mobile, content, emerging media), brand partnerships, events, and .com", "These responsibilities are inclusive, but not limited to leading media planning, contract negotiations, launch initiatives, and working cross-functionally with team to influence and execute premium brand collaborations and public relations", "Execution of seasonal and product launch go-to-market initiatives including both sell-in and sell through tools", "Key stakeholder to the creative development & production of tools with the creative team \u2013 including briefing all GTM and Digital needs for brand assets/photoshoots/etc for seasonal campaigns, brand content needs, launch initiatives and ongoing programs/products", "Leverage consumer insight as well as digital know-how to recommend brand building digital executions", "Develop and implement strategy across multiple digital disciplines including social media, digital creative, content production, eCRM, mobile and emerging spaces", "Partner with the Head of Marketing to drive content strategy & calendar based on consumer & digital insights", "Collaborate with entire brand team and brand partners to collect and develop content to disseminate on social media, digital advertising, .com, wholesale ecomm sites and online partners/influencers", "Concepts and assists in production (with support from creative group and outside agencies) to manage and execute delivery of brand content to deliver on the brand \u2018storyteller\u2019 promise", "Collaborate with producer for .com to ensure the brand\u2019s digital presence is consistent and correct across digital platforms with regard to web design, email campaigns and content", "Lead team in development of content calendars for .com to create seamless integration of digital marketing and ecommerce", "Leverages media partners, influencers, ambassadors, brand partners, etc", "to collect and develop content to support our digital/PR/media syndication strategy", "Manages programs through to delivery in market in partnership with Head of Marketing and Retail Marketing Manager", "Communicates and coordinates with internal stakeholders (product, sales, marketing, and design) to gather requirements and develop project plans for the digital and go to market campaigns", "Manages multiple interdependent timelines and distributes ongoing documentation of project plans with cross functional teams", "Integrated in strategic planning of seasonal campaigns and launch initiatives with Head of Marketing", "Monitors best in class activities for adoption into the brand\u2019s plan", "Manages global campaign development in partnership with Brand Design and/or outside agencies", "As the team grows, support internal career path and development for full time employees", "This role will manage various agencies and contractors", "As the team grows, so will supervisory responsibilities"], "Benefits": ["Train and develop team members based on individual talents", "$42 - $44 an hour"]}, "job_job_title": null, "job_posting_language": "en", "job_onet_soc": "11202100", "job_onet_job_zone": "4"}