{"job_id": "PzdYiJ3p4zHrVCKmAAAAAA==", "employer_name": "Bain & Company", "employer_logo": "https://www.bain.com/contentassets/0b88e3e10a7b4592809517c28b75847e/logo_red_bain.svg", "employer_website": "http://www.bain.com", "employer_company_type": "Consulting", "job_publisher": "Bain & Company", "job_employment_type": "FULLTIME", "job_title": "Expert Senior Manager, Machine Learning Engineer", "job_apply_link": "https://www.bain.com/careers/find-a-role/position/?jobid=74009", "job_apply_is_direct": true, "job_apply_quality_score": 0.9088, "apply_options": [{"publisher": "Bain & Company", "apply_link": "https://www.bain.com/careers/find-a-role/position/?jobid=74009", "is_direct": true}, {"publisher": "LinkedIn", "apply_link": "https://www.linkedin.com/jobs/view/expert-senior-manager-machine-learning-engineer-at-bain-company-3644957593", "is_direct": false}, {"publisher": "JobServe", "apply_link": "https://www.jobserve.com/us/en/extjob/EXPERT-SENIOR-MANAGER-MACHINE-LEARNING-ENGINEER-in-Seattle-WA-Washington-USA-E73B660594368EC908/", "is_direct": false}], "job_description": "WHAT MAKES US A GREAT PLACE TO WORK\n\nWe are proud to be consistently recognized as one of the world's best places to work, a champion of diversity and a model of social responsibility. We are a Glassdoor Best Place to Work and we have maintained a spot in the top four since its founding in 2009. We believe that diversity, inclusion and collaboration are key to building extraordinary teams. We hire people with exceptional talents, abilities and potential, then create an environment where you can become the best version of yourself and thrive both professionally and personally.\n\nWHO YOU\u2019LL WORK WITH\n\nWorking alongside our generalist consultants, Bain's Advanced Analytics Group (AAG) helps clients across industries solve their biggest problems using our expertise in data science, customer insights, statistics, machine learning, data management, supply chain analytics and data engineering. Stationed in our global offices, AAG team members hold advanced degrees in computer science, engineering, AI, data science, physics, statistics, mathematics, and other quantitative disciplines, with backgrounds in a variety of fields including tech, data science, marketing analytics and academia.\n\nWHAT YOU\u2019LL DO\n\nAs a member of the growing Data Science and Machine Learning (ML) Engineering team in Bain\u2019s Advanced Analytics Group, you will:\n\u2022 Collaborate closely with and influence business consulting staff and leaders as part of multi-disciplinary teams to assess opportunities and develop data-driven solutions for Bain clients across a variety of sectors\n\u2022 Translate business objectives into data and analytics solutions and, translate results into business insights using appropriate data engineering and data science applications\n\u2022 Partner closely with other engineering and product specialists at Bain to support development of innovative analytics solutions and products\n\u2022 Transform existing prototype code into optimized scalable, production-grade software\n\u2022 Manage the development of re-usable frameworks, models and components\n\u2022 Drive best practices in machine learning engineering and MLOps\n\u2022 Develop relationships with external data and analytics vendors\n\u2022 Provide thought championing in state-of-the-art machine-learning techniques\n\u2022 Develop, deploy and support industry-leading machine learning solutions, aimed at solving client problems across industry verticals and business functions\n\u2022 Act as Professional Development Advisor to a team of 3-5 machine learning engineers\n\u2022 Support AAG leadership in extending and growing our machine learning, engineering and analytics capabilities\n\u2022 Help develop Advanced Analytics intellectual property and identify areas of new opportunity for data science and analytics for Bain and its clients\n\u2022 Travel is required (30%)\n\u2022 Consideration will be given to individuals with a specialization in NLP or Computer Vision\n\nABOUT YOU\n\u2022 Advanced Degree in a quantitative discipline such as Computer Science, Engineering, Physics, Statistics, Applied Mathematics, etc.\n\u2022 10+ years of software engineering, analytics development or machine learning engineering experience\n\u2022 3+ years of experience managing data scientists and ML engineers\n\u2022 Strong understanding of fundamental computer science concepts, software design best practices, software development lifecycle and common machine learning design patterns\n\u2022 Solid understanding of foundational machine learning concepts and algorithms\n\u2022 Broad experience deploying production-grade machine learning solutions on-premise or in the cloud\n\u2022 Expert knowledge of Python programming and machine learning frameworks (Scikit-learn, TensorFlow, Keras, PyTorch, etc.)\n\u2022 Experience implementing ML automation, MLOps (scalable development to deployment of complex data science workflows) and associated tools (e.g. MLflow, Kubeflow)\n\u2022 Experience working in accordance with DevSecOps principles, and familiarity with industry deployment best practices using CI/CD tools and infrastructure as code (e.g., Docker, Kubernetes, Terraform)\n\u2022 Extensive experience in at least one cloud platform (e.g. AWS, GCP, Azure) and associated machine learning services, e.g. Amazon SageMaker, Azure ML, Databricks\n\u2022 Familiarity with Agile software development practices\n\u2022 Strong interpersonal and communication skills, including the ability to explain and discuss machine learning concepts with colleagues and clients\n\u2022 Ability to collaborate with people at all levels and with multi-office/region teams\n\u2022 Ability to work without supervision and juggle priorities to thrive in a fast-paced and ambiguous environment, while also collaborating as part of a team in complex situations\n\nADDITIONAL SKILLS\n\u2022 Proficiency with core techniques of linear algebra (as relevant for implementation of ML models) and common optimization algorithms\n\u2022 Experience using distributed computing engines, e.g. Dask, Ray, Spark\n\u2022 Experience using big data technologies and distributed computing engines, e.g. HDFS, Spark, Kafka, Cassandra, Solr, Dask\n\nABOUT US\n\nBain & Company is a global consultancy that helps the world\u2019s most ambitious change makers define the future.\n\nAcross 64 cities in 39 countries, we work alongside our clients as one team with a shared ambition to achieve extraordinary results, outperform the competition, and redefine industries. We complement our tailored, integrated expertise with a vibrant ecosystem of digital innovators to deliver better, faster, and more enduring outcomes. Our 10-year commitment to invest more than $1 billion in pro bono services brings our talent, expertise, and insight to organizations tackling today\u2019s urgent challenges in education, racial equity, social justice, economic development, and the environment. We earned a gold rating from EcoVadis, the leading platform for environmental, social, and ethical performance ratings for global supply chains, putting us in the top 2% of all companies. Since our founding in 1973, we have measured our success by the success of our clients, and we proudly maintain the highest level of client advocacy in the industry.\n\nU.S. Compensation and Benefit Information:\n\nCompensation for this role includes base salary, annual discretionary performance bonus, 401(k) plan with an annual employer contribution based on years of service and Bain\u2019s best in class benefits package (details listed below).\n\nSome local governments in the United States require a good-faith, reasonable salary range be included in job postings for open roles. The estimated annualized compensation for this role is as follows:\n\nIn New York City, the good-faith, reasonable annualized full-time salary range for this role is between $260,500 - $313,000; placement within this range will vary based on several factors including, but not limited to experience, education, licensure/certifications, training and skill level\n\nIn California state, the good-faith, reasonable annualized full-time salary range for this role is between $260,500 - $313,000; placement within this range will vary based on several factors including, but not limited to experience, education, licensure/certifications, training and skill level\n\nIn Washington state, the good-faith, reasonable annualized full-time salary range for this role is between $260,500 - $313,000; placement within this range will vary based on several factors including, but not limited to experience, education, licensure/certifications, training and skill level\n\nFor all other U.S. locations, the good-faith, reasonable annualized full-time salary range for this role is commensurate with competitive geographic market rates for this role and will vary based on several factors including, but not limited to experience, education, licensure/certifications, training and skill level\n\nAnnual discretionary performance bonus\n\nThis role may also be eligible for other elements of discretionary compensation\n\n4.5% 401(k) company contribution, which increases after 3 years of service and is 100% vested upon start date\n\nBain & Company's comprehensive U.S. benefits and wellness program is designed to help employees achieve personal independence, protection and stability in the areas most important to you and your family.", "job_is_remote": false, "job_posted_at_timestamp": 1681689600, "job_posted_at_datetime_utc": "2023-04-17T00:00:00.000Z", "job_city": "Seattle", "job_state": "WA", "job_country": "US", "job_latitude": 47.620514, "job_longitude": -122.349304, "job_benefits": ["retirement_savings", "health_insurance"], "job_google_link": "https://www.google.com/search?gl=us&hl=en&rciv=jb&q=mlops+expert&start=10&ibp=htl;jobs#fpstate=tldetail&htivrt=jobs&htiq=mlops+expert&htidocid=PzdYiJ3p4zHrVCKmAAAAAA%3D%3D", "job_offer_expiration_datetime_utc": null, "job_offer_expiration_timestamp": null, "job_required_experience": {"no_experience_required": false, "required_experience_in_months": 36, "experience_mentioned": true, "experience_preferred": false}, "job_required_skills": null, "job_required_education": {"postgraduate_degree": false, "professional_certification": false, "high_school": false, "associates_degree": false, "bachelors_degree": false, "degree_mentioned": true, "degree_preferred": true, "professional_certification_mentioned": true}, "job_experience_in_place_of_education": false, "job_min_salary": null, "job_max_salary": null, "job_salary_currency": null, "job_salary_period": null, "job_highlights": {"Qualifications": ["Advanced Degree in a quantitative discipline such as Computer Science, Engineering, Physics, Statistics, Applied Mathematics, etc", "10+ years of software engineering, analytics development or machine learning engineering experience", "3+ years of experience managing data scientists and ML engineers", "Strong understanding of fundamental computer science concepts, software design best practices, software development lifecycle and common machine learning design patterns", "Solid understanding of foundational machine learning concepts and algorithms", "Broad experience deploying production-grade machine learning solutions on-premise or in the cloud", "Expert knowledge of Python programming and machine learning frameworks (Scikit-learn, TensorFlow, Keras, PyTorch, etc.)", "Experience implementing ML automation, MLOps (scalable development to deployment of complex data science workflows) and associated tools (e.g. MLflow, Kubeflow)", "Experience working in accordance with DevSecOps principles, and familiarity with industry deployment best practices using CI/CD tools and infrastructure as code (e.g., Docker, Kubernetes, Terraform)", "Extensive experience in at least one cloud platform (e.g", "AWS, GCP, Azure) and associated machine learning services, e.g. Amazon SageMaker, Azure ML, Databricks", "Familiarity with Agile software development practices", "Strong interpersonal and communication skills, including the ability to explain and discuss machine learning concepts with colleagues and clients", "Ability to collaborate with people at all levels and with multi-office/region teams", "Ability to work without supervision and juggle priorities to thrive in a fast-paced and ambiguous environment, while also collaborating as part of a team in complex situations", "Proficiency with core techniques of linear algebra (as relevant for implementation of ML models) and common optimization algorithms", "Experience using big data technologies and distributed computing engines, e.g. HDFS, Spark, Kafka, Cassandra, Solr, Dask"], "Responsibilities": ["As a member of the growing Data Science and Machine Learning (ML) Engineering team in Bain\u2019s Advanced Analytics Group, you will:", "Collaborate closely with and influence business consulting staff and leaders as part of multi-disciplinary teams to assess opportunities and develop data-driven solutions for Bain clients across a variety of sectors", "Translate business objectives into data and analytics solutions and, translate results into business insights using appropriate data engineering and data science applications", "Partner closely with other engineering and product specialists at Bain to support development of innovative analytics solutions and products", "Transform existing prototype code into optimized scalable, production-grade software", "Manage the development of re-usable frameworks, models and components", "Drive best practices in machine learning engineering and MLOps", "Develop relationships with external data and analytics vendors", "Provide thought championing in state-of-the-art machine-learning techniques", "Develop, deploy and support industry-leading machine learning solutions, aimed at solving client problems across industry verticals and business functions", "Act as Professional Development Advisor to a team of 3-5 machine learning engineers", "Support AAG leadership in extending and growing our machine learning, engineering and analytics capabilities", "Help develop Advanced Analytics intellectual property and identify areas of new opportunity for data science and analytics for Bain and its clients", "Travel is required (30%)"], "Benefits": ["Compensation for this role includes base salary, annual discretionary performance bonus, 401(k) plan with an annual employer contribution based on years of service and Bain\u2019s best in class benefits package (details listed below)", "Some local governments in the United States require a good-faith, reasonable salary range be included in job postings for open roles", "In New York City, the good-faith, reasonable annualized full-time salary range for this role is between $260,500 - $313,000; placement within this range will vary based on several factors including, but not limited to experience, education, licensure/certifications, training and skill level", "For all other U.S. locations, the good-faith, reasonable annualized full-time salary range for this role is commensurate with competitive geographic market rates for this role and will vary based on several factors including, but not limited to experience, education, licensure/certifications, training and skill level", "This role may also be eligible for other elements of discretionary compensation", "4.5% 401(k) company contribution, which increases after 3 years of service and is 100% vested upon start date", "Bain & Company's comprehensive U.S. benefits and wellness program is designed to help employees achieve personal independence, protection and stability in the areas most important to you and your family"]}, "job_job_title": "Senior manager", "job_posting_language": "en", "job_onet_soc": "15111100", "job_onet_job_zone": "5", "job_naics_code": "541613", "job_naics_name": "Marketing Consulting Services"}