{"job_id": "Sg5KVvKeLN5s0ud-AAAAAA==", "employer_name": "Deloitte", "employer_logo": "https://upload.wikimedia.org/wikipedia/commons/thumb/5/56/Deloitte.svg/1200px-Deloitte.svg.png", "employer_website": "http://www.deloitte.com", "employer_company_type": "Consulting", "job_publisher": "Adzuna", "job_employment_type": "FULLTIME", "job_title": "AI & Data - Banking, Specialist Leader", "job_apply_link": "https://www.adzuna.com/details/4601785517", "job_apply_is_direct": false, "job_apply_quality_score": 0.5403, "apply_options": [{"publisher": "Adzuna", "apply_link": "https://www.adzuna.com/details/4601785517", "is_direct": false}], "job_description": "Position Summary\n\nThe Team\n\nAI & Data is an integrated team of data and AI technologists working across Operate, AI, and Engineering. We serve as a trusted advisor and managed service provider bringing a mix of capability and capacity across data modernization, data ops, AI, and ML. Through our unrivaled breadth and depth of services across every major industry and domain, we help our clients run smarter, faster, and more efficiently. With Deloitte's AI & Data, our clients have the support they need to continuously develop, innovate, automate, scale, and operate in service of organizational performance and growth.\n\nAI & Data practitioners work with our clients to:\n\u2022 Design and modernize large scale data and analytics programs that promote organizational intelligence, provide embedded capacity, and implement as-a-service based subscription models at scale\n\u2022 Enable day-to-day operations, maintenance and ongoing enhancements of their data platforms and applications as well as managing and governing the underlying data leveraging standardized, automated and AI enabled Data Ops capabilities\n\u2022 Mature their AI and Analytics journey with fluid capacity and flexible capability of AI and Analytics experts complemented with experience hardened assets and curated data sets to experiment with AI and scale their AI and Analytics ambitions\n\nRecruiting for this position will end on 3/20/2024\n\nWork You'll Do\n\nOur Data & Cloud Operations practitioners provide end-to-end data services and capabilities required to operate, maintain, and enhance client data ecosystems. Creating integrated, trusted, and high functioning platforms and enabling intelligent operations.\n\nA Specialist Leader in our AI & Data Team serves as a senior advisor for the firm and for our clients by leveraging deep subject matter knowledge to manage and deliver large, complex client engagements. that identify, design, and implement creative business and technology solutions for large cross industry clients. They focus primarily on client service delivery but also drive sales activities and thought leadership in their area of expertise.\n\nA Specialist Leader contributes to the firm's growth and development in a variety of ways, including:\n\u2022 Engagement Management/Delivery: Bring the breadth and depth of Deloitte's capabilities and talent to deliver technical solutions which allow clients to achieve their business strategy. Present technical solution alternatives and recommendations aligned with the client's business and technology objectives. Participate in project estimating, planning, contracting and staffing activities. Manage technical and/or functional teams to design, build, test and implement solutions. Anticipate, raise, and resolve issues which pose risk to the project. Monitor progress and quality. Track and report status.\n\u2022 Client Management: Advise client business and technology leaders. Manage day to day interactions with executive clients and sponsors.\n\u2022 Business Development: Participate in sales pursuits as a pursuit lead or subject matter advisor. Participate in the oral presentation of the proposal to highlight relevant experiences that position Deloitte as the preferred supplier. Develop and maintain relationships with top decision makers at clients to understand their needs and identify opportunities to help grow the account.\n\u2022 Eminence: Lead go-to-market and internal initiatives which drive growth of the practice, drive efficiency and profitability, improve quality, and increase the knowledge of our staff. Author or co-author articles, whitepapers, or presentations. Speak at conferences, universities, or other forums to promote Deloitte's brand.\n\u2022 People Development: Perform role of mentor and coach to help others achieve their career objectives. Actively participate in community, recruiting and onboarding activities. Develop staffing plans and screen candidates for positions on projects. Provide leadership and support for staff on projects and in local offices. Perform regular check-ins with team members and people for which you coach as a part of the performance management process.\n\nQualifications\n\nRequired:\n\u2022 8+ years experience with relevant technology consulting experience to include: enterprise-scale technical experience with cloud and hybrid infrastructures for data and analytics, architecture designs, migrations, and technology management\n\u2022 4+ years of Techno-functional experience with Financial Services-Banking & Capital Markets Industry\n\u2022 3+ years experience leading, managing and delivering technology engagements end-to-end with resources in multiple locations\n\u2022 3+ years experience with large-scale application portfolios in enterprise-wide environments (including migration of on-premise workloads to the cloud)\n\u2022 5+ years experience with at least one of the following cloud platforms: Microsoft Azure, Amazon Web Service (AWS) and/or Google Cloud Platform (GCP)\n\u2022 Bachelor's Degree\n\u2022 Ability to travel up to 50% on average, based on the work you do and the clients and industries/sectors you serve\n\u2022 Limited immigration sponsorship may be available\n\nPreferred:\n\u2022 Experience in a sales capacity to include: shaping Executive-level conversations and providing strategic advice, including selling and solutioning deals, with a proven track record in sales origination\n\u2022 Understanding of the security aspects of cloud architecture\n\u2022 Experience in all aspects of data governance and data engineering\n\u2022 Ability to orchestrate, lead, and influence virtual teams, ensuring successful implementation of customer projects\n\u2022 Presentation skills with a high degree of comfort with both large and small audiences\n\u2022 Demonstrated experience driving both the sales cycle by taking the lead in framing out client opportunities and leading the pursuit team to create the proposal content for client discussions\n\u2022 Strong problem solving and troubleshooting skills with the ability to exercise mature judgment\n\u2022 Demonstrated experience with management and delivery of multiple strategic engagements for large global organization\n\nThe wage range for this role takes into account the wide range of factors that are considered in making compensation decisions including but not limited to skill sets; experience and training; licensure and certifications; and other business and organizational needs. The disclosed range estimate has not been adjusted for the applicable geographic differential associated with the location at which the position may be filled. At Deloitte, it is not typical for an individual to be hired at or near the top of the range for their role and compensation decisions are dependent on the facts and circumstances of each case. A reasonable estimate of the current range is $175,725 - $292,875.\n\nYou may also be eligible to participate in a discretionary annual incentive program, subject to the rules governing the program, whereby an award, if any, depends on various factors, including, without limitation, individual and organizational performance.\n\nAI&DE24\n\nRecruiting tips\n\nFrom developing a stand out resume to putting your best foot forward in the interview, we want you to feel prepared and confident as you explore opportunities at Deloitte. Check out recruiting tips from Deloitte recruiters.\n\nBenefits\n\nAt Deloitte, we know that great people make a great organization. We value our people and offer employees a broad range of benefits. Learn more about what working at Deloitte can mean for you.\n\nOur people and culture\n\nOur diverse, equitable, and inclusive culture empowers our people to be who they are, contribute their unique perspectives, and make a difference individually and collectively. It enables us to leverage different ideas and perspectives, and bring more creativity and innovation to help solve our client most complex challenges. This makes Deloitte one of the most rewarding places to work. Learn more about our inclusive culture.\n\nOur purpose\n\nDeloitte's purpose is to make an impact that matters for our clients, our people, and in our communities. We are creating trust and confidence in a more equitable society. At Deloitte, purpose is synonymous with how we work every day. It defines who we are. We are focusing our collective efforts to advance sustainability, equity, and trust that come to life through our core commitments. Learn more about Deloitte's purpose, commitments, and impact.\n\nProfessional development\n\nFrom entry-level employees to senior leaders, we believe there's always room to learn. We offer opportunities to build new skills, take on leadership opportunities and connect and grow through mentorship. From on-the-job learning experiences to formal development programs, our professionals have a variety of opportunities to continue to grow throughout their career.\n\nAs used in this posting, \"Deloitte\" means Deloitte Consulting LLP, a subsidiary of Deloitte LLP. Please see www.deloitte.com/us/about for a detailed description of the legal structure of Deloitte LLP and its subsidiaries.\n\nAll qualified applicants will receive consideration for employment without regard to race, color, religion, sex, sexual orientation, gender identity, national origin, age, disability or protected veteran status, or any other legally protected basis, in accordance with applicable law.\n\nDeloitte will consider for employment all qualified applicants, including those with criminal histories, in a manner consistent with the requirements of applicable state and local laws, including the City of Los Angeles' Fair Chance Initiative for Hiring Ordinance. See notices of various ban-the-box laws where available.\n\nRequisition code: 175745", "job_is_remote": false, "job_posted_at_timestamp": 1709838000, "job_posted_at_datetime_utc": "2024-03-07T19:00:00.000Z", "job_city": "Hapeville", "job_state": "GA", "job_country": "US", "job_latitude": 33.66011, "job_longitude": -84.4102, "job_benefits": null, "job_google_link": "https://www.google.com/search?gl=us&hl=en&rciv=jb&q=ai+specialist&start=50&ibp=htl;jobs#fpstate=tldetail&htivrt=jobs&htiq=ai+specialist&htidocid=Sg5KVvKeLN5s0ud-AAAAAA%3D%3D", "job_offer_expiration_datetime_utc": "2024-04-01T16:48:01.000Z", "job_offer_expiration_timestamp": 1711990081, "job_required_experience": {"no_experience_required": false, "required_experience_in_months": 96, "experience_mentioned": true, "experience_preferred": false}, "job_required_skills": null, "job_required_education": {"postgraduate_degree": false, "professional_certification": false, "high_school": false, "associates_degree": false, "bachelors_degree": false, "degree_mentioned": true, "degree_preferred": false, "professional_certification_mentioned": true}, "job_experience_in_place_of_education": false, "job_min_salary": null, "job_max_salary": null, "job_salary_currency": null, "job_salary_period": null, "job_highlights": {"Qualifications": ["8+ years experience with relevant technology consulting experience to include: enterprise-scale technical experience with cloud and hybrid infrastructures for data and analytics, architecture designs, migrations, and technology management", "4+ years of Techno-functional experience with Financial Services-Banking & Capital Markets Industry", "3+ years experience leading, managing and delivering technology engagements end-to-end with resources in multiple locations", "3+ years experience with large-scale application portfolios in enterprise-wide environments (including migration of on-premise workloads to the cloud)", "5+ years experience with at least one of the following cloud platforms: Microsoft Azure, Amazon Web Service (AWS) and/or Google Cloud Platform (GCP)", "Bachelor's Degree", "Ability to travel up to 50% on average, based on the work you do and the clients and industries/sectors you serve", "Limited immigration sponsorship may be available"], "Responsibilities": ["Design and modernize large scale data and analytics programs that promote organizational intelligence, provide embedded capacity, and implement as-a-service based subscription models at scale", "Enable day-to-day operations, maintenance and ongoing enhancements of their data platforms and applications as well as managing and governing the underlying data leveraging standardized, automated and AI enabled Data Ops capabilities", "Mature their AI and Analytics journey with fluid capacity and flexible capability of AI and Analytics experts complemented with experience hardened assets and curated data sets to experiment with AI and scale their AI and Analytics ambitions", "Our Data & Cloud Operations practitioners provide end-to-end data services and capabilities required to operate, maintain, and enhance client data ecosystems", "that identify, design, and implement creative business and technology solutions for large cross industry clients", "They focus primarily on client service delivery but also drive sales activities and thought leadership in their area of expertise", "A Specialist Leader contributes to the firm's growth and development in a variety of ways, including:", "Engagement Management/Delivery: Bring the breadth and depth of Deloitte's capabilities and talent to deliver technical solutions which allow clients to achieve their business strategy", "Present technical solution alternatives and recommendations aligned with the client's business and technology objectives", "Participate in project estimating, planning, contracting and staffing activities", "Manage technical and/or functional teams to design, build, test and implement solutions", "Anticipate, raise, and resolve issues which pose risk to the project", "Monitor progress and quality", "Track and report status", "Client Management: Advise client business and technology leaders", "Manage day to day interactions with executive clients and sponsors", "Business Development: Participate in sales pursuits as a pursuit lead or subject matter advisor", "Participate in the oral presentation of the proposal to highlight relevant experiences that position Deloitte as the preferred supplier", "Develop and maintain relationships with top decision makers at clients to understand their needs and identify opportunities to help grow the account", "Eminence: Lead go-to-market and internal initiatives which drive growth of the practice, drive efficiency and profitability, improve quality, and increase the knowledge of our staff", "Author or co-author articles, whitepapers, or presentations", "Speak at conferences, universities, or other forums to promote Deloitte's brand", "People Development: Perform role of mentor and coach to help others achieve their career objectives", "Actively participate in community, recruiting and onboarding activities", "Develop staffing plans and screen candidates for positions on projects", "Provide leadership and support for staff on projects and in local offices", "Perform regular check-ins with team members and people for which you coach as a part of the performance management process"], "Benefits": ["A reasonable estimate of the current range is $175,725 - $292,875", "You may also be eligible to participate in a discretionary annual incentive program, subject to the rules governing the program, whereby an award, if any, depends on various factors, including, without limitation, individual and organizational performance"]}, "job_job_title": null, "job_posting_language": "en", "job_onet_soc": "15111100", "job_onet_job_zone": "5", "job_naics_code": "541613", "job_naics_name": "Marketing Consulting Services"}