{"job_id": "FJp6JCAi27fL2X56AAAAAA==", "employer_name": "Stored Value Solutions (SVS)", "employer_logo": "https://media.licdn.com/dms/image/C4E0BAQGGcqGMk0RoDA/company-logo_100_100/0/1630587163066/stored_value_solutions_svs_logo?e=2147483647&v=beta&t=f3H5VUVKDHKav5AhrfIFVX8kk9nJY3pjMeZoeJC8w0Q", "employer_website": "http://www.storedvalue.com", "employer_company_type": null, "job_publisher": "LinkedIn", "job_employment_type": "FULLTIME", "job_title": "Manager, B2B Brand Partnerships", "job_apply_link": "https://www.linkedin.com/jobs/view/manager-b2b-brand-partnerships-at-stored-value-solutions-svs-3852397623", "job_apply_is_direct": false, "job_apply_quality_score": 0.6366, "apply_options": [{"publisher": "LinkedIn", "apply_link": "https://www.linkedin.com/jobs/view/manager-b2b-brand-partnerships-at-stored-value-solutions-svs-3852397623", "is_direct": false}, {"publisher": "Jobright AI", "apply_link": "https://jobright.ai/jobs/info/65cda220719bd6b3f279486c", "is_direct": false}], "job_description": "Stored Value Solutions (SVS), a subsidiary of FLEETCOR Technologies, Inc., is a world leader in gift cards whose mission is to increase the value and impact of our clients' gift card programs. We are a pioneer in the industry with 25+ years of experience and originate processing in more than 50 countries and more than 45 currencies. SVS serves more than 25% of the top 250 Global Retailers and 35 of the Top 100 US Retailers.\n\nSVS is focuses exclusively on discovering and delivering better ways for retailers and restaurants to maximize revenue from their stored value programs. Our continued investment in people, technology, operations, and new products directly benefits our clients by delivering the latest technology, the highest level of service, and the most effective ways to engage and delight consumers across multiple channels.\n\nWe never stop trying to find ways to make stored value more attractive, more fun, more engaging, easier to buy, easier to use, more rewarding to give, and more iron-clad when it comes to preventing fraud. In fact, over the past 5 years, we have invested millions of dollars in new solutions for our clients. Our chief focus in these investments has been in the areas that have the greatest impact on our clients: Our Technology, Our Analytics, Our Fraud Prevention Solutions, and \u2013 most importantly \u2013 Our People.\n\nThe Manager, B2B Brand Partnerships works with the Sales and Implementation Team to support Card Brand and Customers with existing and new business opportunities. They also ensure quality service to assigned Brands by providing ongoing support, analyzing account and market trends, and identifying additional revenue opportunities. Collaborating closely with the SVP of Solutions B2B & Director of Solutions B2B, the Manager, B2B Brand Partnerships handles day-to-day brand and client requests as needed.\n\nResponsibilities:\n\u2022 Build and maintain relationships with Brands, continually adding value and services to their existing accounts while increasing revenue and gross margin.\n\u2022 Oversee the implementation process, ensuring the process is smooth and improvements are made in areas identified.\n\u2022 Increase the quality of service and support we offer our Brands, maintaining continuous improvement feedback loops to the Team. team\n\u2022 Develop and maintain best practice documentation for all relevant activities.\n\u2022 Maintain and improve our Brand\u2019s levels of service satisfaction. of services\n\u2022 Works alongside the Support team to develop and maintain the multi-year strategic account plan for each assigned Brand.\n\u2022 Facilitates regular progress meetings with key Brand stakeholders and Support Partnerships Team to validate our progress and plans.\n\u2022 Responsible for assisting the Sales team with revenue growth, demos of products, and meeting profit goals for Brands in the portfolio.\n\u2022 Performs trends and performance analysis, providing guidance based on data driven conclusions.\n\u2022 Creates a quarterly business review cadence to track our progress on aligned focus areas/work streams and other interactions.\n\u2022 Responsible for managing promotional calendars for brands who opt into program.\n\u2022 Marketing support and inventory management\n\u2022 Demo portal to clients\n\nQualifications:\n\u2022 Bachelor's degree or other post-secondary certification in sales, marketing or a related field\n\u2022 3+ years of demonstrated expertise working with large customers\n\u2022 3+ years of gift card management (brand or buyer side)\n\u2022 Excellent, proven leadership skills\n\u2022 Comfortable using web-based tools to establish team processes and report on efficiency\n\u2022 Experience with expanding sales and service organizations within B2C or B2B businesses\n\u2022 Self-motivated, proactive team player with innovative ideas to inspire customer loyalty and adoption\n\u2022 Strong customer relationship, interpersonal and communications skills\n\u2022 Experience building internal and external relationships\n\u2022 Excellent analytical, problem-solving, and critical thinking skills\n\u2022 Strong results orientation and desire to learn\n\u2022 Excellent time-management and organizational skills, attention to detail and ability to meet deadlines and deal with multiple concurrent tasks\n\u2022 Comfortable with interacting with senior leadership team.\n\u2022 Proficiency in Microsoft Office tools: PowerPoint, Excel, CRM, Office 365, etc.\n\u2022 Other duties as assigned", "job_is_remote": true, "job_posted_at_timestamp": 1710357311, "job_posted_at_datetime_utc": "2024-03-13T19:15:11.000Z", "job_city": null, "job_state": null, "job_country": "US", "job_latitude": 37.09024, "job_longitude": -95.71289, "job_benefits": null, "job_google_link": "https://www.google.com/search?gl=us&hl=en&rciv=jb&q=manager+of+brand+partnerships&start=20&ibp=htl;jobs#fpstate=tldetail&htivrt=jobs&htiq=manager+of+brand+partnerships&htidocid=FJp6JCAi27fL2X56AAAAAA%3D%3D", "job_offer_expiration_datetime_utc": "2024-04-12T19:15:10.000Z", "job_offer_expiration_timestamp": 1712949310, "job_required_experience": {"no_experience_required": false, "required_experience_in_months": 300, "experience_mentioned": true, "experience_preferred": false}, "job_required_skills": null, "job_required_education": {"postgraduate_degree": false, "professional_certification": false, "high_school": false, "associates_degree": false, "bachelors_degree": true, "degree_mentioned": true, "degree_preferred": false, "professional_certification_mentioned": true}, "job_experience_in_place_of_education": false, "job_min_salary": null, "job_max_salary": null, "job_salary_currency": null, "job_salary_period": null, "job_highlights": {"Qualifications": ["Bachelor's degree or other post-secondary certification in sales, marketing or a related field", "3+ years of demonstrated expertise working with large customers", "3+ years of gift card management (brand or buyer side)", "Excellent, proven leadership skills", "Comfortable using web-based tools to establish team processes and report on efficiency", "Experience with expanding sales and service organizations within B2C or B2B businesses", "Self-motivated, proactive team player with innovative ideas to inspire customer loyalty and adoption", "Strong customer relationship, interpersonal and communications skills", "Experience building internal and external relationships", "Excellent analytical, problem-solving, and critical thinking skills", "Strong results orientation and desire to learn", "Excellent time-management and organizational skills, attention to detail and ability to meet deadlines and deal with multiple concurrent tasks", "Comfortable with interacting with senior leadership team", "Proficiency in Microsoft Office tools: PowerPoint, Excel, CRM, Office 365, etc", "Other duties as assigned"], "Responsibilities": ["They also ensure quality service to assigned Brands by providing ongoing support, analyzing account and market trends, and identifying additional revenue opportunities", "Collaborating closely with the SVP of Solutions B2B & Director of Solutions B2B, the Manager, B2B Brand Partnerships handles day-to-day brand and client requests as needed", "Build and maintain relationships with Brands, continually adding value and services to their existing accounts while increasing revenue and gross margin", "Oversee the implementation process, ensuring the process is smooth and improvements are made in areas identified", "Increase the quality of service and support we offer our Brands, maintaining continuous improvement feedback loops to the Team. team", "Develop and maintain best practice documentation for all relevant activities", "Maintain and improve our Brand\u2019s levels of service satisfaction. of services", "Works alongside the Support team to develop and maintain the multi-year strategic account plan for each assigned Brand", "Facilitates regular progress meetings with key Brand stakeholders and Support Partnerships Team to validate our progress and plans", "Responsible for assisting the Sales team with revenue growth, demos of products, and meeting profit goals for Brands in the portfolio", "Performs trends and performance analysis, providing guidance based on data driven conclusions", "Creates a quarterly business review cadence to track our progress on aligned focus areas/work streams and other interactions", "Responsible for managing promotional calendars for brands who opt into program", "Marketing support and inventory management", "Demo portal to clients"]}, "job_job_title": "Manager", "job_posting_language": "en", "job_onet_soc": "11202100", "job_onet_job_zone": "4"}