{"job_id": "l00Fukyl17NHVQ6mAAAAAA==", "employer_name": "Atria Senior Living", "employer_logo": "https://pbs.twimg.com/profile_images/963872969423437824/P76EomjW_400x400.jpg", "employer_website": "http://www.atriaseniorliving.com", "employer_company_type": "Health Care", "job_publisher": "Atria Senior Living Careers", "job_employment_type": "FULLTIME", "job_title": "Community Sales Director", "job_apply_link": "https://app-careers.azurewebsites.net/careers/community-sales-director-4/", "job_apply_is_direct": false, "job_apply_quality_score": 0.4708, "apply_options": [{"publisher": "Atria Senior Living Careers", "apply_link": "https://app-careers.azurewebsites.net/careers/community-sales-director-4/", "is_direct": false}], "job_description": "Responsibilities\n\nThe Community Sales Director (\u201cCSD\u201d) is responsible for achieving and exceeding the community\u2019s monthly and quarterly revenue/sales targets; developing the community\u2019s internal and external marketing; and building the community\u2019s strategic relationships with various referral sources to produce highly qualified inquiries. Along with other Atria employees, the CSD promotes the leasing and marketing success of the community.\n\u2022 Spend over 50% of time outside of the community generating inquires to meet and exceed monthly and quarterly revenue targets.\n\u2022 Generate inquiries and move-ins from targeted referral sources by developing and maintaining relationships outside of the community, including but not limited to health care providers, hospitals, rehabilitation facilities, retirement and estate planners, real estate service providers, senior organizations, appropriate special interest groups, local civic groups/leaders and other community contacts.\n\u2022 Collaborate with Executive Director (\u201cED\u201d) to forecast move-ins accurately.\n\u2022 Facilitate training and continuous in-servicing for all community staff that may field an inquiry call or conduct a walk-in or scheduled tour.\n\u2022 Ensure that responses to inquiries are handled properly, timely and with appropriate follow-up and demonstrate sense of urgency regarding occupancy rates.\n\u2022 Position ED or Resident Services Director (\u201cRSD\u201d) as local experts on aging through facilitating introductions, joint sales calls, and strategic sales & marketing events.\n\u2022 Develop and maintain strong relationships with national and local referral agencies.\n\u2022 Quickly engage new inquiries on the phone and in person with the objective of helping guide them towards a sale.\n\u2022 Follow-up with in-home visits to potential residents or at locations of influencer(s).\n\u2022 Build relationships with inquiries and potential residents through discovery, listening with empathy and asking follow-up questions.\n\u2022 Accurately maintain the community\u2019s Customer Relationship Management database by collecting and entering information about new inquiries and creating prompt, creative, and personal next steps after each interaction.\n\u2022 Curate extraordinary customer experiences through home visits, hospital/rehab visits, highly personalized tours, and personal follow ups.\n\u2022 Work with the ED to develop and implement a rolling 90-day Sales and Marketing Plan.\n\u2022 Manage and monitor community marketing budget. Operate within established budgetary guidelines.\n\u2022 Help ED recognize first impressions and rent-ready apartment challenges/opportunities.\n\u2022 Ensure smooth hand-off of committed customers to ED, RSD and Community Business Director for care assessment and lease due diligence.\n\u2022 Monitor the market and the competition of other senior living communities outside of Atria.\n\u2022 Create, market and implement engaging events for inquiries and local influencers, both inside and outside of the Community.\n\u2022 Serve as a resource by educating and providing information to those who advise seniors on health and alternative living options.\n\u2022 May perform other duties as needed and/or assigned.\nQualifications\n\u2022 One (1) or more years of related sales experience.\n\u2022 Bachelor\u2019s degree from a four year college or university preferred.\n\u2022 Must possess strong customer service skills, basic financial knowledge of revenue and profitability, strong computer and electronic file management skills and strong organizational skills.\n\u2022 Must have the ability to maintain confidentiality\n\u2022 Must be organized, detail-oriented, and able to multi-task.\n\u2022 As dictated by business needs, must be able to work flexible hours, including evenings, weekends, and holidays.\n\u2022 Position requires driving responsibilities (may use Company provided vehicle and/or personal vehicle).\n\u2022 Must possess valid driver\u2019s license.", "job_is_remote": false, "job_posted_at_timestamp": 1694736000, "job_posted_at_datetime_utc": "2023-09-15T00:00:00.000Z", "job_city": "Grass Valley", "job_state": "CA", "job_country": "US", "job_latitude": 39.21906, "job_longitude": -121.06106, "job_benefits": ["retirement_savings"], "job_google_link": "https://www.google.com/search?gl=us&hl=en&rciv=jb&q=sales+director&start=30&ibp=htl;jobs#fpstate=tldetail&htivrt=jobs&htiq=sales+director&htidocid=l00Fukyl17NHVQ6mAAAAAA%3D%3D", "job_offer_expiration_datetime_utc": null, "job_offer_expiration_timestamp": null, "job_required_experience": {"no_experience_required": false, "required_experience_in_months": null, "experience_mentioned": true, "experience_preferred": false}, "job_required_skills": null, "job_required_education": {"postgraduate_degree": false, "professional_certification": false, "high_school": false, "associates_degree": false, "bachelors_degree": false, "degree_mentioned": true, "degree_preferred": false, "professional_certification_mentioned": false}, "job_experience_in_place_of_education": false, "job_min_salary": null, "job_max_salary": null, "job_salary_currency": null, "job_salary_period": null, "job_highlights": {"Qualifications": ["One (1) or more years of related sales experience", "Must possess strong customer service skills, basic financial knowledge of revenue and profitability, strong computer and electronic file management skills and strong organizational skills", "Must have the ability to maintain confidentiality", "Must be organized, detail-oriented, and able to multi-task", "As dictated by business needs, must be able to work flexible hours, including evenings, weekends, and holidays", "Position requires driving responsibilities (may use Company provided vehicle and/or personal vehicle)", "Must possess valid driver\u2019s license"], "Responsibilities": ["The Community Sales Director (\u201cCSD\u201d) is responsible for achieving and exceeding the community\u2019s monthly and quarterly revenue/sales targets; developing the community\u2019s internal and external marketing; and building the community\u2019s strategic relationships with various referral sources to produce highly qualified inquiries", "Generate inquiries and move-ins from targeted referral sources by developing and maintaining relationships outside of the community, including but not limited to health care providers, hospitals, rehabilitation facilities, retirement and estate planners, real estate service providers, senior organizations, appropriate special interest groups, local civic groups/leaders and other community contacts", "Collaborate with Executive Director (\u201cED\u201d) to forecast move-ins accurately", "Facilitate training and continuous in-servicing for all community staff that may field an inquiry call or conduct a walk-in or scheduled tour", "Ensure that responses to inquiries are handled properly, timely and with appropriate follow-up and demonstrate sense of urgency regarding occupancy rates", "Position ED or Resident Services Director (\u201cRSD\u201d) as local experts on aging through facilitating introductions, joint sales calls, and strategic sales & marketing events", "Develop and maintain strong relationships with national and local referral agencies", "Quickly engage new inquiries on the phone and in person with the objective of helping guide them towards a sale", "Follow-up with in-home visits to potential residents or at locations of influencer(s)", "Build relationships with inquiries and potential residents through discovery, listening with empathy and asking follow-up questions", "Accurately maintain the community\u2019s Customer Relationship Management database by collecting and entering information about new inquiries and creating prompt, creative, and personal next steps after each interaction", "Curate extraordinary customer experiences through home visits, hospital/rehab visits, highly personalized tours, and personal follow ups", "Work with the ED to develop and implement a rolling 90-day Sales and Marketing Plan", "Manage and monitor community marketing budget", "Operate within established budgetary guidelines", "Help ED recognize first impressions and rent-ready apartment challenges/opportunities", "Ensure smooth hand-off of committed customers to ED, RSD and Community Business Director for care assessment and lease due diligence", "Monitor the market and the competition of other senior living communities outside of Atria", "Create, market and implement engaging events for inquiries and local influencers, both inside and outside of the Community", "Serve as a resource by educating and providing information to those who advise seniors on health and alternative living options", "May perform other duties as needed and/or assigned"]}, "job_job_title": "Sales director", "job_posting_language": "en", "job_onet_soc": "11202200", "job_onet_job_zone": "4", "job_naics_code": "623", "job_naics_name": "Nursing and Residential Care Facilities"}