{"job_id": "eh70kSzGMQj9prSfAAAAAA==", "employer_name": "Oracle", "employer_logo": "https://upload.wikimedia.org/wikipedia/commons/thumb/5/50/Oracle_logo.svg/2560px-Oracle_logo.svg.png", "employer_website": "http://www.oracle.com", "employer_company_type": "Information", "job_publisher": "Ladders", "job_employment_type": "FULLTIME", "job_title": "Principal Cloud Architect - HPC", "job_apply_link": "https://www.theladders.com/job-listing/principal-cloud-architect-hpc-oracle-oklahoma-city-ok-_v2_-7-3665953146.html", "job_apply_is_direct": false, "job_apply_quality_score": 0.5374, "apply_options": [{"publisher": "Ladders", "apply_link": "https://www.theladders.com/job-listing/principal-cloud-architect-hpc-oracle-oklahoma-city-ok-_v2_-7-3665953146.html", "is_direct": false}, {"publisher": "Learn4Good", "apply_link": "https://www.learn4good.com/jobs/oklahoma-city/oklahoma/info_technology/2992522779/e/", "is_direct": false}], "job_description": "Business Experience: Understand the challenges in working with large customers. 5+ years of pre sales or technical consulting.Passion : Working with top customers/partners: educating, training, designing, and building cloud computing systems for some of the largest and most important organizations in the world.Creativity : Enjoy creating and delivering compelling presentations, product demos, sample solutions, and discussions to drive adoption of Oracle Cloud.High acumen : for assessing, compiling great technical content, and white papers about emerging technologies and industry developments.Collaboration : Enjoy and have experience with internal teams to define the product road map, market positioning, and other program initiatives targeted at specific audiences e.g. developers and IT pros.No Fear: dynamic and creative, and willing to take on any challenge and make a big impact.Connector : The ability to connect technology with measurable business value is critical to a solutions architect.Strategic Thought Leadership : You should also have a demonstrated ability to think strategically about business, products, and technical challenges.Education: Bachelor and/or Masters level degree, ideally in Computer Science, Math or Engineering or other relevant discipline.ResponsibilitiesJob Responsibilities/Top Qualifications:Work with some of the largest Oracle customers to grow business in a pre-sales and technical consulting role.Define new tailored HPC solutions based on business requirementsAs a trusted customer advocate, you will help customers/partners understand best practices around advanced cloud-based solutions, and how to migrate existing workloads to the cloud.Work with top customers/partners to help shape and execute a strategy to develop their next-gen SaaS offerings on the Oracle Cloud.Educate customers of all sizes on the value proposition of Oracle and participate in deep architectural discussions to ensure solutions are designed for successful deployment in the cloud.Conduct training sessions to transfer knowledge to customers considering or already using Oracle.Act as a technical liaison between customers, service engineering teams, and support.Leverage your influencing skills and unmatched enthusiasm to support sales leaders and highly motivated sales consultants and cloud specialists in closing deals with customers.Develop deep expertise in the Oracle Cloud technology offerings as well as broad know-how around how applications and services are constructed using the Oracle Cloud.Lead the efforts to share best-practice knowledge amongst the Oracle Cloud community.You will learn from, collaborate with, and educate some of the brightest technical minds in the industry today across the breadth of enterprise architecture.Help lead and generate excitement and usage of Oracle Cloud services across various customers/partners segments.Ideal candidates will possess the following traits:Technical :Demonstrate a solid understanding of IaaS, Application Development technologies, and networking and security requirements for migrating applications to the cloud.Expertise with designing on premises / Cloud based HPC deployments and Cloud native HPC solutionsScripting capability in one or more languages \u2013 Python, Java, powershell, scripting in Linux environments, Terraform/Ansible.Knowledge of TCP/IP fundamentals, HPC and low latency networking and MPI.Working knowledge of distributed/parallel file systems (Lustre) and storage appliances.Working knowledge of GPUs and GPU applications.Experience with HPC deployment and middleware technologies (Bright Cluster Manager, Altair PBS Pro, SLURM, Torque MOAB).Expertise in a specific vertical like Financial services , Life Sciences, Pharmaceuticals and Digital Media is a plus.Disclaimer:Certain US customer or client-facing roles may be required to comply with applicable requirements, such as immunization and occupational health mandates.Range and benefit information provided in this posting are specific to the stated locations onlyUS: Hiring Range: from $107,000 to $185,200 per annum. May be eligible for equity. Eligible for commission with an estimated pay mix of 70/30.Oracle maintains broad salary ranges for its roles in order to account for variations in knowledge, skills, experience, market conditions and locations, as well as reflect Oracle\u2019s differing products, industries and lines of business.Candidates are typically placed into the range based on the preceding factors as well as internal peer equity.Oracle US offers a comprehensive benefits package which includes the following:Medical, dental, and vision insurance, including expert medical opinionShort term disability and long term disabilityLife insurance and AD&DHealth care and dependent care Flexible Spending AccountsPre-tax commuter and parking benefits401(k) Savings and Investment Plan with company matchPaid time off: Flexible Vacation is provided to all eligible employees assigned to a salaried (non-overtime eligible) position. Accrued Vacation is provided to all other employees eligible for vacation benefits. For employees working at least 35 hours per week, the vacation accrual rate is 13 days annually for the first three years of employment and 18 days annually for subsequent years of employment. Vacation accrual is prorated for employees working between 20 and 34 hours per week. Employees working fewer than 20 hours per week are not eligible for vacation.11 paid holidaysPaid sick leave: 72 hours of paid sick leave upon date of hire. Refreshes each calendar year. Unused balance will carry over each year up to a maximum cap of 112 hours.Paid parental leaveAdoption assistanceEmployee Stock Purchase PlanFinancial planning and group legalVoluntary benefits including auto, homeowner and pet insuranceAbout UsAs a world leader in cloud solutions, Oracle uses tomorrow\u2019s technology to tackle today\u2019s problems. True innovation starts with diverse perspectives and various abilities and backgrounds.When everyone\u2019s voice is heard, we\u2019re inspired to go beyond what\u2019s been done before. It\u2019s why we\u2019re committed to expanding our inclusive workforce that promotes diverse insights and perspectives.We\u2019ve partnered with industry-leaders in almost every sector\u2014and continue to thrive after 40+ years of change by operating with integrity.Oracle careers open the door to global opportunities where work-life balance flourishes. We offer a highly competitive suite of employee benefits designed on the principles of parity and consistency. We put our people first with flexible medical, life insurance and retirement options. We also encourage employees to give back to their communities through our volunteer programs.We\u2019re committed to including people with disabilities at all stages of the employment process. If you require accessibility assistance or accommodation for a disability at any point, let us know by calling +1 888 404 2494, option one.Disclaimer:Oracle is an Equal Employment Opportunity Employer*. All qualified applicants will receive consideration for employment without regard to race, color, religion, sex, national origin, sexual orientation, gender identity, disability and protected veterans\u2019 status, or any other characteristic protected by law. Oracle will consider for employment qualified applicants with arrest and conviction records pursuant to applicable law.* Which includes being a United States Affirmative Action Employer #J-18808-Ljbffr", "job_is_remote": false, "job_posted_at_timestamp": 1710460800, "job_posted_at_datetime_utc": "2024-03-15T00:00:00.000Z", "job_city": "Oklahoma City", "job_state": "OK", "job_country": "US", "job_latitude": 35.46756, "job_longitude": -97.516426, "job_benefits": ["retirement_savings", "dental_coverage", "paid_time_off", "health_insurance"], "job_google_link": "https://www.google.com/search?gl=us&hl=en&rciv=jb&q=cloud+architect&start=40&ibp=htl;jobs#fpstate=tldetail&htivrt=jobs&htiq=cloud+architect&htidocid=eh70kSzGMQj9prSfAAAAAA%3D%3D", "job_offer_expiration_datetime_utc": null, "job_offer_expiration_timestamp": null, "job_required_experience": {"no_experience_required": false, "required_experience_in_months": null, "experience_mentioned": true, "experience_preferred": true}, "job_required_skills": null, "job_required_education": {"postgraduate_degree": false, "professional_certification": false, "high_school": false, "associates_degree": false, "bachelors_degree": false, "degree_mentioned": true, "degree_preferred": false, "professional_certification_mentioned": false}, "job_experience_in_place_of_education": false, "job_min_salary": null, "job_max_salary": null, "job_salary_currency": null, "job_salary_period": null, "job_highlights": {"Qualifications": ["Business Experience: Understand the challenges in working with large customers. 5+ years of pre sales or technical consulting", "Connector : The ability to connect technology with measurable business value is critical to a solutions architect", "Strategic Thought Leadership : You should also have a demonstrated ability to think strategically about business, products, and technical challenges.Education: Bachelor and/or Masters level degree, ideally in Computer Science, Math or Engineering or other relevant discipline", "Expertise with designing on premises / Cloud based HPC deployments and Cloud native HPC solutions", "Scripting capability in one or more languages \u2013 Python, Java, powershell, scripting in Linux environments, Terraform/Ansible", "Knowledge of TCP/IP fundamentals, HPC and low latency networking and MPI", "Working knowledge of distributed/parallel file systems (Lustre) and storage appliances", "Working knowledge of GPUs and GPU applications", "Which includes being a United States Affirmative Action Employer #J-18808-Ljbffr"], "Responsibilities": ["Creativity : Enjoy creating and delivering compelling presentations, product demos, sample solutions, and discussions to drive adoption of Oracle Cloud", "High acumen : for assessing, compiling great technical content, and white papers about emerging technologies and industry developments", "As a trusted customer advocate, you will help customers/partners understand best practices around advanced cloud-based solutions, and how to migrate existing workloads to the cloud", "Work with top customers/partners to help shape and execute a strategy to develop their next-gen SaaS offerings on the Oracle Cloud", "Educate customers of all sizes on the value proposition of Oracle and participate in deep architectural discussions to ensure solutions are designed for successful deployment in the cloud", "Conduct training sessions to transfer knowledge to customers considering or already using Oracle", "Act as a technical liaison between customers, service engineering teams, and support", "Leverage your influencing skills and unmatched enthusiasm to support sales leaders and highly motivated sales consultants and cloud specialists in closing deals with customers", "Develop deep expertise in the Oracle Cloud technology offerings as well as broad know-how around how applications and services are constructed using the Oracle Cloud", "Lead the efforts to share best-practice knowledge amongst the Oracle Cloud community", "You will learn from, collaborate with, and educate some of the brightest technical minds in the industry today across the breadth of enterprise architecture", "Help lead and generate excitement and usage of Oracle Cloud services across various customers/partners segments"], "Benefits": ["US: Hiring Range: from $107,000 to $185,200 per annum", "Eligible for commission with an estimated pay mix of 70/30.Oracle maintains broad salary ranges for its roles in order to account for variations in knowledge, skills, experience, market conditions and locations, as well as reflect Oracle\u2019s differing products, industries and lines of business", "Oracle US offers a comprehensive benefits package which includes the following:Medical, dental, and vision insurance, including expert medical opinion", "Short term disability and long term disability", "Life insurance and AD&DHealth care and dependent care Flexible Spending AccountsPre-tax commuter and parking benefits401(k) Savings and Investment Plan with company match", "Paid time off: Flexible Vacation is provided to all eligible employees assigned to a salaried (non-overtime eligible) position", "Accrued Vacation is provided to all other employees eligible for vacation benefits", "For employees working at least 35 hours per week, the vacation accrual rate is 13 days annually for the first three years of employment and 18 days annually for subsequent years of employment", "Vacation accrual is prorated for employees working between 20 and 34 hours per week", "Employees working fewer than 20 hours per week are not eligible for vacation.11 paid holidays", "Paid sick leave: 72 hours of paid sick leave upon date of hire", "Unused balance will carry over each year up to a maximum cap of 112 hours", "Paid parental leave", "Voluntary benefits including auto, homeowner and pet insurance", "We offer a highly competitive suite of employee benefits designed on the principles of parity and consistency"]}, "job_job_title": "Cloud architect", "job_posting_language": "en", "job_onet_soc": "15119900", "job_onet_job_zone": "4", "job_naics_code": "511210", "job_naics_name": "Software Publishers"}