{"job_id": "6dZjsLcrz6mH1jRLAAAAAA==", "employer_name": "opentable", "employer_logo": "https://cdn.otstatic.com/cfe/14/images/opentable-logo-153e80.svg", "employer_website": "http://www.opentable.com", "employer_company_type": "Information", "job_publisher": "WayUp", "job_employment_type": "FULLTIME", "job_title": "Sales Strategy and Analytics Manager", "job_apply_link": "https://www.wayup.com/i-j-opentable-870478174849570/", "job_apply_is_direct": false, "job_apply_quality_score": 0.5455, "apply_options": [{"publisher": "WayUp", "apply_link": "https://www.wayup.com/i-j-opentable-870478174849570/", "is_direct": false}], "job_description": "OPENTABLE, part of BOOKING HOLDINGS INC. (NASDAQ: BKNG), is the world's leading provider of online restaurant reservations, seating more than 25 million diners per month via online reservations across more than 45,000 restaurants. The OpenTable network connects restaurants and diners, helping diners discover and book the perfect table and helping restaurants deliver personalized hospitality to keep guests coming back. The OpenTable service enables diners to see which restaurants have available tables, select a restaurant based on verified diner reviews, menus, and other helpful information, and easily book a reservation. In addition to the company's website and mobile apps, OpenTable powers online reservations for nearly 600 partners, including many of the Internet's most popular global and local brands. For restaurants, the OpenTable hospitality solutions enable them to manage their reservation book, streamline their operations, and enhance their service levels. Since its inception in 1998, OpenTable has seated over 1.4 billion diners via online reservations around the world. OpenTable is headquartered in San Francisco and has bookable restaurants in more than 20 countries, including Australia, Canada, Germany, Ireland, Japan, Mexico, the Netherlands, United Kingdom and the United States. Restaurants are available for reservations in Dutch, English, French, German, Japanese, and Spanish languages.\n\nThis position is responsible for defining, analyzing, and providing insight into OpenTable\u2019s global restaurant total addressable market (TAM). The Manager will ensure that there is cross-functional alignment on TAM and the segments within it. S/he will be responsible for ensuring accessibility and operationalization of the data. The role will work cross-functionally with multiple departments including sales, marketing, operations, finance, and product to align on initiatives and needs. The Manager will lead data validation exercises to ensure the TAM and segmentation database is seen as a reliable source throughout the company. S/he will leverage data to inform territory optimization standards across the Restaurant Sales and Services organization.\n\nRESPONSIBILITIES\n\u2022 Manage market sizing and segmentation models for OpenTable\u2019s portfolio of products.\n\u2022 Build, maintain, and enhance a global restaurant database that can be used in real-time by the Sales and Marketing teams.\n\u2022 Ensure the database is up-to-date and interactive with tools such as OpenTable\u2019s instance of Salesforce.com.\n\u2022 Source reliable data from third-parties and manage vendor relationships.\n\u2022 Collaborate with Sales, Marketing, Product, and Finance teams to define and build custom models to size new product/market opportunities and aid in strategic planning.\n\u2022 Partner closely with Sales Operations to inform territory, prospect, and segment prioritization decisions.\n\u2022 Collaborate with Data Analytics, Business Optimization, and other teams to solve complex business problems.\n\u2022 Prepare presentations and clearly communicate findings to senior management.\n\u2022 Provide ad hoc reporting and analytical support to management and Sales.\n\nREQUIREMENTS\n\u2022 Advanced data modeling skills and SQL proficiency required.\n\u2022 Experience with Tableau or similar BI tool.\n\u2022 Professional experience in data analysis and the ability to see beyond the numbers to drive sound decision-making.\n\u2022 Passion for data quality and accuracy.\n\u2022 Excellent written and verbal communication skills. Demonstrated ability to synthesize information to see the big picture while effectively managing detail.\n\u2022 Experience creating and presenting slide decks to senior management.\n\u2022 Ability to prioritize and lead multiple tasks concurrently.\n\u2022 Able to work in a fast paced environment with frequently changing work demands.\n\u2022 Proven success managing cross-functional relationships and ability to collaborate effectively with a diverse group of stakeholders.\n\u2022 Ability to be highly productive with minimal oversight .\n\u2022 Must possess business acumen, strong analytical, troubleshooting, problem solving, and project management skills.\n\u2022 3+ years in an analytical role.\n\u2022 College degree required. MBA a plus.\n\u2022 Salesforce.com experience.\n\u2022 Management consulting & tech industry experience a plus.\n\nWHAT'S NEXT? This is a full time exempt position based in San Francisco. If you're interested in joining the OpenTable team and believe this is the role for you, please apply! OpenTable is proud to be an Equal Employment Opportunity and Affirmative Action Employer M/F/D/V.\n\n2300 #LI-BB1", "job_is_remote": false, "job_posted_at_timestamp": 1524623330, "job_posted_at_datetime_utc": "2018-04-25T02:28:50.000Z", "job_city": null, "job_state": null, "job_country": "US", "job_latitude": 37.09024, "job_longitude": -95.71289, "job_benefits": null, "job_google_link": "https://www.google.com/search?gl=us&hl=en&rciv=jb&q=marketing+analytics+manager&start=60&ibp=htl;jobs#fpstate=tldetail&htivrt=jobs&htiq=marketing+analytics+manager&htidocid=6dZjsLcrz6mH1jRLAAAAAA%3D%3D", "job_offer_expiration_datetime_utc": null, "job_offer_expiration_timestamp": null, "job_required_experience": {"no_experience_required": false, "required_experience_in_months": null, "experience_mentioned": true, "experience_preferred": true}, "job_required_skills": null, "job_required_education": {"postgraduate_degree": false, "professional_certification": false, "high_school": false, "associates_degree": false, "bachelors_degree": false, "degree_mentioned": true, "degree_preferred": false, "professional_certification_mentioned": false}, "job_experience_in_place_of_education": false, "job_min_salary": null, "job_max_salary": null, "job_salary_currency": null, "job_salary_period": null, "job_highlights": {"Qualifications": ["Advanced data modeling skills and SQL proficiency required", "Experience with Tableau or similar BI tool", "Professional experience in data analysis and the ability to see beyond the numbers to drive sound decision-making", "Passion for data quality and accuracy", "Excellent written and verbal communication skills", "Demonstrated ability to synthesize information to see the big picture while effectively managing detail", "Experience creating and presenting slide decks to senior management", "Ability to prioritize and lead multiple tasks concurrently", "Able to work in a fast paced environment with frequently changing work demands", "Proven success managing cross-functional relationships and ability to collaborate effectively with a diverse group of stakeholders", "Ability to be highly productive with minimal oversight ", "Must possess business acumen, strong analytical, troubleshooting, problem solving, and project management skills", "3+ years in an analytical role", "College degree required", "Salesforce.com experience"], "Responsibilities": ["This position is responsible for defining, analyzing, and providing insight into OpenTable\u2019s global restaurant total addressable market (TAM)", "The Manager will ensure that there is cross-functional alignment on TAM and the segments within it", "S/he will be responsible for ensuring accessibility and operationalization of the data", "The role will work cross-functionally with multiple departments including sales, marketing, operations, finance, and product to align on initiatives and needs", "The Manager will lead data validation exercises to ensure the TAM and segmentation database is seen as a reliable source throughout the company", "S/he will leverage data to inform territory optimization standards across the Restaurant Sales and Services organization", "Manage market sizing and segmentation models for OpenTable\u2019s portfolio of products", "Build, maintain, and enhance a global restaurant database that can be used in real-time by the Sales and Marketing teams", "Ensure the database is up-to-date and interactive with tools such as OpenTable\u2019s instance of Salesforce.com", "Source reliable data from third-parties and manage vendor relationships", "Collaborate with Sales, Marketing, Product, and Finance teams to define and build custom models to size new product/market opportunities and aid in strategic planning", "Partner closely with Sales Operations to inform territory, prospect, and segment prioritization decisions", "Collaborate with Data Analytics, Business Optimization, and other teams to solve complex business problems", "Prepare presentations and clearly communicate findings to senior management", "Provide ad hoc reporting and analytical support to management and Sales"]}, "job_job_title": "Manager", "job_posting_language": "en", "job_onet_soc": "11202200", "job_onet_job_zone": "4", "job_naics_code": "519130", "job_naics_name": "Internet Publishing and Broadcasting and Web Search Portals"}