{"job_id": "SmT8FzVxC0e4hjz2AAAAAA==", "employer_name": "Lingoda", "employer_logo": "https://upload.wikimedia.org/wikipedia/commons/thumb/1/1d/Lingoda_logo.png/800px-Lingoda_logo.png", "employer_website": "http://www.lingoda.com", "employer_company_type": null, "job_publisher": "The Org", "job_employment_type": "FULLTIME", "job_title": "(senior) Communications & Partnerships Manager (all Genders)", "job_apply_link": "https://theorg.com/org/lingoda/jobs/senior-communications-par-5fa26ae3", "job_apply_is_direct": false, "job_apply_quality_score": 0.5522, "apply_options": [{"publisher": "The Org", "apply_link": "https://theorg.com/org/lingoda/jobs/senior-communications-par-5fa26ae3", "is_direct": false}], "job_description": "Speak our language!\nWe are Lingoda.\nOur mission is to build bridges through life-changing language learning.\n\nLingoda is a fast-growing online language school for language learners aspiring to provide a human-centric, personalized and seamless learning experience unmatched by competitors. With Lingoda, you're not just learning - you're teaming up with an expert who understands your goals and guides you to success, every step of the way.\nOur classes are teacher-led, and supported in- and out-of-class by the latest technologies and a unique curriculum to empower our students to achieve their language goals. High-quality classes are available online 24/7, so anyone anywhere has the opportunity to learn a language with Lingoda.\nAs a company we bring out the best in people with a positive culture. We challenge ourselves, and we challenge others. We work smart and make it happen. We believe in personal growth and inclusion.\nWe work hard to contribute to a better society. How? Here are three examples:\n\nLingoda\u2019s MATCH network and Global Career Centre seek to upskill and match migrants to career opportunities in Germany, supporting them through government-funded education programs\n\nIn the German healthcare sector, we support international nurses, doctors and midwives to obtain language and professional recognition through state-sponsored education programs. As a result we have become one of the largest educational providers in this field in Germany\n\nIn December 2022, we won \u201cBest Digital Learning Product of the Year\u201d at the Digital Education Awards 2022\n\nWe are currently looking for a Communications & Partnerships Manager(all genders) based in Berlin (or elsewhere in Germany).\n\nYour mission with us:\nJoin our Brand Team to develop and leverage strong brand partnerships that help us expand our awareness among relevant audiences, increase our reach and deepen our connection with students around the world.\n\nYour tasks:\n- Pitch, develop and secure working relationships with relevant brands or organizations in coordination with our Head of Brand\n- Focus on brand partnerships and campaigns that strengthen our story and help us reach our target audiences\n- Organize and attend events to grow Lingoda\u2019s network to grow a strong network of relevant contacts and leaders across Germany and the US and act as go-to-person for all their requests\n- Develop innovative consumer-focused campaign angles that position Lingoda as a leader in the online language learning space\n- Set, analyze and report on various partnership activities to stakeholders across the company\n- Collaborate with a variety of people at all levels of the organization and meet stringent deadlines in a fast-paced work environment\n\nYou bring to Lingoda:\n- You have successfully completed your studies with a focus on PR, communications, marketing or comparable training\n- 4-6 years of professional PR or partnerships experience in a multiple language/country environment\n- Experience managing and collaborating with external entities, with a proven track record of securing strategic partnerships that measurably grew a company\u2019s brand awareness\n- Experience with entering new markets via partnerships with a focus on the US and Germany\n- A track record of launching campaigns and events in multiple languages and countries\n- Research and analytical skills as well as curiosity\n- You are engaged and a voracious follower of current events and trends\n- Exceptional written and verbal communication skills in English and German\n- Existing corporate, non-profit, or education connections in Germany and the US\n- Nice to have: You have experience in both consumer and corporate PR\n\nYou add to our culture:\n- The ability to react quickly and agile to rapidly changing conditions\n- Creativity in coming up with new ways to promote business and approaching new potential partners\n- A can-do attitude ad excitement to grow a brand partnerships program from the ground-up\n\nYou can expect from Lingoda:\n- Approachable leaders and transparent communication - every voice counts at Lingoda!\n- Company events and colleagues who are always happy to socialize + budgets towards team building events!\n- An inclusive environment with great team spirit and passion for languages\n- A well-structured and exciting onboarding process to set you up for success!\n- The possibility to work remotely from your home or in the office located in the heart of Berlin\n- Education funds because we want to see our people grow\n- **Free access** to our language classes\n- Mental Health programs\n- Corporate benefits & pension funds\n- 28 vacation days per year\n- Free snacks & drinks at the office\n- The modern hardware necessary for your work\n- Flexible working hours", "job_is_remote": false, "job_posted_at_timestamp": 1709269513, "job_posted_at_datetime_utc": "2024-03-01T05:05:13.000Z", "job_city": null, "job_state": null, "job_country": "US", "job_latitude": 37.09024, "job_longitude": -95.71289, "job_benefits": ["paid_time_off", "health_insurance"], "job_google_link": "https://www.google.com/search?gl=us&hl=en&rciv=jb&q=senior+manager+of+brand+partnerships&start=20&ibp=htl;jobs#fpstate=tldetail&htivrt=jobs&htiq=senior+manager+of+brand+partnerships&htidocid=SmT8FzVxC0e4hjz2AAAAAA%3D%3D", "job_offer_expiration_datetime_utc": null, "job_offer_expiration_timestamp": null, "job_required_experience": {"no_experience_required": false, "required_experience_in_months": 48, "experience_mentioned": true, "experience_preferred": false}, "job_required_skills": null, "job_required_education": {"postgraduate_degree": false, "professional_certification": false, "high_school": false, "associates_degree": false, "bachelors_degree": false, "degree_mentioned": false, "degree_preferred": false, "professional_certification_mentioned": false}, "job_experience_in_place_of_education": false, "job_min_salary": null, "job_max_salary": null, "job_salary_currency": null, "job_salary_period": null, "job_highlights": {"Qualifications": ["You have successfully completed your studies with a focus on PR, communications, marketing or comparable training", "4-6 years of professional PR or partnerships experience in a multiple language/country environment", "Experience managing and collaborating with external entities, with a proven track record of securing strategic partnerships that measurably grew a company\u2019s brand awareness", "Experience with entering new markets via partnerships with a focus on the US and Germany", "A track record of launching campaigns and events in multiple languages and countries", "Research and analytical skills as well as curiosity", "You are engaged and a voracious follower of current events and trends", "Exceptional written and verbal communication skills in English and German", "Existing corporate, non-profit, or education connections in Germany and the US", "Nice to have: You have experience in both consumer and corporate PR", "The ability to react quickly and agile to rapidly changing conditions", "Creativity in coming up with new ways to promote business and approaching new potential partners"], "Responsibilities": ["Pitch, develop and secure working relationships with relevant brands or organizations in coordination with our Head of Brand", "Focus on brand partnerships and campaigns that strengthen our story and help us reach our target audiences", "Organize and attend events to grow Lingoda\u2019s network to grow a strong network of relevant contacts and leaders across Germany and the US and act as go-to-person for all their requests", "Develop innovative consumer-focused campaign angles that position Lingoda as a leader in the online language learning space", "Set, analyze and report on various partnership activities to stakeholders across the company", "Collaborate with a variety of people at all levels of the organization and meet stringent deadlines in a fast-paced work environment"], "Benefits": ["Company events and colleagues who are always happy to socialize + budgets towards team building events!", "The possibility to work remotely from your home or in the office located in the heart of Berlin", "Education funds because we want to see our people grow", "**Free access** to our language classes", "Mental Health programs", "Corporate benefits & pension funds", "28 vacation days per year", "Free snacks & drinks at the office", "The modern hardware necessary for your work", "Flexible working hours"]}, "job_job_title": "Senior", "job_posting_language": "en", "job_onet_soc": "11203100", "job_onet_job_zone": "4"}