{"job_id": "bg20FNty2WYL4AZOAAAAAA==", "employer_name": "Unissant", "employer_logo": null, "employer_website": "http://unissant.us", "employer_company_type": null, "job_publisher": "Adzuna", "job_employment_type": "FULLTIME", "job_title": "Senior Data Scientist", "job_apply_link": "https://www.adzuna.com/details/4563907714", "job_apply_is_direct": false, "job_apply_quality_score": 0.5782, "apply_options": [{"publisher": "Adzuna", "apply_link": "https://www.adzuna.com/details/4563907714", "is_direct": false}, {"publisher": "Jobilize", "apply_link": "https://www.jobilize.com/job/us-md-laurel-senior-data-scientist-unissant-hiring-now-job-immediately", "is_direct": false}], "job_description": "Unissant, Inc. is an innovative solutions development and consulting company committed to delivering simplicity through innovation. We meet this commitment by delivering state-of-the-art enterprise computing and processing solutions to both government and commercial clients. Our workforce continually strives to advance y(our) collective intellect through collaborative fortitude, and we are looking for further talent to join that effort! To learn more about our exciting organization, please visit us at www.unissant.com\n\nWe are seeking a Senior Data Scientist to join our team and support our customers in Baltimore. MD\n\nThis role serves as a key Data Scientist on our work for national digital outreach programs for a large federal government agency. The ideal candidate has a combination of technical, operational, and interpersonal skills, with demonstrated expertise in collaborating with cross-functional teams to collect and interpret complex datasets.\n\nCandidates must have a desire to be part of a data-driven, customer-focused, fast-paced team that loves the mission of improving the citizen experience and providing excellent service to government customers.\n\nEssential Duties and Responsibilities:\n\nData Analysis:\n\u2022 Analyze complex datasets using statistical methods to identify patterns, trends, and outliers.\n\u2022 Collaborate with cross-functional teams (internally, with partners and with customers) to collect and interpret data.\n\u2022 Develop and maintain databases, data systems, and ensure data integrity and accuracy.\n\nData Visualization:\n\u2022 Design and produce compelling data visualizations and interactive dashboards.\n\u2022 Transform complex findings into intuitive visual reports and dashboards to facilitate understanding for non-technical audiences.\n\u2022 Stay updated with the latest trends in data visualization and integrate innovative techniques into the workflow.\n\nCollaboration:\n\u2022 Work closely with the distributed teams and stakeholders to ensure the data infrastructure decisions factor the interests and data goals of the company and its partners.\n\u2022 Advocate for data science and analytics principles/best-practices in design/requirements discussions with customers\n\u2022 Engage with stakeholders to understand their needs and tailor visualizations accordingly.\n\nWork Experience and Job Skills:\n\u2022 5 years of experience in Data Analytics and Visualization.\n\u2022 Proficiency with data visualization tools like Tableau, QuickSight, Power BI, QlikView, or D3.js.\n\u2022 Strong analytical skills with the ability to analyze complex data and produce actionable insights.\n\u2022 Experience with AWS data and analytics technologies including EMR, Redshift, QuickSight, Glue\n\u2022 Familiarity with statistical analysis tools such as R or Python.\n\nEducation:\n\u2022 Bachelor's Degree in Computer Science or Information Systems required. Master's degree is preferred\n\nCertificates, Licenses and Registrations:\n\u2022 Due to security requirements, this position is currently open only to U.S. citizens. Additionally, you must have been a resident of the United States at least three of the last five years. Exceptions are possible for applicants who worked for the U.S. Government as an employee overseas in a Federal or military capacity; and/or been a dependent of a U.S. Federal or military employee serving overseas. Such applicants must be able to provide state-side reference coverage. State-side coverage information is required to make a suitability or security determination.\n\nCommunications Skills:\n\u2022 Excellent communication skills, both written and verbal.\n\u2022 Solid ability to interface, inspire and motivate at various levels of the organization.\n\u2022 Ability to convey technical information to non-technical individuals.\n\u2022 Demonstrated experience communicating effectively across internal and external organizations.\n\nTravel:\n\u2022 Client location is Baltimore, MD. Onsite meeting participation may be needed occasionally.\n\nEnvironmental Requirements:\n\u2022 Mainly sedentary; in an office environment.\n\u2022 May be required to lift up to ten (10) pounds\n\u2022 Flexible in working extended hours\n\nThe above statements are intended to describe the general nature and level of work being performed by the individual(s) assigned to this position. They are not intended to be an exhaustive list of all duties, responsibilities, and skills required. Unissant management reserves the right to modify, add, or remove duties and to assign other duties as necessary. In addition, where applicable and available, reasonable accommodation(s) may be made to enable individuals with disabilities to perform essential functions of this position.\n\nPlease note: Candidate(s) will be required to go through pre-employment screening.\n\nUnissant, Inc. is a proud Equal Opportunity Employer! (EOE; M/F/Disability/Vets)", "job_is_remote": false, "job_posted_at_timestamp": 1707246000, "job_posted_at_datetime_utc": "2024-02-06T19:00:00.000Z", "job_city": "Laurel", "job_state": "MD", "job_country": "US", "job_latitude": 39.093807, "job_longitude": -76.79136, "job_benefits": null, "job_google_link": "https://www.google.com/search?gl=us&hl=en&rciv=jb&q=senior+data+scientist&start=70&ibp=htl;jobs#fpstate=tldetail&htivrt=jobs&htiq=senior+data+scientist&htidocid=bg20FNty2WYL4AZOAAAAAA%3D%3D", "job_offer_expiration_datetime_utc": "2024-03-16T15:33:31.000Z", "job_offer_expiration_timestamp": 1710603211, "job_required_experience": {"no_experience_required": false, "required_experience_in_months": 60, "experience_mentioned": true, "experience_preferred": false}, "job_required_skills": null, "job_required_education": {"postgraduate_degree": false, "professional_certification": false, "high_school": false, "associates_degree": false, "bachelors_degree": false, "degree_mentioned": true, "degree_preferred": true, "professional_certification_mentioned": false}, "job_experience_in_place_of_education": false, "job_min_salary": null, "job_max_salary": null, "job_salary_currency": null, "job_salary_period": null, "job_highlights": {"Qualifications": ["Candidates must have a desire to be part of a data-driven, customer-focused, fast-paced team that loves the mission of improving the citizen experience and providing excellent service to government customers", "5 years of experience in Data Analytics and Visualization", "Proficiency with data visualization tools like Tableau, QuickSight, Power BI, QlikView, or D3.js", "Strong analytical skills with the ability to analyze complex data and produce actionable insights", "Experience with AWS data and analytics technologies including EMR, Redshift, QuickSight, Glue", "Familiarity with statistical analysis tools such as R or Python", "Bachelor's Degree in Computer Science or Information Systems required", "Due to security requirements, this position is currently open only to U.S. citizens", "Exceptions are possible for applicants who worked for the U.S. Government as an employee overseas in a Federal or military capacity; and/or been a dependent of a U.S. Federal or military employee serving overseas", "State-side coverage information is required to make a suitability or security determination", "Excellent communication skills, both written and verbal", "Solid ability to interface, inspire and motivate at various levels of the organization", "Ability to convey technical information to non-technical individuals", "Demonstrated experience communicating effectively across internal and external organizations", "Mainly sedentary; in an office environment", "May be required to lift up to ten (10) pounds", "Flexible in working extended hours"], "Responsibilities": ["Analyze complex datasets using statistical methods to identify patterns, trends, and outliers", "Collaborate with cross-functional teams (internally, with partners and with customers) to collect and interpret data", "Develop and maintain databases, data systems, and ensure data integrity and accuracy", "Design and produce compelling data visualizations and interactive dashboards", "Transform complex findings into intuitive visual reports and dashboards to facilitate understanding for non-technical audiences", "Stay updated with the latest trends in data visualization and integrate innovative techniques into the workflow", "Work closely with the distributed teams and stakeholders to ensure the data infrastructure decisions factor the interests and data goals of the company and its partners", "Advocate for data science and analytics principles/best-practices in design/requirements discussions with customers", "Engage with stakeholders to understand their needs and tailor visualizations accordingly", "Onsite meeting participation may be needed occasionally"]}, "job_job_title": "Data scientist", "job_posting_language": "en", "job_onet_soc": "15111100", "job_onet_job_zone": "5"}