{"job_id": "Jm3T9IADLj_4S6oDAAAAAA==", "employer_name": "Twin Health", "employer_logo": "https://encrypted-tbn0.gstatic.com/images?q=tbn:ANd9GcR3fonmH06NXndD2zo07C11LTZ9cVR9Xt0VFNF2&s=0", "employer_website": "http://www.twinhealth.com", "employer_company_type": null, "job_publisher": "LinkedIn", "job_employment_type": "FULLTIME", "job_title": "Vice President, Partner Growth Marketing", "job_apply_link": "https://www.linkedin.com/jobs/view/vice-president-partner-growth-marketing-at-twin-health-3831219420", "job_apply_is_direct": false, "job_apply_quality_score": 0.6879, "apply_options": [{"publisher": "LinkedIn", "apply_link": "https://www.linkedin.com/jobs/view/vice-president-partner-growth-marketing-at-twin-health-3831219420", "is_direct": false}, {"publisher": "Wellfound", "apply_link": "https://wellfound.com/jobs/2933056-vice-president-partner-growth-marketing", "is_direct": true}, {"publisher": "Glassdoor", "apply_link": "https://www.glassdoor.com/job-listing/vice-president-partner-growth-marketing-twin-health-JV_IC1138213_KO0,39_KE40,51.htm?jl=1009136177615", "is_direct": true}, {"publisher": "Indeed", "apply_link": "https://www.indeed.com/viewjob?jk=57e0f3cafc4ff325", "is_direct": true}, {"publisher": "Built In", "apply_link": "https://builtin.com/job/vice-president-partner-growth-marketing/2322934", "is_direct": true}, {"publisher": "Jobgether", "apply_link": "https://jobgether.com/offer/65da849aaf69414782b426d6-vice-president-partner-growth-marketing", "is_direct": false}, {"publisher": "Pangian", "apply_link": "https://pangian.com/job/vice-president-partner-growth-marketing-remote-2/", "is_direct": true}, {"publisher": "Simplify", "apply_link": "https://simplify.jobs/p/ec82b579-675c-4112-ba00-a07c747cb6e6/Vice-President", "is_direct": false}], "job_description": "Twin Health\n\nAt Twin Health, we empower people to reverse, prevent and improve chronic metabolic diseases. Twin Health invented The Whole Body Digital Twin\u2122 , a dynamic representation of each individual\u2019s unique metabolism, built from thousands of data points collected daily via non-invasive sensors and self-reported preferences. The Whole Body Digital Twin delivers a new standard of care, empowering physicians and patients to make personalized data-driven decisions.\n\nWorking here\n\nOur team is passionate, talented, and driven by our purpose to improve the health and happiness of our members. Our culture empowers each Twin to do what\u2019s needed to create impact for our members, partners, and our company, and enjoy their experience at work. Twin Health was awarded Innovator of the Year by Employer Health Innovation Roundtable (EHIR) (out of 358 companies), named to the 2021 CB Insights Digital Health 150, and recognized by Built In's 2022 Best Places To Work Awards. Twin Health has the backing of leading venture capital funds including ICONIQ Growth, Sequoia, and Sofina, enabling us to scale services in the U.S. and globally and help solve the global chronic metabolic disease health crisis. We have recently announced broad and growing partnerships with premier employers, such as Blackstone and Berkshire Hathaway. We are building the company you always wished you worked for. Join us in revolutionizing healthcare and building the most impactful digital health company in the world!\n\nExcited to join us and do your part in improving people\u2019s health and happiness?\n\nOpportunity\n\nWe are seeking a dynamic and experienced VP, Partner Growth Marketing to join our growing Clinical Operations and Marketing team. Reporting to the Chief Medical Officer and Head of Marketing, in this role you will be responsible for forging and nurturing marketing and communications relationships with our key partners, including health plans and employers, to drive member growth through targeted and precise marketing initiatives. This candidate will work closely with the Member Growth Marketing team, Partner Experience Team, BD team, Clinical Delivery Team, and Clinical Operations team to drive Twin\u2019s growth from Partner to Member. The ideal candidate will have a proven track record in B2B2C marketing, ideally within the healthcare industry and specifically, within large health plan organizations.\n\nResponsibilities\n\nPartner Engagement:\n\u2022 Cultivate and maintain strong relationships with health plan and employer partners\n\u2022 Collaborate with partners to understand their unique needs, objectives, and member demographics\n\u2022 Starting during the sales cycle, work with large partners on ROI analyses, forecasting active twin potentials, and discussing key tactics that will be available to most accurately forecast the member growth\n\u2022 Work closely with legal team to negotiate and finalize partnership agreements, ensuring mutual benefits and a strong foundation for collaboration; Review all sales contracts and ensure that marketing appendix is detailed, specific, and clear on the responsibilities and allowances of both Twin and the partner\n\u2022 Utilize data-driven insights to optimize lead generation channels, campaigns, and tactics.\n\u2022 Collaborate with sales, business development, partner success, and implementation to ensure that the marketing team is at the table discussing opportunities to enhance targets and meet growth plans set for the annual year\n\u2022 Work with sales team on key final pitches and support acquisition of key clients\n\u2022 Support RFPs and related finalist deliverables, including presentations at key conferences for business development leads\n\u2022 Determine prior to launch the quality of eligibles for each partner as high, medium, low and set up conversion plan with core conversion and analytics team prior to implementation\n\u2022 Ensure co-branding approval for all partners working implementation and approval timelines into the launch plan\n\nMarketing Strategy Development And Engagement\n\u2022 Devise comprehensive marketing strategies tailored to each partner, aligning with overall company goals and working to ensure expectations on conversion are aligned with quality of eligibles and contractual agreements\n\u2022 Work closely with the member growth marketing team to create compelling, data-driven campaigns that resonate with target audiences and align with partner specific agreements based on sales, contracting, and implementation decisions\n\u2022 Lead relationships with the key stakeholders at each partner and work to achieve the highest engagement and innovation to drive member growth\n\u2022 Lead partner specific marketing strategic weekly meeting working closely with VP, Member Growth Marketing and VP, Member Enrollment Operations, as well as clinical ops team, PET team, and analytics team\n\nCampaign Execution Support And Iteration\n\u2022 Strategize marketing tactics to drive member growth, considering both online and offline channels and share with Member Growth Marketing team to execute\n\u2022 Utilize a variety of marketing tools and platforms to drive execution of campaigns effectively, working closely with VP, Member Growth Marketing\n\u2022 Take campaign performance and share back to partners to improve and more precisely drive campaign execution and success\n\u2022 Work closely with VP, Member Growth Marketing on expected opens, clicks, registrations in order to optimize active twins, bringing back all ideas to partners for permission and approval and driving novel ideas based on partner precision marketing tactics\n\nLeadership And Team Building\n\u2022 Build a best in class partner marketing team to support both SIE and HP partners, aligned with growth of business\n\u2022 Develop metrics for each team member and evaluate performance quarterly according to charter, role, and responsibilities\n\u2022 Ensure team is clear on vision and hold team members accountable for business goals and collaborative execution\n\u2022 Manage team budget closely to be within allocated budget; make budget adjustments in line with performance of the business\n\nData Analysis And Reporting\n\u2022 Monitor and analyze key performance indicators (KPIs) to evaluate the success of marketing initiatives\n\u2022 Work with analytics and reporting to provide regular reports to partners, highlighting the impact of campaigns and areas for improvement, leading summarizing overall conversion performance at partner quarterly executive business reviews\n\nQualifications\n\u2022 Minimum 15 years\u2019 in leadership position with interest in growth opportunities in a fast paced start up.\n\u2022 Bachelor's degree in Marketing, Business, or a related field, MBA a plus\n\u2022 Proven experience in B2B2C marketing, preferably with experience in health plans and the healthcare industry\n\u2022 Strong understanding of metabolic diseases and a passion for health and wellness\n\u2022 Excellent interpersonal and communication skills, with the ability to influence and build lasting partnerships\n\u2022 Demonstrated ability to develop and execute successful marketing strategies\n\u2022 Analytical mindset with proficiency in data analysis tools and reporting\n\u2022 Ability to thrive in a dynamic, fast-paced startup environment\n\nCore Metrics: At Twin Health, we measure what matters. This is especially true for our partner growth marketing function which is critical to the growth of our business and ensuring partner ROI and impact. Here are the core metric areas that this individual will have analytical support for and accountability on plan and actuals:\n\u2022 Active Twins - As a metric of the partner marketing engine, shared with member growth marketing, demonstrating health of B to B to C conversion overall\n\u2022 Lead Generation Metrics (eg. Approved marketing campaigns, marketing sends, forecasting vs. actuals)\n\u2022 Partner Quality Metrics (eg. L1, L2, L3 quality leads - partner quality graded based on contractual and co-branding achievements and alignment)\n\u2022 Marketing Budget - ability to stay within budget to meet goals based on precision marketing strategy\n\u2022 Partner NPS (measurement of partner\u2019s experience with our marketing team)\n\u2022 Required Skills and Abilities\n\u2022 Exceptional communication, leadership, and interpersonal skills\n\u2022 Desire to build an organization from the ground up and to see rapid growth, personally and professionally - hungry for change and impact\n\u2022 Proficiency in marketing software, analytical tools, and marketing automation / CRM platforms including Salesforce, Braze and others\n\u2022 Analytical mindset with ability to interpret data and generate actionable insights\n\u2022 Deep understanding of the healthcare industry regulations, consumer engagement strategies, and compliance standards\n\u2022 Creative thinker with a strategic approach to marketing initiatives\n\u2022 Team player\n\u2022 Passionate about changing healthcare for the better\n\u2022 Speed and Quality driven\n\u2022 Occasional travel will be required for this role, though the role is remote.\n\u2022 Applicants must be authorized to work for any employer in the U.S. We are unable to sponsor or take over sponsorship of an employment Visa at this time.\n\nCompensation And Benefits\n\nThe compensation range for this position is $200,000-$225,000 annually.\n\nIn addition, Twin has an ambitious vision to empower people to live healthier and happier lives, and to achieve this purpose, we need the very best people to enhance our cutting-edge technology and medical science, deliver the best possible care, and turn our passion into value for our members, partners and investors. We are committed to delivering an outstanding culture and experience for every Twin employee through a company based on the values of passion, talent, and trust. We offer comprehensive benefits and perks in line with these principles, as well as a high level of flexibility for every Twin\n\u2022 A competitive compensation package in line with leading technology companies\n\u2022 As a remote friendly company we are committed to providing opportunities for all who join to further build relationships, increase cross-functional collaboration, and celebrate our accomplishments.\n\u2022 Opportunity for equity participation\n\u2022 Unlimited vacation with manager approval\n\u2022 16 weeks of 100% paid parental leave for delivering parents; 8 weeks of 100% paid parental leave for non-delivering parents\n\u2022 100% Employer sponsored healthcare, dental, and vision for you, and 80% coverage for your family; Health Savings Account and Flexible Spending Account options\n\u2022 401k retirement savings plan\n\nSalary range for US jobs\n\nUS Salary Range\n\n$200,000\u2014$225,000 USD", "job_is_remote": true, "job_posted_at_timestamp": 1708486722, "job_posted_at_datetime_utc": "2024-02-21T03:38:42.000Z", "job_city": null, "job_state": null, "job_country": "US", "job_latitude": 37.09024, "job_longitude": -95.71289, "job_benefits": ["paid_time_off", "dental_coverage", "retirement_savings", "health_insurance"], "job_google_link": "https://www.google.com/search?gl=us&hl=en&rciv=jb&q=vice+president+of+brand+partnerships&start=40&ibp=htl;jobs#fpstate=tldetail&htivrt=jobs&htiq=vice+president+of+brand+partnerships&htidocid=Jm3T9IADLj_4S6oDAAAAAA%3D%3D", "job_offer_expiration_datetime_utc": "2024-03-22T03:38:42.000Z", "job_offer_expiration_timestamp": 1711078722, "job_required_experience": {"no_experience_required": false, "required_experience_in_months": null, "experience_mentioned": true, "experience_preferred": false}, "job_required_skills": null, "job_required_education": {"postgraduate_degree": false, "professional_certification": false, "high_school": false, "associates_degree": false, "bachelors_degree": true, "degree_mentioned": true, "degree_preferred": true, "professional_certification_mentioned": false}, "job_experience_in_place_of_education": false, "job_min_salary": null, "job_max_salary": null, "job_salary_currency": null, "job_salary_period": null, "job_highlights": {"Qualifications": ["Minimum 15 years\u2019 in leadership position with interest in growth opportunities in a fast paced start up", "Proven experience in B2B2C marketing, preferably with experience in health plans and the healthcare industry", "Strong understanding of metabolic diseases and a passion for health and wellness", "Excellent interpersonal and communication skills, with the ability to influence and build lasting partnerships", "Demonstrated ability to develop and execute successful marketing strategies", "Analytical mindset with proficiency in data analysis tools and reporting", "Ability to thrive in a dynamic, fast-paced startup environment", "Marketing Budget - ability to stay within budget to meet goals based on precision marketing strategy", "Partner NPS (measurement of partner\u2019s experience with our marketing team)", "Required Skills and Abilities", "Exceptional communication, leadership, and interpersonal skills", "Desire to build an organization from the ground up and to see rapid growth, personally and professionally - hungry for change and impact", "Proficiency in marketing software, analytical tools, and marketing automation / CRM platforms including Salesforce, Braze and others", "Analytical mindset with ability to interpret data and generate actionable insights", "Deep understanding of the healthcare industry regulations, consumer engagement strategies, and compliance standards", "Creative thinker with a strategic approach to marketing initiatives", "Passionate about changing healthcare for the better", "Speed and Quality driven", "Applicants must be authorized to work for any employer in the U.S. We are unable to sponsor or take over sponsorship of an employment Visa at this time"], "Responsibilities": ["Reporting to the Chief Medical Officer and Head of Marketing, in this role you will be responsible for forging and nurturing marketing and communications relationships with our key partners, including health plans and employers, to drive member growth through targeted and precise marketing initiatives", "This candidate will work closely with the Member Growth Marketing team, Partner Experience Team, BD team, Clinical Delivery Team, and Clinical Operations team to drive Twin\u2019s growth from Partner to Member", "Cultivate and maintain strong relationships with health plan and employer partners", "Collaborate with partners to understand their unique needs, objectives, and member demographics", "Starting during the sales cycle, work with large partners on ROI analyses, forecasting active twin potentials, and discussing key tactics that will be available to most accurately forecast the member growth", "Work closely with legal team to negotiate and finalize partnership agreements, ensuring mutual benefits and a strong foundation for collaboration; Review all sales contracts and ensure that marketing appendix is detailed, specific, and clear on the responsibilities and allowances of both Twin and the partner", "Utilize data-driven insights to optimize lead generation channels, campaigns, and tactics", "Collaborate with sales, business development, partner success, and implementation to ensure that the marketing team is at the table discussing opportunities to enhance targets and meet growth plans set for the annual year", "Work with sales team on key final pitches and support acquisition of key clients", "Support RFPs and related finalist deliverables, including presentations at key conferences for business development leads", "Determine prior to launch the quality of eligibles for each partner as high, medium, low and set up conversion plan with core conversion and analytics team prior to implementation", "Ensure co-branding approval for all partners working implementation and approval timelines into the launch plan", "Marketing Strategy Development And Engagement", "Devise comprehensive marketing strategies tailored to each partner, aligning with overall company goals and working to ensure expectations on conversion are aligned with quality of eligibles and contractual agreements", "Work closely with the member growth marketing team to create compelling, data-driven campaigns that resonate with target audiences and align with partner specific agreements based on sales, contracting, and implementation decisions", "Lead relationships with the key stakeholders at each partner and work to achieve the highest engagement and innovation to drive member growth", "Lead partner specific marketing strategic weekly meeting working closely with VP, Member Growth Marketing and VP, Member Enrollment Operations, as well as clinical ops team, PET team, and analytics team", "Campaign Execution Support And Iteration", "Strategize marketing tactics to drive member growth, considering both online and offline channels and share with Member Growth Marketing team to execute", "Utilize a variety of marketing tools and platforms to drive execution of campaigns effectively, working closely with VP, Member Growth Marketing", "Take campaign performance and share back to partners to improve and more precisely drive campaign execution and success", "Work closely with VP, Member Growth Marketing on expected opens, clicks, registrations in order to optimize active twins, bringing back all ideas to partners for permission and approval and driving novel ideas based on partner precision marketing tactics", "Build a best in class partner marketing team to support both SIE and HP partners, aligned with growth of business", "Develop metrics for each team member and evaluate performance quarterly according to charter, role, and responsibilities", "Ensure team is clear on vision and hold team members accountable for business goals and collaborative execution", "Manage team budget closely to be within allocated budget; make budget adjustments in line with performance of the business", "Data Analysis And Reporting", "Monitor and analyze key performance indicators (KPIs) to evaluate the success of marketing initiatives", "Work with analytics and reporting to provide regular reports to partners, highlighting the impact of campaigns and areas for improvement, leading summarizing overall conversion performance at partner quarterly executive business reviews", "Here are the core metric areas that this individual will have analytical support for and accountability on plan and actuals:", "Active Twins - As a metric of the partner marketing engine, shared with member growth marketing, demonstrating health of B to B to C conversion overall", "Lead Generation Metrics (eg", "Approved marketing campaigns, marketing sends, forecasting vs. actuals)"], "Benefits": ["Compensation And Benefits", "The compensation range for this position is $200,000-$225,000 annually", "A competitive compensation package in line with leading technology companies", "As a remote friendly company we are committed to providing opportunities for all who join to further build relationships, increase cross-functional collaboration, and celebrate our accomplishments", "Opportunity for equity participation", "Unlimited vacation with manager approval", "16 weeks of 100% paid parental leave for delivering parents; 8 weeks of 100% paid parental leave for non-delivering parents", "100% Employer sponsored healthcare, dental, and vision for you, and 80% coverage for your family; Health Savings Account and Flexible Spending Account options", "401k retirement savings plan", "Salary range for US jobs", "$200,000\u2014$225,000 USD"]}, "job_job_title": "Vice president", "job_posting_language": "en", "job_onet_soc": "11202100", "job_onet_job_zone": "4"}