{"job_id": "TM32k_fcqNY1zgO0AAAAAA==", "employer_name": "Hilton", "employer_logo": "https://www.hilton.com/modules/assets/svgs/logos/WW.svg", "employer_website": "http://www.hilton.com", "employer_company_type": "Accommodation", "job_publisher": "ZipRecruiter", "job_employment_type": "FULLTIME", "job_title": "Vice President Customer Engagement, Loyalty & Partnerships GCM, Greater China & Mongolia", "job_apply_link": "https://www.ziprecruiter.com/c/Hilton/Job/Vice-President-Customer-Engagement,-Loyalty-&-Partnerships-GCM,-Greater-China-&-Mongolia/-in-Shanghai,WV?jid=52cc9ef1a5d6bd13", "job_apply_is_direct": false, "job_apply_quality_score": 0.7244, "apply_options": [{"publisher": "ZipRecruiter", "apply_link": "https://www.ziprecruiter.com/c/Hilton/Job/Vice-President-Customer-Engagement,-Loyalty-&-Partnerships-GCM,-Greater-China-&-Mongolia/-in-Shanghai,WV?jid=52cc9ef1a5d6bd13", "is_direct": false}], "job_description": "With thousands of hotels in over 100 countries and territories, Hilton offers countless opportunities to delight. From an open door to a welcoming smile and an exceptional experience, we offer the millions of travellers who stay with us every year a welcome they will never forget. In addition to our flagship brand, Hilton Hotels & Resorts, the family of brands includes Waldorf Astoria, LXR, Conrad, Canopy, Curio Collection, DoubleTree, Hilton Garden Inn, Hampton and many others.\n\nIf you appreciate the impact global travel can have on the world, you may be just the person we are looking for to work as a Hilton Team Member. Because it's with Hilton where we never forget the reason we're here: to delight our guests, Team Members, and owners alike.\n\nPosition Statement\n\nAs VP Customer Engagement, Loyalty & Partnerships GCM, your strategic vision will drive success across critical areas, ensuring alignment with business objectives and delivering best-in-class initiatives. The primary purpose of this position is to lead and direct the Customer Engagement, Loyalty, Strategic Partnerships, Marketing technology team in GCM. Focus will be on leading strategy planning and implementation in loyalty program implementation, strategic partnership, Customer Relationship Management (CRM), On-property Honors Performance, collaborating with franchised partners, demonstrating leadership to shape the future and strengthen team engagement in the dynamic China market.\n\nWhat will I be doing?\n\nAs VP Customer Engagement, Loyalty & Partnerships GCM, your strategic vision will drive success across critical areas, ensuring alignment with business objectives and delivering best-in-class initiatives. The primary purpose of this position is to lead and direct the Customer Engagement, Loyalty, Strategic Partnerships, Marketing technology team in GCM. Focus will be on leading strategy planning and implementation in loyalty program implementation, strategic partnership, Customer Relationship Management (CRM), On-property Honors Performance, collaborating with franchised partners, demonstrating leadership to shape the future and strengthen team engagement in the dynamic China market.\n\nAs the VP Customer Engagement, Loyalty & Partnerships GCM, you will be responsible for performing the following tasks to the highest standard:\n\nLead Strategy Planning and Implementation\n\nLoyalty Program Implementation:\n\u2022 Build and execute the China strategy for the Honors loyalty program growth.\nCollaborate with the global loyalty team to integrate global system-wide plans and local plans, driving the implementation of these programs in the\nChina market to ensure success.\nDevelop platforms to introduce and activate customers to enroll in Honors ; Work closely with the Marketing technology teams to ensure that loyalty\nplatforms meet the needs of our customers.\n\nStrategic Partnership:\n\nDefine the partnership strategy for GCM, building and implementing partnership strategy to drive Hilton China's commercial advantage, enhance Hilton\nHonors program value proposition, and deliver win-win solutions with key strategic partners.\nHold responsibility for leading partnerships team for management and development in GCM of all partnerships headquartered within GCM and activation\nof global partner programs in GCM.\nIdentify, negotiate, activate, and manage strategic partnerships with airlines, finance, lifestyle etc.\n\nCustomer Relationship Management (CRM):\n\nCollaborate with the Global Customer Experience and technology team to define China Martech requirements and execute strategies in the region.\nDrive customer engagement, create customer experiences, and map customer journeys through innovative technology solutions.\nPartner with the Snr Director of Marketing & eCommerce in GCM to develop customer engagement programs to cultivate loyalty in the key GCM source\nmarkets for the overall brand portfolio globally.\nLeverage existing and new Hilton Honors and partner channels to enable Customer engagement and incremental revenue delivery across GCM.\n\nDrive On-Property Honors Performance\n\nWork closely with the GCM Operations team and leaders to deliver exceptional Honors performance across Hilton properties.\n\nDirect and mentor the team to excel in the following areas:\nEnhance Honors occupancy by implementing effective strategies.\nMonitor and evaluate individual property performance within GCM.\nDevelop tools and programs to engage property teams and drive Honors performance.\nDrive growth of Honors membership production across the property in GCM.\nSupport for new market entry and property opening in GCM.\n\nCollaborate with Franchised Partners\n\nCollaborate with franchised partners, including MLA and other key franchised partners to build Honors capability and drive performance.\n\nExemplify Leadership and Build Relationship\n\nActively engage in the GCM Commercial Services leadership team, maintains excellent relationships, and ensures teamwork to achieve the objectives of\nGCM Commercial Service team.\nWork with the GCM Commercial leaders to ensure that departmental initiatives are delivered collectively.\nClosely partner with global and APAC stakeholder to champion China needs.\nLead and inspire team members towards high performance and engagement:\n\nDrive team performance through clearly focusing effort through objectives and targets. Ensuring that all people in the team are trained and equipped\nto excel in their roles and have all the tools to execute their daily activities and responsibilities.\nMaintain adequate succession plans to ensure that our team is 'future-proofed'.\nCreate a culture which motivates and encourages team members to perform to the best of their ability.\n\nWhat are we looking for?\n\nSpecific Job Knowledge, Skill and Ability:\n\nThe individual must possess the following knowledge, skills and abilities and be able to perform the essential functions of the job, with or without reasonable supervision:\n\nRequired:\n\nLoyalty Program Expertise\n\nYou've successfully developed and activated global loyalty programs in China. Your insights into customer behavior and market dynamics are\ninvaluable.\n\nExcellent Leadership\n\nCross-Functional Teams: You excel at leading cross-functional teams. Your influence with senior stakeholders within a global matrix organization\nsets you apart.\nEthical Leadership: You lead by example, resolving conflicts and introducing positive change.\nTalent Development: Your passion for attracting, inspiring, mentoring, and developing talent drives our team's engagement.\n\nStrategic Decision-Making\n\nFrom Scratch to Success: You thrive on building strategies from the ground up. Your ability to execute and optimize plans is unmatched.\nBusiness Case Development: You've led teams in creating robust business cases, turning concepts into actionable plans. You're adept at presenting to\nglobal teams. Your influence drives alignment and commitment.\nAnalytical Acumen: You analyze departmental financial data to make informed strategic and tactical decisions.\nProblem-Solving: Your problem-solving skills are top-notch. You collaborate effectively to address challenges and prevent potential issues.\n\nMarket Understanding\n\nLocal Insights: Your extensive understanding of the local market and industry informs our strategies. You recommend targeted approaches to achieve\nour goals.\nCustomer-Centric: You grasp customer segments, business plans, and competitive landscapes. Your insights drive our success.\n\nOther Qualifications\n\nEducation: A bachelor's degree or equivalent experience.\nLanguage Skills: Excellent in spoken and written English and Chinese.\nCommunication: Excellent communication skills in presentations, written content, and public speaking.\nEthical Behavior: Demonstrates the highest standards of ethical behavior and absolute discretion with sensitive information.\n\nPreferred:\n\nAdvanced degree or equivalent.\nSignificant hospitality industry experience in a loyalty related function as leadership role.\n\nWhat will it be like to work for Hilton?\n\nHilton is the leading global hospitality company, spanning the lodging sector from legendary luxury hotels and resorts to extended-stay suites and mid-priced hotels. For nearly a century, Hilton has offered business and leisure travelers the finest in accommodations, service, amenities and value. Hilton is dedicated to continuing its tradition of providing exceptional guest experiences across its global brands. Our vision to fill the earth with the light and warmth of hospitality unites us as a team to create remarkable hospitality experiences around the world every day. And, our amazing Team Members are at the heart of it all!", "job_is_remote": false, "job_posted_at_timestamp": 1709875860, "job_posted_at_datetime_utc": "2024-03-08T05:31:00.000Z", "job_city": null, "job_state": null, "job_country": "US", "job_latitude": 37.09024, "job_longitude": -95.71289, "job_benefits": null, "job_google_link": "https://www.google.com/search?gl=us&hl=en&rciv=jb&q=vice+president+of+brand+partnerships&start=20&ibp=htl;jobs#fpstate=tldetail&htivrt=jobs&htiq=vice+president+of+brand+partnerships&htidocid=TM32k_fcqNY1zgO0AAAAAA%3D%3D", "job_offer_expiration_datetime_utc": "2024-04-07T00:00:00.000Z", "job_offer_expiration_timestamp": 1712448000, "job_required_experience": {"no_experience_required": false, "required_experience_in_months": null, "experience_mentioned": true, "experience_preferred": false}, "job_required_skills": null, "job_required_education": {"postgraduate_degree": false, "professional_certification": false, "high_school": false, "associates_degree": false, "bachelors_degree": false, "degree_mentioned": true, "degree_preferred": true, "professional_certification_mentioned": false}, "job_experience_in_place_of_education": false, "job_min_salary": null, "job_max_salary": null, "job_salary_currency": null, "job_salary_period": null, "job_highlights": {"Qualifications": ["The individual must possess the following knowledge, skills and abilities and be able to perform the essential functions of the job, with or without reasonable supervision:", "Loyalty Program Expertise", "You've successfully developed and activated global loyalty programs in China", "Talent Development: Your passion for attracting, inspiring, mentoring, and developing talent drives our team's engagement", "From Scratch to Success: You thrive on building strategies from the ground up", "Your ability to execute and optimize plans is unmatched", "Business Case Development: You've led teams in creating robust business cases, turning concepts into actionable plans", "You're adept at presenting to", "Analytical Acumen: You analyze departmental financial data to make informed strategic and tactical decisions", "Problem-Solving: Your problem-solving skills are top-notch", "You collaborate effectively to address challenges and prevent potential issues", "Education: A bachelor's degree or equivalent experience", "Language Skills: Excellent in spoken and written English and Chinese", "Communication: Excellent communication skills in presentations, written content, and public speaking", "Ethical Behavior: Demonstrates the highest standards of ethical behavior and absolute discretion with sensitive information", "Advanced degree or equivalent", "Significant hospitality industry experience in a loyalty related function as leadership role"], "Responsibilities": ["As VP Customer Engagement, Loyalty & Partnerships GCM, your strategic vision will drive success across critical areas, ensuring alignment with business objectives and delivering best-in-class initiatives", "The primary purpose of this position is to lead and direct the Customer Engagement, Loyalty, Strategic Partnerships, Marketing technology team in GCM", "Focus will be on leading strategy planning and implementation in loyalty program implementation, strategic partnership, Customer Relationship Management (CRM), On-property Honors Performance, collaborating with franchised partners, demonstrating leadership to shape the future and strengthen team engagement in the dynamic China market", "As the VP Customer Engagement, Loyalty & Partnerships GCM, you will be responsible for performing the following tasks to the highest standard:", "Build and execute the China strategy for the Honors loyalty program growth", "Collaborate with the global loyalty team to integrate global system-wide plans and local plans, driving the implementation of these programs in the", "Develop platforms to introduce and activate customers to enroll in Honors ; Work closely with the Marketing technology teams to ensure that loyalty", "platforms meet the needs of our customers", "Honors program value proposition, and deliver win-win solutions with key strategic partners", "Hold responsibility for leading partnerships team for management and development in GCM of all partnerships headquartered within GCM and activation", "Identify, negotiate, activate, and manage strategic partnerships with airlines, finance, lifestyle etc", "Drive customer engagement, create customer experiences, and map customer journeys through innovative technology solutions", "Partner with the Snr Director of Marketing & eCommerce in GCM to develop customer engagement programs to cultivate loyalty in the key GCM source", "markets for the overall brand portfolio globally", "Leverage existing and new Hilton Honors and partner channels to enable Customer engagement and incremental revenue delivery across GCM", "Direct and mentor the team to excel in the following areas:", "Enhance Honors occupancy by implementing effective strategies", "Monitor and evaluate individual property performance within GCM", "Develop tools and programs to engage property teams and drive Honors performance", "Drive growth of Honors membership production across the property in GCM", "Support for new market entry and property opening in GCM", "Collaborate with franchised partners, including MLA and other key franchised partners to build Honors capability and drive performance", "Exemplify Leadership and Build Relationship", "Actively engage in the GCM Commercial Services leadership team, maintains excellent relationships, and ensures teamwork to achieve the objectives of", "Work with the GCM Commercial leaders to ensure that departmental initiatives are delivered collectively", "Drive team performance through clearly focusing effort through objectives and targets", "Ensuring that all people in the team are trained and equipped", "to excel in their roles and have all the tools to execute their daily activities and responsibilities", "Maintain adequate succession plans to ensure that our team is 'future-proofed'", "Create a culture which motivates and encourages team members to perform to the best of their ability"]}, "job_job_title": "Customer", "job_posting_language": "en", "job_onet_soc": "11101100", "job_onet_job_zone": "5", "job_occupational_categories": ["11-2021.00: Marketing Managers"], "job_naics_code": "7211", "job_naics_name": "Traveler Accommodation"}