{"job_id": "ekAS4G33qrZahLJ7AAAAAA==", "employer_name": "British Council", "employer_logo": "https://logowik.com/content/uploads/images/british-council.jpg", "employer_website": "http://www.britishcouncil.org", "employer_company_type": "Education", "job_publisher": "Jooble", "job_employment_type": "FULLTIME", "job_title": "Senior manager business development", "job_apply_link": "https://jooble.org/jdp/4298745707281999755", "job_apply_is_direct": false, "job_apply_quality_score": 0.5417, "apply_options": [{"publisher": "Jooble", "apply_link": "https://jooble.org/jdp/4298745707281999755", "is_direct": false}, {"publisher": "Institute Of Data Jobs", "apply_link": "https://jobs.institutedata.com/job/2552802/senior-manager-business-development/", "is_direct": true}], "job_description": "We support peace and prosperity by building connections, understanding and trust between people in the UK and countries worldwide.\n\nWe work directly with individuals to help them gain the skills, confidence and connections to transform their lives and shape a better world in partnership with the UK. We support them to build networks and explore creative ideas, to learn English, to get a high-quality education and to gain internationally recognised qualifications.\n\nWorking with people in over 200 countries and territories, we are on the ground in more than 100 countries. In 2021\u201322 we reached 650 million people.\n\nRole Purpose\n\nThe purpose of this role is to deliver the market-led, integrated Business Development & Sales plan aligned with Global/Regional Exams strategy, in order to leverage opportunities and create value. This role is ultimately responsible for building and managing demand, ensuring capacity fill, delivering income/surplus targets, and overseeing quality of the B2C customer experience. The postholder will build and manage key client accounts and partnerships across the country. The postholder will work closely with marketing and communications colleagues in country and within the region.\n\nMain Accountabilities\n\u2022 Adds value to key accounts and looks at opportunities for retention through cross-sell and other initiatives\n\u2022 Flags and addresses issues in delivery and proactively seeks solution for an amicable resolution\n\u2022 Practices Relationship Management, development and reviews (including mapping and delivering F2F touch-points, annual and quarterly reviews for big accounts)\n\u2022 Builds and develops networks around existing clients to cultivate segments\n\u2022 Account and stakeholder management\n\u2022 Manages and delivers in year Account Plan\n\u2022 Develops out of year Account Plan\n\u2022 Links with B2B support from Operations team to set and review quality of delivery to support account relationship.\n\u2022 Links with Marketing for targeted events, campaigns and collateral to support retention and value add\n\u2022 Undertakes contract review and refresh\n\u2022 Works to defined Account Relationship standards and frameworks, including an up-to-date records on relevant CRM system\n\u2022 Prioritises own work activities, from long terms plans into day to day activities.\n\u2022 Builds relationships and uses influence to work with others internally to grow the business\n\u2022 Market and customer intelligence\n\u2022 Ensures product/sector knowledge is up to date and forward thinking\n\u2022 Provides account/country specific input into market intelligence activities, innovation and business development/marketing plan/targets\n\u2022 Collects and shares trends and insights within market developments\n\u2022 Using standard procedures and templates, regularly records, analyses and reports on operational\n\u2022 activity levels and performance data, to support senior managers in making timely and effective business decisions that respond to operational needs.\n\nRole Requirements\n\u2022 University Degree in any subject or qualification in a relevant field. Business management or marketing qualifications is desireable.\n\u2022 4 years\u2019 relevant experience in BD role. Experience of working with the India public and private schools sector is desireable.\n\u2022 Demonstrable experience of sustaining and/or growing a product/service in line with strategic priorities for income and impact. Business development experience in the English & Exams / Education sector is desireable.\n\u2022 Significant experience collecting and analysing client/stakeholder feedback and using the data to identify business needs and obstacles; works to resolve them. Experience working with a dispersed team located in different cities or countries.\n\u2022 Takes a pro-active approach to identifying ways in which service can be improved, and takes these forward.\n\nEssential Core Skills For The Role\n\u2022 Communication and Influencing (Level 3)\n\u2022 Developing business (Level 2)\n\u2022 Managing accounts & relationships (Level 2)\n\nEnsure team members complete Safeguarding e-learning courses and adhere to the Safeguarding Policy and Code of Conduct.\n\nReport any safeguarding concerns or incidents to the National Safeguarding Manager Pakistan.\n\nFurther Information\n\nPay band: 6\n\nLocation: New Delhi, India\n\nNo. of Position: 1\n\nDepartment: Country/Cluster Commercial\n\nContract Type: Indefinite\n\nClosing Date: 18th March 2024, Monday at 23:59\n\nOur Values And Behaviours\n\nBritish council values and behaviours are applicable across our organisation, in all roles and at all levels. They are important because they say what we stand for at the British Council and help us to deliver our strategy. We use them to guide our decision making, as well as guiding how we treat one another and the people we work with. These will be assessed in the selection process.\n\nOur Values Are\n\nOpen and Committed; Expert and Inclusive; Optimistic and Bold.\n\nThe behaviours for each values pair can be found on our Intranet SharePoint site for internal staff and at our Careers portal for external applicants.\n\nA connected and trusted UK in a more connected and trusted world.\n\nEquality , Diversity, and Inclusion (EDI) Statement\n\nThe British Council is committed to policies and practices of equality, diversity and inclusion across everything we do. We support all staff to make sure their behaviour is consistent with this commitment. We want to address under representation and encourage applicants from under-represented groups, in particular, but not exclusively, on grounds of ethnicity and disability. All disabled applicants who meet the essential criteria are guaranteed an interview and we have Disability Confident Employer Status. We welcome discussions about specific requirements or adjustments to enable participation and engagement in our work and activities.\n\nThe British Council is committed to safeguarding children, young people and adults who we work with.\n\nWe believe that all children and adults everywhere in the world deserve to live in safe environments and have the right to be protected from all forms of abuse, maltreatment and exploitation as set out in article 19, UNCRC (United Nations Convention on the Rights of the Child) 1989.\n\nAppointment to positions where there is direct involvement with vulnerable groups will be dependent on thorough checks being completed; these will include qualification checks, reference checks, identity & criminal record checks in line with legal requirements and with the British Council\u2019s Safeguarding policies for Adults and Children.\n\nIf you have any problems with your application please email View email address on jobs.institutedata.com\n\nPlease note: Applications to this role can only be considered when made through the Apply section of our careers website. Our \u2018ASK HR\u2019 email is only to be used in case of a technical issue encountered when applying through the careers website. Emails with supporting statements and CV/Resumes sent to this email address will not be reviewed and will be deleted.", "job_is_remote": false, "job_posted_at_timestamp": 1709712791, "job_posted_at_datetime_utc": "2024-03-06T08:13:11.000Z", "job_city": null, "job_state": null, "job_country": "US", "job_latitude": 37.09024, "job_longitude": -95.71289, "job_benefits": null, "job_google_link": "https://www.google.com/search?gl=us&hl=en&rciv=jb&q=senior+manager+of+business+development&start=0&ibp=htl;jobs#fpstate=tldetail&htivrt=jobs&htiq=senior+manager+of+business+development&htidocid=ekAS4G33qrZahLJ7AAAAAA%3D%3D", "job_offer_expiration_datetime_utc": "2024-04-04T00:00:00.000Z", "job_offer_expiration_timestamp": 1712188800, "job_required_experience": {"no_experience_required": false, "required_experience_in_months": 48, "experience_mentioned": true, "experience_preferred": false}, "job_required_skills": null, "job_required_education": {"postgraduate_degree": false, "professional_certification": false, "high_school": false, "associates_degree": false, "bachelors_degree": false, "degree_mentioned": true, "degree_preferred": true, "professional_certification_mentioned": false}, "job_experience_in_place_of_education": false, "job_min_salary": null, "job_max_salary": null, "job_salary_currency": null, "job_salary_period": null, "job_highlights": {"Qualifications": ["University Degree in any subject or qualification in a relevant field", "Business management or marketing qualifications is desireable", "4 years\u2019 relevant experience in BD role", "Experience of working with the India public and private schools sector is desireable", "Demonstrable experience of sustaining and/or growing a product/service in line with strategic priorities for income and impact", "Business development experience in the English & Exams / Education sector is desireable", "Significant experience collecting and analysing client/stakeholder feedback and using the data to identify business needs and obstacles; works to resolve them", "Experience working with a dispersed team located in different cities or countries"], "Responsibilities": ["The purpose of this role is to deliver the market-led, integrated Business Development & Sales plan aligned with Global/Regional Exams strategy, in order to leverage opportunities and create value", "This role is ultimately responsible for building and managing demand, ensuring capacity fill, delivering income/surplus targets, and overseeing quality of the B2C customer experience", "The postholder will build and manage key client accounts and partnerships across the country", "The postholder will work closely with marketing and communications colleagues in country and within the region", "Adds value to key accounts and looks at opportunities for retention through cross-sell and other initiatives", "Flags and addresses issues in delivery and proactively seeks solution for an amicable resolution", "Practices Relationship Management, development and reviews (including mapping and delivering F2F touch-points, annual and quarterly reviews for big accounts)", "Builds and develops networks around existing clients to cultivate segments", "Account and stakeholder management", "Manages and delivers in year Account Plan", "Develops out of year Account Plan", "Links with B2B support from Operations team to set and review quality of delivery to support account relationship", "Links with Marketing for targeted events, campaigns and collateral to support retention and value add", "Undertakes contract review and refresh", "Works to defined Account Relationship standards and frameworks, including an up-to-date records on relevant CRM system", "Prioritises own work activities, from long terms plans into day to day activities", "Builds relationships and uses influence to work with others internally to grow the business", "Market and customer intelligence", "Ensures product/sector knowledge is up to date and forward thinking", "Provides account/country specific input into market intelligence activities, innovation and business development/marketing plan/targets", "Collects and shares trends and insights within market developments", "Using standard procedures and templates, regularly records, analyses and reports on operational", "activity levels and performance data, to support senior managers in making timely and effective business decisions that respond to operational needs", "Takes a pro-active approach to identifying ways in which service can be improved, and takes these forward", "Communication and Influencing (Level 3)", "Managing accounts & relationships (Level 2)", "Ensure team members complete Safeguarding e-learning courses and adhere to the Safeguarding Policy and Code of Conduct", "Report any safeguarding concerns or incidents to the National Safeguarding Manager Pakistan"]}, "job_job_title": "Manager business", "job_posting_language": "en", "job_onet_soc": "11202100", "job_onet_job_zone": "4", "job_naics_code": "61", "job_naics_name": "Education"}