{"job_id": "rTyETgSc870jEzJ0AAAAAA==", "employer_name": "H.B. Fuller", "employer_logo": "https://lookaside.fbsbx.com/lookaside/crawler/media/?media_id=100063519221621", "employer_website": "http://www.hbfuller.com", "employer_company_type": "Manufacturing", "job_publisher": "Talentify", "job_employment_type": "FULLTIME", "job_title": "Business Development Manager - Construction Adhesives", "job_apply_link": "https://www.talentify.io/job/business-development-manager-construction-adhesives---hb-fuller-r23-0000001989", "job_apply_is_direct": false, "job_apply_quality_score": 0.5016, "apply_options": [{"publisher": "Talentify", "apply_link": "https://www.talentify.io/job/business-development-manager-construction-adhesives---hb-fuller-r23-0000001989", "is_direct": false}], "job_description": "H.B. Fuller is a leading global adhesives provider focusing on perfecting adhesives, sealants and other specialty chemicals across all industries throughout the world. While our products are virtually invisible, they play a vital role in ensuring the quality of modern life and we are committed to connecting what matters to solve some of the world's biggest adhesion challenges.\n\nThe Business development manager (BDM) position is expected to grow and retain HB Fuller's market share and customer base in Construction adhesives market segments focused into Flooring, Roofing, Building envelope and Cryogenic Insulation for Oil&Gas / Process industries in India while achieving profit sales targets.\n\nThe BDM expected to be HB Fuller\u2019s field-based application expert, with a high level of knowledge and expertise in the Construction Adhesive market to cover India Region. He must be able to quantify the value of our products and capable of adjusting customer machinery / field applications to enable our products to run as effectively as possible.\n\nThe BDM works very closely with the Management / Technical Manager / Segment Manager / Sales Teams /Technical &R&D to support the top accounts & opportunities, and any key partners, such as Distributors. All activity should be aligned with the SBU business objectives.\n\nThe BDM plays a key role in innovation, both in identifying opportunities in the market and communicating them into the HB Fuller organization and in bringing new products and technologies to the Sales Force and the market.\n\nThe BDM will be key in working with consultants of the industry to make specification of our products.\n\nThe BDM should work closely with Marketing to identify tools that help the Sales force be more effective in the field and then work with the Sales team to ensure the tools are understood and used.\n\nThe BDM needs to have a clear understanding of the HB Fuller Sales Process, Value Selling and the role that they play in both.\n\nThe BDM is expected to:\n\u2022 Ability to train & mentor entry / new sales roles;\n\u2022 Ability to teach customers on industry trends and is sought after by customers; may be viewed as an expert in certain areas;\n\u2022 Positive feedback frequently received by customers on level of service excellence; and\n\u2022 Accountable for delivering results\n\u2022 Develops and owns a strategic plan for own accounts, and drives the execution of the plan through expert communication, coordination of activities and influence of indirect resources;\n\u2022 Develops sales funnel for future growth opportunities;\n\u2022 One voice to the customer;\n\u2022 Drives and delivers HBF\u2019s commercial goals, optimizing share, price and profitability;\n\u2022 Anticipates and meets the needs of the customer;\n\u2022 Key Metric Options (agreed annually)\n\nTerritory Sales Plan\n\nContribution Margin\n\nVolume\n\nPrice\n\nWin / Loss Ratio\n\nSFDC Usage\n\nNew Business Development\n\n# of days dedicated to development of trainees / junior sales pros including leading modules in GSE classes\n\nConsistently applies sales process and use of all sales tools; and\n\nPRIMARY DUTIES\n\nCORE COMPETENCIES\n\u2022 Accountability for results\n\u2022 Customer focused \u2013 creating value\n\u2022 Demonstrates functional excellence\n\u2022 Demonstrates business acumen\n\u2022 Embraces change and innovation\n\u2022 Team Work\n\nACCOUNTABILITY FOR RESULTS\n\u2022 Sales Manager is accountable for delivering annual business results, aligned with business plan, sales, CM and volume\n\u2022 Growth \u2013 focuses effort on delivering growth and maintains existing business to deliver plan\n\u2022 Negotiates pricing and margin (aligned with the business) using value selling and the flip pricing tool to capture the optimum price and margin for HBF\n\u2022 Develops strategy and plan for short and long term to defend and grow the account, optimize profitability, and manage risk\n\u2022 Owns the contact matrix, ensuring that the expectations of all parties are set and met, internal & external\n\nCUSTOMER FOCUSED \u2013 CREATING VALUE\n\u2022 Drive customer intimacy by delivering HBF\u2019s value proposition tailored to meet the needs of the customer\n\u2022 Promote, quantify and expertly sell value, which differentiates HBF in the market and adds value to our customers\n\u2022 Consistently deliver value to our customers to realize customer loyalty and minimize erosion\n\u2022 Provide insight to the customer through expert application of knowledge in the industry Anticipate current and future needs of the customer through deep understanding of the customer\u2019s business\n\u2022 Promote and sell latest HBF products and technology thereby enhancing our position in the market as an innovative leader\n\u2022 Begin to demonstrate the ability to teach the customer on current market trends and issues, and is able to be a strategic partner to our customers on key issues such as raw material trends\n\nDEMONSTRATES FUNCTIONAL EXCELLENCE\n\u2022 Consistently manage activities to ensure all EHS requirements are followed\n\u2022 Leverage all sales processes, including salesforce.com, consistently applies the HBF sales process\n\u2022 Independently technically support the customer for standard needs, including running a product demonstration\n\u2022 Identify, develop and close new business opportunities and communicate forecasting needs to the business\n\u2022 Intimately know the territory/industry, including developing new business pipeline\n\u2022 Manage time by balancing effort between existing business and new business pipeline\n\u2022 Provide timely monthly reports and all necessary internal/external communication, and collaboration with other stakeholders\n\u2022 Understands competitive landscape and how to position HBF for advantage\n\nDEMONSTRATES BUSINESS ACUMEN\n\u2022 Implement business pricing strategy based on business guidelines, expertly delivers price increases thereby enabling prices to stick\n\u2022 Promote HBF products and technologies to optimize profitability\n\u2022 Allocate own resources in a planned and consistent way with the business strategy\n\u2022 Manage impact on profitability from terms and conditions, supply chain, days outstanding and other aspects\n\u2022 Manage T&E expenses to budget\n\nEMBRACES CHANGE AND INNOVATION\n\u2022 Provide voice of the customer feedback into the organization\n\u2022 Promote and sell innovative HBF technologies that create competitive advantage and optimize value for customers\n\u2022 Adapt easily to a dynamic environment and maintain high levels of motivation and engagement\n\u2022 Credible leader in the sales team that positively influences change\n\u2022 Provide high level insight from customer and industry back into the HBF organization\n\nSALES COMPETENCIES & BEHAVIORS\n\u2022 Negotiating: Master negotiator and is sought out by others within the organization to handle or advise the most complex customer situations. Consistently negotiates solutions with maximum value for HBF. Always seeks the win-win option.\n\u2022 Growing a sales territory: Has a deep understanding of business, financials, products/services, the market or the needs/ challenges of assigned territory/accounts; helps to develop colleagues' understanding and progress.\n\u2022 Presenting: Expert presenter that transitions skillfully within the presentation, and tactfully responds when faced with on-the-spot questions or challenges during or after presentations, and always progresses the agenda and teaches the customer.\n\u2022 Questioning / Listening: Accurately assesses underlying causes and/or concerns of customers' through enhanced listening skills; listens for potential using skills of deduction to customers' issues and concerns. Always in the here and now.\n\u2022 Communicating: Delivers accurate, clear, and concise messages that inform and frequently persuade audiences to take action. Adapts to the needs of diverse audiences and/or complex situations.\n\u2022 Prospecting: Maintains a large pipeline of referrals/prospects with awareness for long-term growth. Expert knowledge in territory enhances prospecting activity. Always works key prospects to optimize success. Tailors prospecting messages to individual and customers' needs. Finds and works with the key decision makers and influencers inside the prospective customer.\n\u2022 Being a team player: Outstanding team player and often sought after to join teams and able to exert influence and experience for the positive outcome of team activities.\n\nKNOWLEDGE\n\u2022 Technical knowledge of products & services\n\u2022 Operates as a resource and consultant to the customer in use of products and services\n\u2022 Sales Process & Sales Tools\n\u2022 Expert user of all sales tools and processes, which leads to higher rate of new business gains and consistently meets sales and margin goals\n\u2022 Trends in market & industry\n\u2022 Uses expert knowledge of trends in market and industry to differentiate and teach the customer\n\u2022 Supply chain\n\u2022 Selectively engages experts in supply chain to bring value and solve issues for customer\n\u2022 Equipment & application process\n\u2022 Has wide-spread contacts and knowledge of adhesive application equipment and manufacturing process equipment suppliers. Able to leverage for advantage, creating opportunities and problem solving.\n\u2022 Substrate\n\u2022 Has intimate knowledge and contacts of substrate suppliers. Understands adhesive interface with substrates.\n\u2022 Business Acumen\n\u2022 Uses knowledge to conduct business conversations at a higher level inside the customer. Comfortable operating at senior level inside the customer.\n\nEMPLOYEES SUPERVISED\n\nNone\nSCOPE OF RESPONSIBILITY\n\u2022 New business development activities represents ~40% of time. Focus is on top strategic opportunities for the business.\n\nMinimum Requirements\n\u2022 4 year college degree, with a technical/mechanical, marketing, or chemistry background preferred\n\u2022 7+ years of relevant sales experience; related industry and B2B experience, preferably with a chemistry background. Marketing and customer service experience also valued.\n\u2022 Must have a valid driver\u2019s license and be willing to travel.\n\u2022 Travel time depends on size/geography of the territory.\n\u2022 Ability to lift and carry up to 50 lbs.\n\nH.B. Fuller is an Equal Employment Opportunity employer and proud to have created a collaborative culture where employees around the world are seen, heard, and respected. All qualified applicants will receive consideration for employment without regard to race, color, religion, sex, sexual orientation, gender identity or expression, national origin, disability, or marital status or status as a protected veteran, or any other legally protected classification.\n\nH.B. Fuller does not accept unsolicited resumes from recruiters, employment agencies, or staffing firms. To conduct business with H.B. Fuller, a written service agreement must be executed by Human Resources prior to submitting any information relating to a potential candidate. Without a signed service agreement, H.B. Fuller shall not be obligated for payment of any fee or compensation.", "job_is_remote": true, "job_posted_at_timestamp": 1704931200, "job_posted_at_datetime_utc": "2024-01-11T00:00:00.000Z", "job_city": "South Bend", "job_state": "IN", "job_country": "US", "job_latitude": 41.67717, "job_longitude": -86.278625, "job_benefits": null, "job_google_link": "https://www.google.com/search?gl=us&hl=en&rciv=jb&q=manager+of+business+development&start=40&ibp=htl;jobs#fpstate=tldetail&htivrt=jobs&htiq=manager+of+business+development&htidocid=rTyETgSc870jEzJ0AAAAAA%3D%3D", "job_offer_expiration_datetime_utc": null, "job_offer_expiration_timestamp": null, "job_required_experience": {"no_experience_required": false, "required_experience_in_months": 84, "experience_mentioned": true, "experience_preferred": false}, "job_required_skills": null, "job_required_education": {"postgraduate_degree": false, "professional_certification": false, "high_school": false, "associates_degree": false, "bachelors_degree": false, "degree_mentioned": true, "degree_preferred": false, "professional_certification_mentioned": false}, "job_experience_in_place_of_education": false, "job_min_salary": null, "job_max_salary": null, "job_salary_currency": null, "job_salary_period": null, "job_highlights": {"Qualifications": ["Demonstrates business acumen", "Negotiating: Master negotiator and is sought out by others within the organization to handle or advise the most complex customer situations", "Growing a sales territory: Has a deep understanding of business, financials, products/services, the market or the needs/ challenges of assigned territory/accounts; helps to develop colleagues' understanding and progress", "Presenting: Expert presenter that transitions skillfully within the presentation, and tactfully responds when faced with on-the-spot questions or challenges during or after presentations, and always progresses the agenda and teaches the customer", "Questioning / Listening: Accurately assesses underlying causes and/or concerns of customers' through enhanced listening skills; listens for potential using skills of deduction to customers' issues and concerns", "Prospecting: Maintains a large pipeline of referrals/prospects with awareness for long-term growth", "Technical knowledge of products & services", "Expert user of all sales tools and processes, which leads to higher rate of new business gains and consistently meets sales and margin goals", "Uses expert knowledge of trends in market and industry to differentiate and teach the customer", "Has wide-spread contacts and knowledge of adhesive application equipment and manufacturing process equipment suppliers", "Has intimate knowledge and contacts of substrate suppliers. Understands adhesive interface with substrates", "Uses knowledge to conduct business conversations at a higher level inside the customer", "7+ years of relevant sales experience; related industry and B2B experience, preferably with a chemistry background", "Marketing and customer service experience also valued", "Must have a valid driver\u2019s license and be willing to travel", "Travel time depends on size/geography of the territory", "Ability to lift and carry up to 50 lbs"], "Responsibilities": ["The BDM works very closely with the Management / Technical Manager / Segment Manager / Sales Teams /Technical &R&D to support the top accounts & opportunities, and any key partners, such as Distributors", "All activity should be aligned with the SBU business objectives", "The BDM will be key in working with consultants of the industry to make specification of our products", "The BDM should work closely with Marketing to identify tools that help the Sales force be more effective in the field and then work with the Sales team to ensure the tools are understood and used", "Ability to train & mentor entry / new sales roles;", "Ability to teach customers on industry trends and is sought after by customers; may be viewed as an expert in certain areas;", "Positive feedback frequently received by customers on level of service excellence; and", "Develops and owns a strategic plan for own accounts, and drives the execution of the plan through expert communication, coordination of activities and influence of indirect resources;", "Develops sales funnel for future growth opportunities;", "One voice to the customer;", "Drives and delivers HBF\u2019s commercial goals, optimizing share, price and profitability;", "Anticipates and meets the needs of the customer;", "Key Metric Options (agreed annually)", "# of days dedicated to development of trainees / junior sales pros including leading modules in GSE classes", "Consistently applies sales process and use of all sales tools; and", "Customer focused \u2013 creating value", "Sales Manager is accountable for delivering annual business results, aligned with business plan, sales, CM and volume", "Growth \u2013 focuses effort on delivering growth and maintains existing business to deliver plan", "Negotiates pricing and margin (aligned with the business) using value selling and the flip pricing tool to capture the optimum price and margin for HBF", "Develops strategy and plan for short and long term to defend and grow the account, optimize profitability, and manage risk", "Owns the contact matrix, ensuring that the expectations of all parties are set and met, internal & external", "Drive customer intimacy by delivering HBF\u2019s value proposition tailored to meet the needs of the customer", "Promote, quantify and expertly sell value, which differentiates HBF in the market and adds value to our customers", "Consistently deliver value to our customers to realize customer loyalty and minimize erosion", "Provide insight to the customer through expert application of knowledge in the industry Anticipate current and future needs of the customer through deep understanding of the customer\u2019s business", "Promote and sell latest HBF products and technology thereby enhancing our position in the market as an innovative leader", "Begin to demonstrate the ability to teach the customer on current market trends and issues, and is able to be a strategic partner to our customers on key issues such as raw material trends", "DEMONSTRATES FUNCTIONAL EXCELLENCE", "Consistently manage activities to ensure all EHS requirements are followed", "Leverage all sales processes, including salesforce.com, consistently applies the HBF sales process", "Independently technically support the customer for standard needs, including running a product demonstration", "Identify, develop and close new business opportunities and communicate forecasting needs to the business", "Intimately know the territory/industry, including developing new business pipeline", "Manage time by balancing effort between existing business and new business pipeline", "Provide timely monthly reports and all necessary internal/external communication, and collaboration with other stakeholders", "Understands competitive landscape and how to position HBF for advantage", "Implement business pricing strategy based on business guidelines, expertly delivers price increases thereby enabling prices to stick", "Promote HBF products and technologies to optimize profitability", "Allocate own resources in a planned and consistent way with the business strategy", "Manage impact on profitability from terms and conditions, supply chain, days outstanding and other aspects", "Manage T&E expenses to budget", "Provide voice of the customer feedback into the organization", "Promote and sell innovative HBF technologies that create competitive advantage and optimize value for customers", "Adapt easily to a dynamic environment and maintain high levels of motivation and engagement", "Provide high level insight from customer and industry back into the HBF organization", "Communicating: Delivers accurate, clear, and concise messages that inform and frequently persuade audiences to take action", "Adapts to the needs of diverse audiences and/or complex situations", "Expert knowledge in territory enhances prospecting activity", "Always works key prospects to optimize success", "Tailors prospecting messages to individual and customers' needs", "Finds and works with the key decision makers and influencers inside the prospective customer", "Operates as a resource and consultant to the customer in use of products and services", "Selectively engages experts in supply chain to bring value and solve issues for customer", "New business development activities represents ~40% of time"]}, "job_job_title": "Development manager", "job_posting_language": "en", "job_onet_soc": "11202100", "job_onet_job_zone": "4", "job_naics_code": "32518", "job_naics_name": "Other Basic Inorganic Chemical Manufacturing"}