{"job_id": "stnOy36Md3avrnShAAAAAA==", "employer_name": "The Family Place", "employer_logo": "https://encrypted-tbn0.gstatic.com/images?q=tbn:ANd9GcR7ar9cP60Xv2pK7vhbCklR-u8-exef0cZ7-vAY&s=0", "employer_website": null, "employer_company_type": null, "job_publisher": "Indeed", "job_employment_type": "FULLTIME", "job_title": "Director of Development: Corporate and Retail Partnerships", "job_apply_link": "https://www.indeed.com/viewjob?jk=9911d3692d231c8b", "job_apply_is_direct": true, "job_apply_quality_score": 0.6134, "apply_options": [{"publisher": "Indeed", "apply_link": "https://www.indeed.com/viewjob?jk=9911d3692d231c8b", "is_direct": true}], "job_description": "POSITION TITLE: Director of Development: Corporate and Retail Partnerships\nSTATUS: Full Time\nFLSA STATUS Exempt (salaried)\nREPORTS TO: Chief Development Officer\nPROGRAM: Development\nLOCATION: Ann Moody Place\n\nPosition summary below is not inclusive of additional responsibilities.\n\nPosition Summary:\nThis high-energy, external role directs The Family Place\u2019s corporate strategy, including the largest signature fundraiser: Partners Card. This 30+ year-old shopping program raises more than $1.2M+ annually through retail partnerships, sponsorships, and individual card sales. This position also focuses on year-round corporate partnerships that support The Family Place\u2019s revenue, volunteer, and in-kind needs. The ideal candidate has worked in corporate engagement or retail partnerships, and has experience with public relations, marketing, and special events. If you have a passion for creating partnerships, as well as interest in leveraging technology to achieve efficiency and digital transformation, please apply!\n\nThis position reports to the CDO and will work closely with organizational leadership including the Executive Team, Board and external agency partners to expand the brand of The Family Place with corporate and retail partners.\n\nKey Responsibilities:\n\u2022 Grow and expand the Partners Card program including the following elements:\n\u2022 Build and maintain retail partner relations and solicitations\n\u2022 Identify sponsors, solicitation and stewardship\n\u2022 Cultivate relationships with Community Sellers identification, solicitation and stewardship\n\u2022 Manage Partners Card events from concept to completion\n\u2022 Lead and manage the development of collateral material, print production, digital tool kit\n\u2022 Coordinate advertising deadlines\n\u2022 Develop and implement communications, social media, and marketing plans to support Partners Card in partnership with public relations agency, internal special events leader, and development team.\n\u2022 Other duties related to Partners Card:\n\u2022 Manage correspondence and applications with 750+ participating retailers.\n\u2022 Lead Partners Card planning meetings and provide meeting minutes, maintain Partners Card records, notebooks, and files for special projects.\n\u2022 Respond to general requests for Partners Card information.\n\u2022 Oversee website and database support for Partners Card\n\nOther Duties:\n\u2022 Develop and maintain corporate partnerships/relationships on behalf of The Family Place.\n\u2022 Collaborate with Development Team on Corporate Events strategy, ensuring all relationships are focused on\n\u2022 Perform other job-related duties at the request of Development Team leaders and CEO.\n\nRequirements: Bachelor\u2019s degree in Marketing, Communications, or related field. Five plus years of retail/marketing/public relations/development/special events experience.\n\nLicenses and Certifications: Valid Texas Driver\u2019s License\n\nKnowledge, Skills, and Abilities:\n\u2022 Excellent level of project management, planning, budgeting, and financial tracking.\n\u2022 Knowledge and skill in managing donor databases.\n\u2022 Knowledge and skill of advanced MS Office Suite, Excel, Desktop Publishing and proficient in Acrobat Adobe.\n\u2022 Knowledge of branding strategies and social media development and execution.\n\u2022 Skilled in analytical and technical writing techniques and proficient in research.\n\u2022 Ability to communicate effectively with all levels of management, coworkers, stakeholders, donors, board members, etc. in a professional manner.\n\u2022 Ability to multitask, coordinate, and deliver results within a specific timeframe.\n\u2022 Ability to perform under pressure and meet demanding deadlines while maintaining flexibility.\n\u2022 Ability to prioritize and self-motivate to accomplish and surpass goals.\n\u2022 Ability to work some evenings and weekends, as needed.\n\u2022 Possess excellent organizational, written, interpersonal, and communication skills.\n\nMental and Physical Abilities: Ability to drive vehicle to event venues, retailers, donors, sponsors, and other meetings.\n\nWorking Conditions: Duties are usually performed seated with occasional periods of standing or walking. Limited physical effort is required associated with lifting and carrying objects (less than 25 pounds). Work may be performed in but is not limited to an office environment.\n\nEssential Functions: This job description should not be interpreted as all inclusive. It is intended to identify the essential functions and requirements of this position. The incumbents may be requested to perform job-related responsibilities and tasks other than those stated in this job description.\n\nJob Type: Full-time", "job_is_remote": false, "job_posted_at_timestamp": 1707841262, "job_posted_at_datetime_utc": "2024-02-13T16:21:02.000Z", "job_city": null, "job_state": null, "job_country": "US", "job_latitude": 37.09024, "job_longitude": -95.71289, "job_benefits": null, "job_google_link": "https://www.google.com/search?gl=us&hl=en&rciv=jb&q=manager+of+brand+partnerships&start=50&ibp=htl;jobs#fpstate=tldetail&htivrt=jobs&htiq=manager+of+brand+partnerships&htidocid=stnOy36Md3avrnShAAAAAA%3D%3D", "job_offer_expiration_datetime_utc": "2024-07-11T00:15:11.000Z", "job_offer_expiration_timestamp": 1720656911, "job_required_experience": {"no_experience_required": false, "required_experience_in_months": 60, "experience_mentioned": true, "experience_preferred": false}, "job_required_skills": null, "job_required_education": {"postgraduate_degree": false, "professional_certification": false, "high_school": false, "associates_degree": false, "bachelors_degree": false, "degree_mentioned": true, "degree_preferred": true, "professional_certification_mentioned": true}, "job_experience_in_place_of_education": false, "job_min_salary": null, "job_max_salary": null, "job_salary_currency": null, "job_salary_period": null, "job_highlights": {"Qualifications": ["Requirements: Bachelor\u2019s degree in Marketing, Communications, or related field", "Five plus years of retail/marketing/public relations/development/special events experience", "Licenses and Certifications: Valid Texas Driver\u2019s License", "Excellent level of project management, planning, budgeting, and financial tracking", "Knowledge and skill in managing donor databases", "Knowledge and skill of advanced MS Office Suite, Excel, Desktop Publishing and proficient in Acrobat Adobe", "Knowledge of branding strategies and social media development and execution", "Skilled in analytical and technical writing techniques and proficient in research", "Ability to communicate effectively with all levels of management, coworkers, stakeholders, donors, board members, etc. in a professional manner", "Ability to multitask, coordinate, and deliver results within a specific timeframe", "Ability to perform under pressure and meet demanding deadlines while maintaining flexibility", "Ability to prioritize and self-motivate to accomplish and surpass goals", "Ability to work some evenings and weekends, as needed", "Possess excellent organizational, written, interpersonal, and communication skills", "Mental and Physical Abilities: Ability to drive vehicle to event venues, retailers, donors, sponsors, and other meetings", "Limited physical effort is required associated with lifting and carrying objects (less than 25 pounds)"], "Responsibilities": ["This position reports to the CDO and will work closely with organizational leadership including the Executive Team, Board and external agency partners to expand the brand of The Family Place with corporate and retail partners", "Grow and expand the Partners Card program including the following elements:", "Build and maintain retail partner relations and solicitations", "Identify sponsors, solicitation and stewardship", "Cultivate relationships with Community Sellers identification, solicitation and stewardship", "Manage Partners Card events from concept to completion", "Lead and manage the development of collateral material, print production, digital tool kit", "Coordinate advertising deadlines", "Develop and implement communications, social media, and marketing plans to support Partners Card in partnership with public relations agency, internal special events leader, and development team", "Other duties related to Partners Card:", "Manage correspondence and applications with 750+ participating retailers", "Lead Partners Card planning meetings and provide meeting minutes, maintain Partners Card records, notebooks, and files for special projects", "Respond to general requests for Partners Card information", "Oversee website and database support for Partners Card", "Develop and maintain corporate partnerships/relationships on behalf of The Family Place", "Collaborate with Development Team on Corporate Events strategy, ensuring all relationships are focused on", "Perform other job-related duties at the request of Development Team leaders and CEO"], "Benefits": ["This 30+ year-old shopping program raises more than $1.2M+ annually through retail partnerships, sponsorships, and individual card sales"]}, "job_job_title": null, "job_posting_language": "en", "job_onet_soc": "11202100", "job_onet_job_zone": "4"}