{"job_id": "NKh8TMWMGMoaAdw0AAAAAA==", "employer_name": "LanguageBird", "employer_logo": "https://encrypted-tbn0.gstatic.com/images?q=tbn:ANd9GcQ9XNK-Rc_l-xVc7q_MSLVEuLL7eDk44o8bU067&s=0", "employer_website": null, "employer_company_type": null, "job_publisher": "LinkedIn", "job_employment_type": "FULLTIME", "job_title": "Assistant Director of Partnerships and Business Development", "job_apply_link": "https://www.linkedin.com/jobs/view/assistant-director-of-partnerships-and-business-development-at-languagebird-3852340917", "job_apply_is_direct": false, "job_apply_quality_score": 0.6388, "apply_options": [{"publisher": "LinkedIn", "apply_link": "https://www.linkedin.com/jobs/view/assistant-director-of-partnerships-and-business-development-at-languagebird-3852340917", "is_direct": false}, {"publisher": "Indeed", "apply_link": "https://www.indeed.com/viewjob?jk=e30313a10236df04", "is_direct": true}], "job_description": "Position Summary: We are a premier, accredited online language school seeking an Assistant Director of Partnerships and Business Development to play a pivotal role in cultivating new partnerships and fostering growth within existing ones across various sectors, including schools/universities, professionals, and organizations. This role demands exceptional communication and interpersonal skills, alongside the ability to deliver compelling presentations. Strong organizational and project management capabilities are also essential.\n\nResponsibilities:\n\nDevelop, Maintain, and Nurture Relationships\n\u2022 Provide excellent internal and external customer service through professional, consistent, and effective communication\n\u2022 Call on (in person and virtually) education and business professionals (school counselors/administrators, IECs, HR Directors, etc.) to spread awareness of the LanguageBird brand and generate referrals\n\u2022 Complete 20 or more outreach meetings per month\n\u2022 Develop and execute individualized nurturing plans for each relationship (ex. seasonal gifts, thank you cards for referrals, personalized invitations to events, etc.)\n\u2022 Generate 30 new professional referral sources each academic year\n\u2022 Grow partner and connector portfolio\n\u2022 Manage partner and connector pipeline\n\nManage Data\n\u2022 Maintain updated CRM (HubSpot) and provide sales pipeline forecast and weekly activity reports\n\u2022 Track and update deals based on their sales cycle\n\u2022 Input and monitor partner enrollment information in CRM\n\u2022 Support Director of Admissions with organizational projects in CRM\n\u2022 Import Purchase Order documents into HubSpot deals\n\nServe as Brand Ambassador and Elevate Brand Awareness\n\u2022 Effectively communicate and promote the LanguageBird brand with all current and prospective referral sources\n\u2022 Practice triangle training regularly to finesse and perfect messaging for all stakeholders\n\u2022 Plan the promotion and execution of other lead-generating events and activities (webinars, conferences, etc.)\n\u2022 Innovate and initiate ideas on how to generate more referrals\n\nRequirements:\n\u2022 Bachelor\u2019s degree in business, marketing, sales, education, or equivalent work experience\n\u2022 Must reside in and be eligible to work in the United States of America\n\u2022 Willingness to work non-traditional hours with possible evening and weekend meetings/activities\n\u2022 Knowledge of and experience with sales process, minimum 2 years\n\u2022 Deep respect for teaching and learning\n\u2022 Ability to self-direct and collaborate with a team working remotely\n\u2022 Ability to prioritize and manage complex projects with multiple deadlines\n\u2022 Ability to think critically, problem-solve, backwards plan, analyze, and use data\n\u2022 Commitment to constant self-improvement and professional development\n\u2022 Willingness to go above and beyond to deliver white-glove experience to students/parents\n\u2022 Strong skills with Windows, including Word, Excel, PowerPoint, One Note, Teams, and Outlook\n\u2022 Experience with CRM systems (eg. HubSpot) preferred\n\u2022 Must be able to travel by air or motor vehicle to conferences, trainings, and meetings as needed/required\n\nCompetencies (job-related): Honest, organized, follows-through on commitments, persistent, proactive, calm under pressure, strategic and critical thinker, strong listening skills, excellent verbal and written communication skills, strong presentation and meeting facilitation skills, influential, knowledgeable, entrepreneurial, and energetic\n\nCompetencies (cultural): Intelligent, creative, adaptable, continuous learner committed to self-improvement, passionate, enthusiastic, engaging, personable, positive, punctual, and confident Tips: Provide a summary of the role, what success in the position looks like, and how this role fits into the organization overall.", "job_is_remote": true, "job_posted_at_timestamp": 1710347081, "job_posted_at_datetime_utc": "2024-03-13T16:24:41.000Z", "job_city": null, "job_state": null, "job_country": "US", "job_latitude": 37.09024, "job_longitude": -95.71289, "job_benefits": null, "job_google_link": "https://www.google.com/search?gl=us&hl=en&rciv=jb&q=manager+of+brand+partnerships&start=80&ibp=htl;jobs#fpstate=tldetail&htivrt=jobs&htiq=manager+of+brand+partnerships&htidocid=NKh8TMWMGMoaAdw0AAAAAA%3D%3D", "job_offer_expiration_datetime_utc": "2024-04-12T16:24:41.000Z", "job_offer_expiration_timestamp": 1712939081, "job_required_experience": {"no_experience_required": false, "required_experience_in_months": null, "experience_mentioned": true, "experience_preferred": true}, "job_required_skills": null, "job_required_education": {"postgraduate_degree": false, "professional_certification": false, "high_school": false, "associates_degree": false, "bachelors_degree": true, "degree_mentioned": true, "degree_preferred": true, "professional_certification_mentioned": false}, "job_experience_in_place_of_education": false, "job_min_salary": null, "job_max_salary": null, "job_salary_currency": null, "job_salary_period": null, "job_highlights": {"Qualifications": ["Strong organizational and project management capabilities are also essential", "Bachelor\u2019s degree in business, marketing, sales, education, or equivalent work experience", "Must reside in and be eligible to work in the United States of America", "Willingness to work non-traditional hours with possible evening and weekend meetings/activities", "Knowledge of and experience with sales process, minimum 2 years", "Deep respect for teaching and learning", "Ability to self-direct and collaborate with a team working remotely", "Ability to prioritize and manage complex projects with multiple deadlines", "Ability to think critically, problem-solve, backwards plan, analyze, and use data", "Commitment to constant self-improvement and professional development", "Willingness to go above and beyond to deliver white-glove experience to students/parents", "Strong skills with Windows, including Word, Excel, PowerPoint, One Note, Teams, and Outlook", "Experience with CRM systems (eg", "Competencies (job-related): Honest, organized, follows-through on commitments, persistent, proactive, calm under pressure, strategic and critical thinker, strong listening skills, excellent verbal and written communication skills, strong presentation and meeting facilitation skills, influential, knowledgeable, entrepreneurial, and energetic", "Competencies (cultural): Intelligent, creative, adaptable, continuous learner committed to self-improvement, passionate, enthusiastic, engaging, personable, positive, punctual, and confident Tips: Provide a summary of the role, what success in the position looks like, and how this role fits into the organization overall"], "Responsibilities": ["Develop, Maintain, and Nurture Relationships", "Provide excellent internal and external customer service through professional, consistent, and effective communication", "Call on (in person and virtually) education and business professionals (school counselors/administrators, IECs, HR Directors, etc.)", "to spread awareness of the LanguageBird brand and generate referrals", "Complete 20 or more outreach meetings per month", "Develop and execute individualized nurturing plans for each relationship (ex. seasonal gifts, thank you cards for referrals, personalized invitations to events, etc.)", "Generate 30 new professional referral sources each academic year", "Grow partner and connector portfolio", "Manage partner and connector pipeline", "Manage Data", "Maintain updated CRM (HubSpot) and provide sales pipeline forecast and weekly activity reports", "Track and update deals based on their sales cycle", "Input and monitor partner enrollment information in CRM", "Support Director of Admissions with organizational projects in CRM", "Import Purchase Order documents into HubSpot deals", "Serve as Brand Ambassador and Elevate Brand Awareness", "Effectively communicate and promote the LanguageBird brand with all current and prospective referral sources", "Practice triangle training regularly to finesse and perfect messaging for all stakeholders", "Plan the promotion and execution of other lead-generating events and activities (webinars, conferences, etc.)", "Innovate and initiate ideas on how to generate more referrals"]}, "job_job_title": "Assistant", "job_posting_language": "en", "job_onet_soc": "11202100", "job_onet_job_zone": "4"}