{"job_id": "_SN137gEj4h8wpIoAAAAAA==", "employer_name": "Wolters Kluwer", "employer_logo": "https://cdn.wolterskluwer.io/wk/fundamentals/1.15.2/logo/assets/medium.svg", "employer_website": "https://www.wolterskluwer.nl", "employer_company_type": "Computer Services", "job_publisher": "JobServe", "job_employment_type": "FULLTIME", "job_title": "Sales Training Manager", "job_apply_link": "https://www.jobserve.com/us/en/extjob/SALES-TRAINING-MANAGER-in-Sacramento-California-USA-0B6027695C6EF01C46/", "job_apply_is_direct": false, "job_apply_quality_score": 0.5645, "apply_options": [{"publisher": "JobServe", "apply_link": "https://www.jobserve.com/us/en/extjob/SALES-TRAINING-MANAGER-in-Sacramento-California-USA-0B6027695C6EF01C46/", "is_direct": false}, {"publisher": "USNLX Diversity Jobs - National Labor Exchange", "apply_link": "https://diversity.usnlx.com/sacramento-ca/sales-training-manager/925843EFA1CC4BCDA48C2830EF2CF82B/job/?vs=28", "is_direct": false}, {"publisher": "Hispanic Today", "apply_link": "https://hispanic-today.com/sacramento-ca/sales-training-manager/925843EFA1CC4BCDA48C2830EF2CF82B/job/", "is_direct": false}, {"publisher": "Nexxt", "apply_link": "https://www.nexxt.com/jobs/sales-training-manager-sacramento-ca-2654350921-job.html?aff=2ED44C72-8FD2-4B5D-BC54-2F623E88BE26", "is_direct": false}, {"publisher": "Sales Job Apply", "apply_link": "https://www.salesjobapply.com/job-in-Sacramento-California-USA/SALES-TRAINING-MANAGER-6330f69cf334f06876/", "is_direct": false}], "job_description": "Location : Remote - US only\n\nBasic Function\n\nThe Sales Training Manager (Field Coach) is responsible for developing and enhancing the skills of the sales team to drive revenue and achieve business objectives for the Professional Software suite, in particular our Tax & Audit solutions. The primary goal is to help new hires and existing sales representatives achieve/exceed quota and close business. They accomplish this by engaging with the sales team via 1:1 coaching, group trainings, and live customer meetings with new hires, existing sellers and Leaders. Training, coaching and development is provided to sales teams responsible for selling into the following markets: accounting and firms, professional CPA practitioners, financial institutions, and other professional services organizations. The Sales Training Manager should be well versed in the Accounting Industry and up to date with market trends. This position will interface with VPs, Directors, Managers, and other Learning & Development partners.\n\nEssential Duties and responsibilities\n\nAchieves Specific Sales Goals\n\u2022 Supports sales reps in ability to perform and achieve/exceed sales quotas for the Medium/Large Software Division\n\u2022 Drives performance and behavior based on established Key Performance Indicators\n\u2022 Partners with VP, Divisional Sales Managers and Learning & Development Partners to identify and execute on strategies that close skill and knowledge gaps for new hires, existing team members and front-line managers\n\u2022 Consistently assesses and re-aligns priorities and strategies to ensure decreased ramp time and increased productivity\n\u2022 Demonstrates ability to identify, analyze and provide solutions to problems/issues.\n\u2022 Partners with sales management as required in competitive analysis, business development reviews, product launches, and ongoing sales training\n\u2022 Communicate KPI data to Learning and Development team and Sales Leadership for continuous improvement of onboarding programs and sales representative effectiveness. Recommend areas of opportunity for sales representative improvement, help build training to address gaps.\n\nCoaches & Develops\n\u2022 Scales expertise via 1:1 and small group coaching, along with workshops, on the following for the Professional segment:\n\u2022 Gains knowledge by building relationships and soliciting feedback from key personas on what our solutions do and what they mean for our customers\n\u2022 Coaches sales representatives on identifying customer needs, (Recognize Needs) demo preparation, and evaluating the best solution based on customer requirements.\n\u2022 Effectively communicating the \"key\" value points of our solutions, why they matter and presenting value/ROI to the customer\n\u2022 Creates strategies to help reps maximize deals\n\u2022 Recommends best practices to reps for how to effectively position our solutions in competitive situations\n\u2022 Attends Sales calls as needed based upon specific prospect needs as well as to provide ongoing feedback and coaching\n\u2022 Leverages best practices in adult learning to ensure transfer of skill and knowledge\n\u2022 Maintains a high level of knowledge regarding all WK/CCH solutions in order to effectively coach & develop\n\u2022 Maintains a strong knowledge of competitive solutions and services, changing marketplace, and client needs.\n\u2022 Demonstrates exceptional time management and organization skills.\n\nOther Duties\n\nPerforms other duties as assigned by supervisor\n\nJob Qualifications Education\n\u2022 Bachelor's degree or equivalent OR, if no degree, 9 years in a sales, pre-sales, or post-sales environment. Master's preferred.\n\nExperience\n\nMinimum\n\nRequires 7-10 years of relevant experience including:\n\u2022 Minimum of 5-7 years' experience working in or supporting sales organizations (ie, a broad-based and business-oriented understanding of sales issues)\n\u2022 Must have strong tax and accounting background, preferably with audit experience\n\u2022 Knowledge of CCH Products and Services\n\u2022 Proven track record of providing direct guidance, coaching & mentoring to organizational stakeholders (eg, leaders and employees) seeking expert advice. Commercially minded.\n\u2022 Experience in public accounting or working with public accounting firms preferred.\n\u2022 Experience working in a remote/matrixed environment\n\u2022 Proficiency with Microsoft Office Suite (Word, Excel, PowerPoint, Outlook, Teams)\n\u2022 Experience working in a CRM (Salesforce.com preferred, and proficiency in reporting preferred)\n\nOther Knowledge, Skills, Abilities or Certifications:\n\u2022 Strong understanding of the business and the tax and accounting industry.\n\u2022 Depth of experience in CCH Audit, Tax and/or Firm Management solutions\n\u2022 Effective written and verbal communication skills, interacting with all levels of employees and management\n\u2022 Self-starter that takes initiative; seeks out and has ability to drive change through persuasion and leadership\n\u2022 Good analytical and critical thinking skills\n\u2022 Knowledge of territory planning and sales skills (software and database sales knowledge is preferred)\n\u2022 Ability to be agile and adapt to a changing environment\n\u2022 Creative and innovative\n\u2022 Ability to work independently and multitask\n\u2022 Demonstrated ability to work effectively in a team environment\n\u2022 Proficient in the use and maintenance of sales information and information databases. Experience with CRM software a plus\n\u2022 Excellent computer and software skills.\n\u2022 Project manages with a highly collaborative style, deadline sensitive high priority programs and deliverables with a team-focused attitude.\n\nTravel requirements 20% - ability to travel independently for client and internal meetings.\n\nPhysical Demands\n\nNormal office environment. May be a remote, home-based position.\n\nThe above statements are intended to describe the general nature and level of work being performed by most people assigned to this job. They re not intended to be an exhaustive list of all duties and responsibilities and requirements.\n\nEQUAL EMPLOYMENT OPPORTUNITY Wolters Kluwer U. S. Corporation and all of its subsidiaries, divisions and customer/business units is an Equal Opportunity/Affirmative Action employer. All qualified applicants will receive consideration for employment without regard to race, color, religion, sex, sexual orientation, gender identity, national origin, disability, or protected veteran status.", "job_is_remote": false, "job_posted_at_timestamp": 1709948520, "job_posted_at_datetime_utc": "2024-03-09T01:42:00.000Z", "job_city": "Sacramento", "job_state": "CA", "job_country": "US", "job_latitude": 38.581573, "job_longitude": -121.4944, "job_benefits": null, "job_google_link": "https://www.google.com/search?gl=us&hl=en&rciv=jb&q=manager+of+sales+training&start=0&ibp=htl;jobs#fpstate=tldetail&htivrt=jobs&htiq=manager+of+sales+training&htidocid=_SN137gEj4h8wpIoAAAAAA%3D%3D", "job_offer_expiration_datetime_utc": "2024-04-08T01:42:00.000Z", "job_offer_expiration_timestamp": 1712540520, "job_required_experience": {"no_experience_required": false, "required_experience_in_months": 84, "experience_mentioned": true, "experience_preferred": true}, "job_required_skills": null, "job_required_education": {"postgraduate_degree": false, "professional_certification": false, "high_school": false, "associates_degree": false, "bachelors_degree": false, "degree_mentioned": true, "degree_preferred": false, "professional_certification_mentioned": true}, "job_experience_in_place_of_education": false, "job_min_salary": null, "job_max_salary": null, "job_salary_currency": null, "job_salary_period": null, "job_highlights": {"Qualifications": ["Bachelor's degree or equivalent OR, if no degree, 9 years in a sales, pre-sales, or post-sales environment", "Requires 7-10 years of relevant experience including:", "Minimum of 5-7 years' experience working in or supporting sales organizations (ie, a broad-based and business-oriented understanding of sales issues)", "Must have strong tax and accounting background, preferably with audit experience", "Knowledge of CCH Products and Services", "Proven track record of providing direct guidance, coaching & mentoring to organizational stakeholders (eg, leaders and employees) seeking expert advice", "Experience working in a remote/matrixed environment", "Proficiency with Microsoft Office Suite (Word, Excel, PowerPoint, Outlook, Teams)", "Other Knowledge, Skills, Abilities or Certifications:", "Strong understanding of the business and the tax and accounting industry", "Depth of experience in CCH Audit, Tax and/or Firm Management solutions", "Effective written and verbal communication skills, interacting with all levels of employees and management", "Self-starter that takes initiative; seeks out and has ability to drive change through persuasion and leadership", "Good analytical and critical thinking skills", "Ability to be agile and adapt to a changing environment", "Creative and innovative", "Ability to work independently and multitask", "Demonstrated ability to work effectively in a team environment", "Proficient in the use and maintenance of sales information and information databases", "Excellent computer and software skills", "Project manages with a highly collaborative style, deadline sensitive high priority programs and deliverables with a team-focused attitude", "Travel requirements 20% - ability to travel independently for client and internal meetings"], "Responsibilities": ["The primary goal is to help new hires and existing sales representatives achieve/exceed quota and close business", "They accomplish this by engaging with the sales team via 1:1 coaching, group trainings, and live customer meetings with new hires, existing sellers and Leaders", "Training, coaching and development is provided to sales teams responsible for selling into the following markets: accounting and firms, professional CPA practitioners, financial institutions, and other professional services organizations", "The Sales Training Manager should be well versed in the Accounting Industry and up to date with market trends", "This position will interface with VPs, Directors, Managers, and other Learning & Development partners", "Achieves Specific Sales Goals", "Supports sales reps in ability to perform and achieve/exceed sales quotas for the Medium/Large Software Division", "Drives performance and behavior based on established Key Performance Indicators", "Partners with VP, Divisional Sales Managers and Learning & Development Partners to identify and execute on strategies that close skill and knowledge gaps for new hires, existing team members and front-line managers", "Consistently assesses and re-aligns priorities and strategies to ensure decreased ramp time and increased productivity", "Demonstrates ability to identify, analyze and provide solutions to problems/issues", "Partners with sales management as required in competitive analysis, business development reviews, product launches, and ongoing sales training", "Communicate KPI data to Learning and Development team and Sales Leadership for continuous improvement of onboarding programs and sales representative effectiveness", "Recommend areas of opportunity for sales representative improvement, help build training to address gaps", "Gains knowledge by building relationships and soliciting feedback from key personas on what our solutions do and what they mean for our customers", "Coaches sales representatives on identifying customer needs, (Recognize Needs) demo preparation, and evaluating the best solution based on customer requirements", "Effectively communicating the \"key\" value points of our solutions, why they matter and presenting value/ROI to the customer", "Creates strategies to help reps maximize deals", "Recommends best practices to reps for how to effectively position our solutions in competitive situations", "Attends Sales calls as needed based upon specific prospect needs as well as to provide ongoing feedback and coaching", "Leverages best practices in adult learning to ensure transfer of skill and knowledge", "Maintains a high level of knowledge regarding all WK/CCH solutions in order to effectively coach & develop", "Demonstrates exceptional time management and organization skills", "Performs other duties as assigned by supervisor"]}, "job_job_title": "Training manager", "job_posting_language": "en", "job_onet_soc": "11313100", "job_onet_job_zone": "4", "job_naics_code": "541512", "job_naics_name": "Computer Systems Design Services"}