{"job_id": "qhwXel_-sTW7yySpAAAAAA==", "employer_name": "Talkdesk", "employer_logo": "https://encrypted-tbn0.gstatic.com/images?q=tbn:ANd9GcR9SxmZu3FLJwtQh4caomYNc8s8itoF17ZXkq5V&s=0", "employer_website": null, "employer_company_type": null, "job_publisher": "VentureLoop", "job_employment_type": "FULLTIME", "job_title": "AI Strategic Sales Specialist", "job_apply_link": "https://www.ventureloop.com/ventureloop/jobdetail.php?jobid=2653992", "job_apply_is_direct": false, "job_apply_quality_score": 0.6729, "apply_options": [{"publisher": "VentureLoop", "apply_link": "https://www.ventureloop.com/ventureloop/jobdetail.php?jobid=2653992", "is_direct": false}], "job_description": "At Talkdesk, we are courageous innovators focused on redefining the customer experience, making the impossible possible for companies globally. We champion an inclusive and diverse culture representative of the communities in which we live and serve. And, we give back to our community by volunteering our time, supporting non-profits, and minimizing our global footprint. Each day, thousands of employees, customers, and partners all over the world trust Talkdesk to deliver a better way to great experiences.\n\nWe are recognized as a cloud contact center leader by many of the most influential research organizations, including Gartner and Forrester. With $498 million in total funding, a valuation of more than $10 Billion, and a ranking of #8 on the Forbes Cloud 100 list, now is the time to be part of the Talkdesk legacy to help accelerate our success in a new decade of transformational growth.\n\nAt Talkdesk, we embrace FAST, our fundamental operating principles that define who we are as an organization. These principles drive us to make the impossible possible. FAST: Focus + Accountability + Speed = Talkdesker.\n\u2022 Focus: Focus time, energy and attention on what is most impactful for the business and thoughtful about how and when to partner with others.\n\u2022 Accountability: Hold self and others accountable to meet commitments and drive results. Accept responsibility for successes and failures.\n\u2022 Speed: Execute with agility and urgency. Act promptly, decisively, and without delay. Make good and timely decisions that keep the organization moving forward.\n\u2022 Talkdesker: YOU!\n\nAs an AI Strategic Sales Specialist you will help lead the transformation of Talkdesk\u2019s sales motion to AI-first, spearheading large and/or complex AI opportunities and enabling our sales teams to scale with a set of repeatable best practices in order to accelerate AI revenue growth. If you want to join a hyper growth company that will impact an evolving industry, then come enjoy the ride.\n\nRESPONSIBILITIES:\n\nGo-to-Market Strategy: Partner with the AI Business Unit and other departments to define how Talkdesk is going to tackle the market and beat the competition:\n\u2022 Demonstrate advanced knowledge of the AI market and competition\n\u2022 Identify the target market, customers and buyers\n\u2022 Understand customer needs and pain points\n\u2022 Define use cases where Talkdesk can deliver unique business value and differentiation\n\u2022 Develop global and regional go-to-market strategies\n\nPipeline and Account Development: Drive new sales opportunities within our install base and new logos:\n\u2022 Create strategic plans to generate a strong pipeline, while meeting and exceeding sales targets\n\u2022 Develop new ways to cross sell, upsell and increase usage of our AI solutions within the customer install base\n\u2022 Develop new ways to accelerate sales of our AI solutions to new logo accounts\n\u2022 Support the sales teams with existing large and/or strategic AI opportunities across multiple verticals\n\u2022 Develop AI sales playbooks and necessary materials to empower the sales teams to scale through a set of repeatable best practices\n\nConvert Opportunities: Successfully drive AI engagements with prospects, customers, and partners in order to close significant revenue opportunities:\n\u2022 Build and maintain business and executive relationships with prospects, clients, and partners \u2013 engage customers in jointly addressing business priorities and objectives that align with their business needs and timelines\n\u2022 Develop and deliver \u201cart of the possible\u201d AI sales presentations and customized demos\n\u2022 Demonstrate deep domain knowledge of Talkdesk AI products and services \u2013 address customer objections, competitive differentiation and pricing questions\n\u2022 Execute against sales targets for an assigned territory\n\u2022 Accountable for accurate forecasting\n\nREQUIREMENTS:\n\u2022 Excellent communication, presentation, problem solving, analytical, and solution selling skills\n\u2022 Deep pre-existing network and successful track record of selling AI products (or adjacent) to that network\n\u2022 10+ years of sales experience, preferably in a B2B environment\n\u2022 4+ years of experience in Conversational AI / Intelligent Automation / Machine Learning\n\u2022 Solid understanding and experience selling into enterprise accounts - must have a \u201cHunter\u201d mindset with the ability to learn, adapt and improve constantly\n\u2022 Contact center/customer service technology experience\n\u2022 Prior success calling on executives in a highly competitive market\n\u2022 Proficient with web-based demo software and tools\n\u2022 Strong working knowledge of Salesforce\n\u2022 SaaS and Communications experience highly preferred\n\u2022 Articulate, passionate and committed to success\n\u2022 Strong understanding of channel partnerships and strategic relationships\n\u2022 Ability to travel 40% of the time\n\u2022 Bachelor\u2019s degree\n\nWORK ENVIRONMENT AND PHYSICAL REQUIREMENTS:\n\nPrimarily office-environment work, extended periods of sitting or standing, computer-based work. Limited lifting, and equipment usage limited to computer-related equipment (keyboards, mouse, etc.)\n\nThe Talkdesk story hinges on empathy and acceptance. It is the shared goal among all Talkdeskers to empower a new kind of customer hero through our innovative software solution, and we firmly believe that the best path to success for our mission is inclusivity, diversity, and genuine acceptance. To that end, we will hire, promote, work along, cheer for, bond with, and warmly welcome into the Talkdesk family all persons without regard to ethnic and racial identity, indigenous heritage, national origin, religion, gender, gender identity, gender expression, sexual orientation, age, disability, marital status, veteran status, genetic information, or any other legally protected status.", "job_is_remote": true, "job_posted_at_timestamp": 1708618820, "job_posted_at_datetime_utc": "2024-02-22T16:20:20.000Z", "job_city": null, "job_state": null, "job_country": "US", "job_latitude": 37.09024, "job_longitude": -95.71289, "job_benefits": null, "job_google_link": "https://www.google.com/search?gl=us&hl=en&rciv=jb&q=ai+specialist&start=20&ibp=htl;jobs#fpstate=tldetail&htivrt=jobs&htiq=ai+specialist&htidocid=qhwXel_-sTW7yySpAAAAAA%3D%3D", "job_offer_expiration_datetime_utc": "2024-04-22T00:00:00.000Z", "job_offer_expiration_timestamp": 1713744000, "job_required_experience": {"no_experience_required": false, "required_experience_in_months": 120, "experience_mentioned": true, "experience_preferred": true}, "job_required_skills": null, "job_required_education": {"postgraduate_degree": false, "professional_certification": false, "high_school": false, "associates_degree": false, "bachelors_degree": false, "degree_mentioned": true, "degree_preferred": false, "professional_certification_mentioned": false}, "job_experience_in_place_of_education": false, "job_min_salary": null, "job_max_salary": null, "job_salary_currency": null, "job_salary_period": null, "job_highlights": {"Qualifications": ["Excellent communication, presentation, problem solving, analytical, and solution selling skills", "Deep pre-existing network and successful track record of selling AI products (or adjacent) to that network", "10+ years of sales experience, preferably in a B2B environment", "4+ years of experience in Conversational AI / Intelligent Automation / Machine Learning", "Solid understanding and experience selling into enterprise accounts - must have a \u201cHunter\u201d mindset with the ability to learn, adapt and improve constantly", "Contact center/customer service technology experience", "Prior success calling on executives in a highly competitive market", "Proficient with web-based demo software and tools", "Strong working knowledge of Salesforce", "Articulate, passionate and committed to success", "Strong understanding of channel partnerships and strategic relationships", "Ability to travel 40% of the time", "Bachelor\u2019s degree", "Primarily office-environment work, extended periods of sitting or standing, computer-based work", "Limited lifting, and equipment usage limited to computer-related equipment (keyboards, mouse, etc.)"], "Responsibilities": ["Focus: Focus time, energy and attention on what is most impactful for the business and thoughtful about how and when to partner with others", "Accountability: Hold self and others accountable to meet commitments and drive results", "Accept responsibility for successes and failures", "Speed: Execute with agility and urgency", "Act promptly, decisively, and without delay", "Make good and timely decisions that keep the organization moving forward", "Go-to-Market Strategy: Partner with the AI Business Unit and other departments to define how Talkdesk is going to tackle the market and beat the competition:", "Demonstrate advanced knowledge of the AI market and competition", "Identify the target market, customers and buyers", "Understand customer needs and pain points", "Define use cases where Talkdesk can deliver unique business value and differentiation", "Develop global and regional go-to-market strategies", "Pipeline and Account Development: Drive new sales opportunities within our install base and new logos:", "Create strategic plans to generate a strong pipeline, while meeting and exceeding sales targets", "Develop new ways to cross sell, upsell and increase usage of our AI solutions within the customer install base", "Support the sales teams with existing large and/or strategic AI opportunities across multiple verticals", "Develop AI sales playbooks and necessary materials to empower the sales teams to scale through a set of repeatable best practices", "Convert Opportunities: Successfully drive AI engagements with prospects, customers, and partners in order to close significant revenue opportunities:", "Build and maintain business and executive relationships with prospects, clients, and partners \u2013 engage customers in jointly addressing business priorities and objectives that align with their business needs and timelines", "Develop and deliver \u201cart of the possible\u201d AI sales presentations and customized demos", "Demonstrate deep domain knowledge of Talkdesk AI products and services \u2013 address customer objections, competitive differentiation and pricing questions", "Execute against sales targets for an assigned territory", "Accountable for accurate forecasting"]}, "job_job_title": "Sales specialist", "job_posting_language": "en", "job_onet_soc": "15111100", "job_onet_job_zone": "5"}