{"job_id": "ve-NU4NJfwShHEigAAAAAA==", "employer_name": "PowerSchool", "employer_logo": "https://www.powerschool.com/wp-content/uploads/2022/05/powerschool-logo.png", "employer_website": "http://www.powerschool.com", "employer_company_type": null, "job_publisher": "Jooble", "job_employment_type": "FULLTIME", "job_title": "Education Business Consultant", "job_apply_link": "https://jooble.org/jdp/-1610674568144894844", "job_apply_is_direct": false, "job_apply_quality_score": 0.6543, "apply_options": [{"publisher": "Jooble", "apply_link": "https://jooble.org/jdp/-1610674568144894844", "is_direct": false}], "job_description": "Job Summary\n\nThe Education Impact Consultant is responsible for partnering with the client account team in support of clients to help them achieve success with the PowerSchool products utilized by students, school and district teachers, counselors and administrators. When a need is identified by the account team, the Education Business Consultant will engage with a client to share best practices and product knowledge to drive improved usage and adoption of the identified PowerSchool products. This role will work in coordination with the account team during various client touch points to discuss various aspects of the partnership, including but not limited to monitoring adoption of implemented software, consulting on product-specific best practices, aligning district goals to product solution usage, and mitigating risk identified by the account team. The Education Business Consultant will not have an assigned book of clients but will support clients in a designated geography on an as-needed basis. The primary objective of an Education Business Consultant is to strengthen the understanding and adoption of the customer's investment in PowerSchool solutions to ensure retention and continued valued partnership long term.\nResponsibilities\n\nEssential duties and responsibilities include the following. Reasonable accommodations may be made to enable individuals with disabilities to perform the essential functions.\n\u2022 Act as a client-facing subject matter expert for a solution area and assist with client product awareness, understanding and adoption\n\u2022 Serve as an adoption advisor to clients who need additional product support during their client journey\n\u2022 Meets with key client stakeholders identified by the CSM and/or account team to consult on adopting and using the implemented software. This consultation may involve sharing product-specific best practices, aligning district goals to product solution usage, and identifying and mitigating risk.\n\u2022 Partner with the CSM to help develop and track annual goals in alignment with the school/district mission, vision, and strategic plan.\n\u2022 Fulfill requests submitted by the account team for assistance with clients in their assigned territory.\n\u2022 Upon request, share reports and other data analysis to inform a client of their continued progress against high level goals.\n\u2022 Work cross-functionally to recognize areas of risk and identify solutions to optimize outcomes for customer retention.\n\u2022 Support the CSM on escalations that may require product-specific knowledge to ensure customer satisfaction and retention.\n\u2022 Upon request, engage with identified client to provide recommendations for optional product usage\n\u2022 Work across the Success team to support any customer meeting and/or review that requires product knowledge expertise for the discussion\n\u2022 Serve as an internal consultant to other projects functions related to solutions where EBC has expertise.\n\u2022 As needed, consult on PowerSchool implementation engagements post go-live to ensure client has access to ongoing resources to drive usage and adoption\n\u2022 Facilitate EBC-led user group webinars and act as product expert to guide webinar attendees to successfully learn about product releases, roadmap, seasonal product-specific topics, and solution area best practices.\n\u2022 All other duties as assigned by management.\nQualifications\n\nTo be considered for and to perform this job successfully, an individual must be able to perform each essential duty and responsibility satisfactorily. The requirements listed below are representative of the knowledge, skill and/or ability required.\n\nQualifications include:\n\u2022 Bachelor\u2019s degree required\n\u2022 Two (2) to Three (3) years of educational technology experience with proven ability to share best practices and strategies for driving adoption and usage of educational solutions.\n\u2022 Two (2) to Three (3) years of related experience with proven ability to help lead a multidisciplinary team, project operations, and cultivate business development opportunities.\n\u2022 School system experience in the areas of administration, student assessment, counseling, curriculum & instruction, information technology, finance, or business operations is strongly desired.\n\u2022 Data visualization and/or software implementation experience is a plus, particularly for PowerSchool products.\n\u2022 Experience with Gainsight and Salesforce is a plus.\n\u2022 Commitment to exceptional client service and confidently lead with credibility.\n\u2022 Flexible, self-starter possessing intellectual curiosity.\n\u2022 Creative problem-solving ability and a consultancy mindset.\n\u2022 Ability to move multiple engagements forward while working at a detailed level.\n\u2022 Able to follow, critically evaluate, and improve upon current processes.\n\u2022 Excellent organization and time management skills.\n\u2022 Excellent research and project management skills\n\u2022 Excellent oral presentation and written communication skills.\n\u2022 Excellent attention to detail and ability to work with large data sets with accurate results.\n\nExpert in MS Office Suite particularly PowerPoint, Excel, and Word.", "job_is_remote": true, "job_posted_at_timestamp": 1709379749, "job_posted_at_datetime_utc": "2024-03-02T11:42:29.000Z", "job_city": null, "job_state": null, "job_country": "US", "job_latitude": 37.09024, "job_longitude": -95.71289, "job_benefits": ["retirement_savings"], "job_google_link": "https://www.google.com/search?gl=us&hl=en&rciv=jb&q=business+development+consultant&start=40&ibp=htl;jobs#fpstate=tldetail&htivrt=jobs&htiq=business+development+consultant&htidocid=ve-NU4NJfwShHEigAAAAAA%3D%3D", "job_offer_expiration_datetime_utc": "2024-04-03T14:02:14.000Z", "job_offer_expiration_timestamp": 1712152934, "job_required_experience": {"no_experience_required": false, "required_experience_in_months": 24, "experience_mentioned": true, "experience_preferred": true}, "job_required_skills": null, "job_required_education": {"postgraduate_degree": false, "professional_certification": false, "high_school": false, "associates_degree": false, "bachelors_degree": false, "degree_mentioned": true, "degree_preferred": false, "professional_certification_mentioned": false}, "job_experience_in_place_of_education": false, "job_min_salary": null, "job_max_salary": null, "job_salary_currency": null, "job_salary_period": null, "job_highlights": {"Qualifications": ["To be considered for and to perform this job successfully, an individual must be able to perform each essential duty and responsibility satisfactorily", "Bachelor\u2019s degree required", "Two (2) to Three (3) years of educational technology experience with proven ability to share best practices and strategies for driving adoption and usage of educational solutions", "Two (2) to Three (3) years of related experience with proven ability to help lead a multidisciplinary team, project operations, and cultivate business development opportunities", "Commitment to exceptional client service and confidently lead with credibility", "Flexible, self-starter possessing intellectual curiosity", "Creative problem-solving ability and a consultancy mindset", "Ability to move multiple engagements forward while working at a detailed level", "Able to follow, critically evaluate, and improve upon current processes", "Excellent organization and time management skills", "Excellent research and project management skills", "Excellent oral presentation and written communication skills", "Excellent attention to detail and ability to work with large data sets with accurate results", "Expert in MS Office Suite particularly PowerPoint, Excel, and Word"], "Responsibilities": ["The Education Impact Consultant is responsible for partnering with the client account team in support of clients to help them achieve success with the PowerSchool products utilized by students, school and district teachers, counselors and administrators", "When a need is identified by the account team, the Education Business Consultant will engage with a client to share best practices and product knowledge to drive improved usage and adoption of the identified PowerSchool products", "This role will work in coordination with the account team during various client touch points to discuss various aspects of the partnership, including but not limited to monitoring adoption of implemented software, consulting on product-specific best practices, aligning district goals to product solution usage, and mitigating risk identified by the account team", "The Education Business Consultant will not have an assigned book of clients but will support clients in a designated geography on an as-needed basis", "Reasonable accommodations may be made to enable individuals with disabilities to perform the essential functions", "Act as a client-facing subject matter expert for a solution area and assist with client product awareness, understanding and adoption", "Serve as an adoption advisor to clients who need additional product support during their client journey", "Meets with key client stakeholders identified by the CSM and/or account team to consult on adopting and using the implemented software", "Partner with the CSM to help develop and track annual goals in alignment with the school/district mission, vision, and strategic plan", "Fulfill requests submitted by the account team for assistance with clients in their assigned territory", "Upon request, share reports and other data analysis to inform a client of their continued progress against high level goals", "Work cross-functionally to recognize areas of risk and identify solutions to optimize outcomes for customer retention", "Support the CSM on escalations that may require product-specific knowledge to ensure customer satisfaction and retention", "Upon request, engage with identified client to provide recommendations for optional product usage", "Work across the Success team to support any customer meeting and/or review that requires product knowledge expertise for the discussion", "Serve as an internal consultant to other projects functions related to solutions where EBC has expertise", "As needed, consult on PowerSchool implementation engagements post go-live to ensure client has access to ongoing resources to drive usage and adoption", "Facilitate EBC-led user group webinars and act as product expert to guide webinar attendees to successfully learn about product releases, roadmap, seasonal product-specific topics, and solution area best practices", "All other duties as assigned by management"]}, "job_job_title": "Business consultant", "job_posting_language": "en", "job_onet_soc": "13111100", "job_onet_job_zone": "5"}