{"job_id": "DW7lwA2ScRdlfD80AAAAAA==", "employer_name": "Mastercard", "employer_logo": "https://www.mastercard.us/content/dam/public/mastercardcom/na/us/en/homepage/Home/mc-logo-52.svg", "employer_website": "http://www.mastercard.com", "employer_company_type": "Finance", "job_publisher": "The Muse", "job_employment_type": "FULLTIME", "job_title": "Manager Business Development", "job_apply_link": "https://www.themuse.com/jobs/mastercard/manager-business-development-e2b647", "job_apply_is_direct": false, "job_apply_quality_score": 0.6706, "apply_options": [{"publisher": "The Muse", "apply_link": "https://www.themuse.com/jobs/mastercard/manager-business-development-e2b647", "is_direct": false}, {"publisher": "Jobs Trabajo.org", "apply_link": "https://us.trabajo.org/job-1373-20240211-7a299221c54b00ed7c66f386b2525516", "is_direct": false}], "job_description": "Our Purpose\n\nWe work to connect and power an inclusive, digital economy that benefits everyone, everywhere by making transactions safe, simple, smart and accessible. Using secure data and networks, partnerships and passion, our innovations and solutions help individuals, financial institutions, governments and businesses realize their greatest potential. Our decency quotient, or DQ, drives our culture and everything we do inside and outside of our company. We cultivate a culture of inclusion for all employees that respects their individual strengths, views, and experiences. We believe that our differences enable us to be a better team - one that makes better decisions, drives innovation and delivers better business results.\n\nTitle and Summary\n\nManager Business Development\n\nOverview:\nThe Commercial Solutions organization is looking for a strategic-minded, action-oriented individual to help grow the LAC region. This role reports into the Commercial Solutions Sales team. About Commercial Solutions: Commercial Solutions is an exciting and newly built organization focused on pursuing and tackling the outsized B2B payments opportunity where Mastercard is well positioned to win.\nDriving growth in B2B payments with new customers is amongst our highest priorities and greatest opportunities. Deepening our participation in carded commercial POS flows and B2B accounts payable flows is essential to realizing our ambitions in capturing new payments flows. While the opportunity is significant, these are new areas for us that will require new product offerings and go-to-market strategies, informed by the input and active participation of our customers who are most focused on this space, while also building new capabilities and relationships needed to increase revenue growth.\n\nMastercard is creating a new global business development team to drive our expansion into business-to-business payments in the Large & Mid-Market corporate segment, solving for their payment needs across the procurement cycle with current and future platforms and products and making our multi-rail vision a reality for B2B payments. The focus of this team is building and expanding the two-sided network of Buyers & Suppliers to deliver accelerated GDV & Revenue growth in our Large & Mid-Market Corporate segments\n\nRole\nThe Senior Account Manager position is responsible to deliver GDV & Net Revenue KPIs against the customers that are allocated to their portfolio.\n\n\u2022 Develop the sales pipeline, coordinating with product development and account management teams \u2022 Prospects, contacts. Enhances ongoing business development relationships (e.g., government, regulators, industry bodies)\n\u2022 Be responsible for setting sales strategies as it relates to customer accounts that are aligned with geography strategy and achieving sales goals that drive market share, volume and revenue growth.\n\u2022 Leads and manages existing customer relationships, and works to identify opportunities and customer needs\n\u2022 Be partners with customers to deliver customized solutions and comprehensive consulting support\n\u2022 Working in direct collaboration with our Account Management colleagues that manage/own customer relationships, the B2B Regional & Global product teams, Data & Services and other cross functional teams. Support the growth, maintenance, conversion and track a healthy pipeline of Large Market/B2B opportunities across all issuers, including new players in this space.\n\u2022 Undertake Direct-to-Corporate (D2C) activities by working directly with Large and Mid-Market corporates that have significant procurement activity. Assist them in identifying pain points in their procurement processes, articulate solutions that leverage Mastercard platforms & products and have them make the brand decision in favor of Mastercard. Once that is done, then in discussion with Regional B2B Head, take these prospective corporate customers to Issuers/FI partners in a completely agnostic manner and help them make decisions around which partners to go with.\n\u2022 Own deal implementation and go-live in partnership with B2B Program Managers where available or directly interface with Technical Account Managers to drive implementation of deals\n\u2022 Create, drive, and win deals with Financial Institution (FI) partners (for both card and invoice led flows) and own the response to RFPs\n\nSpecific Responsibilities\n\n\u2022 Contributes to the achievement of sales and net revenue targets\n\u2022 Assists with analysis of customer's business through profitability modeling, financial forecasting and competitive analysis\n\u2022 Assists in designing strategies, messaging and proposals for customers\n\u2022 Supports the management key customer relationships at manager levels\n\u2022 Collaborates with the account team and customers to plan, execute and monitor progress against annual business plans\n\u2022 Assists in local projects and cross-functional initiatives\n\u2022 Grow, maintain, convert, and track a healthy pipeline of Large Market/B2B opportunities across all issuers, including new players in this space. Meet and exceed KPIs on Pipeline Value, Conversion rate.\n\u2022 Support issuers through the LM/B2B journey by clearly and simply articulate the value MC can bring both around Product, D&S and other Services capabilities (Cyber & Intelligence, New Payment Platforms, etc.).\n\u2022 Take responsibility for training the sales teams inside the FI partners and supporting their ongoing product knowledge development to enable them to sell into their customer base.\n\u2022 Undertake Direct -to-Corporate (D2C) activities, working directly with Large Market/Mid-Market corporates that have significant procurement activity. Assist them in identifying pain points in their procurement processes, articulate solutions that leverage Mastercard platforms & products and have them make the brand decision in favor of Mastercard.\nOnce that is done, take these prospective LM/MM corporate customers to Issuers/FI partners in a completely agnostic manner and help them make decisions around which partners to go with.\n\u2022 Bring to bear the entire Mastercard capability set, across all functions, to close out deals\n\u2022 Develop and manage a Commercial BD events schedule\n\nKPIs\n\u2022 GDV\n\u2022 Net Revenue\n\u2022 Pipeline size & conversion of pipeline deals\n\u2022 Deal activation rates\n\u2022 Other strategic & tactical KPIs that may be added from time to time\n\nAll About You\n\u2022 Good knowledge of the Commercial Large Market segment and it's AP/Procure-to-Pay and AR/Order-to-Cash cycle pain points.\n\u2022 Working knowledge of the Commercial Card / Transaction Banking industry with a demonstrated experience in sales/product/customer management in these businesses.\n\u2022 Comprehensive experience executing and managing sales strategies for medium-sized accounts\n\u2022 Self-motivated with a demonstrated track record of success\n\u2022 Ability to interact with external clients\n\u2022 Successful salesperson with ability to generate and follow up on leads independently\n\u2022 Good communication skills and active participation to contribute to team settings\n\u2022 Proactivity, curiosity to learn and eagerness to innovate\n\u2022 Consistently delivered thoughtful market and business analysis for customer accounts\n\u2022 Demonstrated success in commercial management/relationship roles with a strong track record of success\n\u2022 Superior interpersonal and communications skills and an ability to bring together internal and external stakeholders to create solutions for customers and have them implemented.\n\u2022 Experience in id Strong network in the large client space and prior experience in engaging CXOs of large companies.\n\u2022 Successful salesperson with ability to generate and follow up on leads independently identifying strategic opportunities and of managing multiple stakeholder projects.\n\n\u2022 English and Spanish fluency required\n\nIn the US, Mastercard is an inclusive Equal Employment Opportunity employer that considers applicants without regard to gender, gender identity, sexual orientation, race, ethnicity, disabled or veteran status, or any other characteristic protected by law. If you require accommodations or assistance to complete the online application process, please contact reasonable_accommodation@mastercard.com and identify the type of accommodation or assistance you are requesting. Do not include any medical or health information in this email. The Reasonable Accommodations team will respond to your email promptly.\n\nCorporate Security Responsibility\n\nAll activities involving access to Mastercard assets, information, and networks comes with an inherent risk to the organization and, therefore, it is expected that every person working for, or on behalf of, Mastercard is responsible for information security and must:\n\u2022 Abide by Mastercard's security policies and practices;\n\u2022 Ensure the confidentiality and integrity of the information being accessed;\n\u2022 Report any suspected information security violation or breach, and\n\u2022 Complete all periodic mandatory security trainings in accordance with Mastercard's guidelines.\nIn line with Mastercard's total compensation philosophy and assuming that the job will be performed in the US, the successful candidate will be offered a competitive base salary based on location, experience and other qualifications for the role and may be eligible for an annual bonus or commissions depending on the role. Mastercard benefits for full time (and certain part time) employees generally include: insurance (including medical, prescription drug, dental, vision, disability, life insurance), flexible spending account and health savings account, paid leaves (including 16 weeks new parent leave, up to 20 paid days bereavement leave), 10 annual paid sick days, 10 or more annual paid vacation days based on level, 5 personal days, 10 annual paid U.S. observed holidays, 401k with a best-in-class company match, deferred compensation for eligible roles, fitness reimbursement or on-site fitness facilities, eligibility for tuition reimbursement, gender-inclusive benefits and many more.", "job_is_remote": false, "job_posted_at_timestamp": 1705019339, "job_posted_at_datetime_utc": "2024-01-12T00:28:59.000Z", "job_city": null, "job_state": null, "job_country": "US", "job_latitude": 37.09024, "job_longitude": -95.71289, "job_benefits": ["dental_coverage", "health_insurance", "paid_time_off", "retirement_savings"], "job_google_link": "https://www.google.com/search?gl=us&hl=en&rciv=jb&q=manager+of+business+development&start=10&ibp=htl;jobs#fpstate=tldetail&htivrt=jobs&htiq=manager+of+business+development&htidocid=DW7lwA2ScRdlfD80AAAAAA%3D%3D", "job_offer_expiration_datetime_utc": null, "job_offer_expiration_timestamp": null, "job_required_experience": {"no_experience_required": false, "required_experience_in_months": null, "experience_mentioned": true, "experience_preferred": false}, "job_required_skills": null, "job_required_education": {"postgraduate_degree": false, "professional_certification": false, "high_school": false, "associates_degree": false, "bachelors_degree": false, "degree_mentioned": false, "degree_preferred": false, "professional_certification_mentioned": false}, "job_experience_in_place_of_education": false, "job_min_salary": null, "job_max_salary": null, "job_salary_currency": null, "job_salary_period": null, "job_highlights": {"Qualifications": ["Working knowledge of the Commercial Card / Transaction Banking industry with a demonstrated experience in sales/product/customer management in these businesses", "Comprehensive experience executing and managing sales strategies for medium-sized accounts", "Ability to interact with external clients", "Good communication skills and active participation to contribute to team settings", "Proactivity, curiosity to learn and eagerness to innovate", "Consistently delivered thoughtful market and business analysis for customer accounts", "Demonstrated success in commercial management/relationship roles with a strong track record of success", "Superior interpersonal and communications skills and an ability to bring together internal and external stakeholders to create solutions for customers and have them implemented", "Experience in id Strong network in the large client space and prior experience in engaging CXOs of large companies", "Successful salesperson with ability to generate and follow up on leads independently identifying strategic opportunities and of managing multiple stakeholder projects", "English and Spanish fluency required"], "Responsibilities": ["The Commercial Solutions organization is looking for a strategic-minded, action-oriented individual to help grow the LAC region", "This role reports into the Commercial Solutions Sales team", "The Senior Account Manager position is responsible to deliver GDV & Net Revenue KPIs against the customers that are allocated to their portfolio", "Develop the sales pipeline, coordinating with product development and account management teams", "Prospects, contacts", "Enhances ongoing business development relationships (e.g., government, regulators, industry bodies)", "Be responsible for setting sales strategies as it relates to customer accounts that are aligned with geography strategy and achieving sales goals that drive market share, volume and revenue growth", "Leads and manages existing customer relationships, and works to identify opportunities and customer needs", "Be partners with customers to deliver customized solutions and comprehensive consulting support", "Working in direct collaboration with our Account Management colleagues that manage/own customer relationships, the B2B Regional & Global product teams, Data & Services and other cross functional teams", "Support the growth, maintenance, conversion and track a healthy pipeline of Large Market/B2B opportunities across all issuers, including new players in this space", "Assist them in identifying pain points in their procurement processes, articulate solutions that leverage Mastercard platforms & products and have them make the brand decision in favor of Mastercard", "Once that is done, then in discussion with Regional B2B Head, take these prospective corporate customers to Issuers/FI partners in a completely agnostic manner and help them make decisions around which partners to go with", "Own deal implementation and go-live in partnership with B2B Program Managers where available or directly interface with Technical Account Managers to drive implementation of deals", "Create, drive, and win deals with Financial Institution (FI) partners (for both card and invoice led flows) and own the response to RFPs", "Contributes to the achievement of sales and net revenue targets", "Assists with analysis of customer's business through profitability modeling, financial forecasting and competitive analysis", "Assists in designing strategies, messaging and proposals for customers", "Supports the management key customer relationships at manager levels", "Collaborates with the account team and customers to plan, execute and monitor progress against annual business plans", "Assists in local projects and cross-functional initiatives", "Meet and exceed KPIs on Pipeline Value, Conversion rate", "Support issuers through the LM/B2B journey by clearly and simply articulate the value MC can bring both around Product, D&S and other Services capabilities (Cyber & Intelligence, New Payment Platforms, etc.)", "Take responsibility for training the sales teams inside the FI partners and supporting their ongoing product knowledge development to enable them to sell into their customer base", "Undertake Direct -to-Corporate (D2C) activities, working directly with Large Market/Mid-Market corporates that have significant procurement activity", "Bring to bear the entire Mastercard capability set, across all functions, to close out deals", "Develop and manage a Commercial BD events schedule", "Other strategic & tactical KPIs that may be added from time to time", "Abide by Mastercard's security policies and practices;", "Ensure the confidentiality and integrity of the information being accessed;", "Report any suspected information security violation or breach, and", "Complete all periodic mandatory security trainings in accordance with Mastercard's guidelines"], "Benefits": ["In line with Mastercard's total compensation philosophy and assuming that the job will be performed in the US, the successful candidate will be offered a competitive base salary based on location, experience and other qualifications for the role and may be eligible for an annual bonus or commissions depending on the role", "Mastercard benefits for full time (and certain part time) employees generally include: insurance (including medical, prescription drug, dental, vision, disability, life insurance), flexible spending account and health savings account, paid leaves (including 16 weeks new parent leave, up to 20 paid days bereavement leave), 10 annual paid sick days, 10 or more annual paid vacation days based on level, 5 personal days, 10 annual paid U.S. observed holidays, 401k with a best-in-class company match, deferred compensation for eligible roles, fitness reimbursement or on-site fitness facilities, eligibility for tuition reimbursement, gender-inclusive benefits and many more"]}, "job_job_title": "Manager business", "job_posting_language": "en", "job_onet_soc": "11202100", "job_onet_job_zone": "4", "job_naics_code": "522110", "job_naics_name": "Commercial Banking"}