{"job_id": "wVSrzcbCjntPloytAAAAAA==", "employer_name": "Ledge Lounger", "employer_logo": "http://t0.gstatic.com/images?q=tbn:ANd9GcT-_94aDS4PKTydNJofsgBpANT0uKMrQV_S0x7W72mMw6SBcwFJ", "employer_website": "http://ledgeloungers.com", "employer_company_type": null, "job_publisher": "Media Bistro", "job_employment_type": "FULLTIME", "job_title": "Director of Marketing", "job_apply_link": "https://www.mediabistro.com/jobs/210947441-director-of-marketing", "job_apply_is_direct": false, "job_apply_quality_score": 0.5727, "apply_options": [{"publisher": "Media Bistro", "apply_link": "https://www.mediabistro.com/jobs/210947441-director-of-marketing", "is_direct": false}], "job_description": "Founded in 2011, Ledge Lounger Inc. (\"Ledge\") is a pioneering luxury pool and patio furniture company that has set new standards in outdoor living. With a strong commitment to innovation, quality, and elegant design, Ledge has quickly risen to prominence in the industry. Our core values -Loyalty, Ethics, Drive, Grace, and Evolve- underpin every aspect of our business, and we're dedicated to fostering a positive and collaborative work environment where these values thrive.Over the years, Ledge has earned numerous accolades, including multiple appearances on the Inc. 5000 list for fastest growing companies and the prestigiousGlobal Awardfrom Good Design , a testament to our exceptional craftsmanship and design principles. Additionally, Ledge has continuously appeared on Houston's50Best Places to Worklists for the past 6 years in a row. As we continue to evolve and inspire outdoor spaces worldwide, our passion for quality, creativity, and customer satisfaction remains at the forefront of our journey.Job Overview:Are you an experienced Marketing Leader with a passion for planning and executing marketing campaigns that drive business growth while upholding our core values ofLoyalty, Ethics, Drive, Grace,andEvolve ? Ledge Lounger is seeking aDirector of Marketingto develop and execute integrated D2C/B2B marketing plans, lead product marketing, public relations, partnerships, awareness and direct response marketing, research and intelligence. Reporting to the Chief Marketing Officer, this role will lead a team of passionate and talented individuals and agency partners.Key Responsibilities:Partnering with the CMO, develop and execute the organization's 12-month marketing strategy, aligning it with overall business goals and objectives. This annual calendar will include products, pricing, promotions, sales channels, and messaging.Translate the marketing plan into Revenue and Expense forecasts. Continuously assess the return on investment for marketing campaigns and adjust strategies accordingly.Establish and maintain marketing operations processes to enhance efficiency and agility, fostering strong internal department relationships and coordinating with external vendors.Product Marketing including new product launch plans, product messaging and prioritization throughout the calendar year.Public Relations planning, media and influencer relations, develop and execute market facing content, narratives and storytelling, media coverage, and affiliate media support.B2B Marketing including planning and execution of trade shows, events, marketing and sales support materials.Brand Partnerships, product integrations, and organic social (including establishment of brand ambassador program).Brand Awareness and Direct Response media planning and execution.D2C Research and Intelligence including consumer and competitor insights, market trends, reporting and analytics.Lead and mentor a team of marketing professionals and agencies, fostering a culture of creativity, innovation, and collaboration.Provide regular updates to senior management on the performance of marketing initiatives, budget utilization, and strategic progress.RequirementsBachelor's degree in marketing, advertising, business, or a related field. MBA or advanced degree is a plus.Minimum of 8-10 years progressive Marketing experience; and minimum 5 years leading internal teams and external partners.Self-motivated leader that is purposeful, decisive, adaptive, and works well in entrepreneurial, high growth environments.Ability to think strategically while also functionally leading a team to drive execution delivering results. This is a \"sleeves rolled up company and position\".Strong analytical skills with the ability to interpret data and make data-driven decisions, while adhering to our values.Expertise in budget management and financial forecasting.Excellent oral and written communication skills.Creative thinking and problem-solving abilities that resonate with our values.Strong leadership, coaching and team management skills.Aptitude to work collaboratively across departments.Ability to travel up to 20% of the time.At Ledge, we value diversity and inclusion and are committed to providing equal employment opportunities to all individuals. We offer a competitive salary, benefits package, and the opportunity to work with a dynamic team in a positive and supportive work environment.", "job_is_remote": false, "job_posted_at_timestamp": 1710165600, "job_posted_at_datetime_utc": "2024-03-11T14:00:00.000Z", "job_city": null, "job_state": null, "job_country": "US", "job_latitude": 37.09024, "job_longitude": -95.71289, "job_benefits": null, "job_google_link": "https://www.google.com/search?gl=us&hl=en&rciv=jb&q=director+of+brand+partnerships&start=40&ibp=htl;jobs#fpstate=tldetail&htivrt=jobs&htiq=director+of+brand+partnerships&htidocid=wVSrzcbCjntPloytAAAAAA%3D%3D", "job_offer_expiration_datetime_utc": null, "job_offer_expiration_timestamp": null, "job_required_experience": {"no_experience_required": false, "required_experience_in_months": 96, "experience_mentioned": true, "experience_preferred": false}, "job_required_skills": null, "job_required_education": {"postgraduate_degree": false, "professional_certification": false, "high_school": false, "associates_degree": false, "bachelors_degree": false, "degree_mentioned": true, "degree_preferred": true, "professional_certification_mentioned": false}, "job_experience_in_place_of_education": false, "job_min_salary": null, "job_max_salary": null, "job_salary_currency": null, "job_salary_period": null, "job_highlights": {"Qualifications": ["RequirementsBachelor's degree in marketing, advertising, business, or a related field", "Minimum of 8-10 years progressive Marketing experience; and minimum 5 years leading internal teams and external partners.Self-motivated leader that is purposeful, decisive, adaptive, and works well in entrepreneurial, high growth environments", "Ability to think strategically while also functionally leading a team to drive execution delivering results", "This is a \"sleeves rolled up company and position\".Strong analytical skills with the ability to interpret data and make data-driven decisions, while adhering to our values", "Expertise in budget management and financial forecasting", "Excellent oral and written communication skills", "Creative thinking and problem-solving abilities that resonate with our values", "Strong leadership, coaching and team management skills", "Aptitude to work collaboratively across departments", "Ability to travel up to 20% of the time"], "Responsibilities": ["Ledge Lounger is seeking aDirector of Marketingto develop and execute integrated D2C/B2B marketing plans, lead product marketing, public relations, partnerships, awareness and direct response marketing, research and intelligence", "Reporting to the Chief Marketing Officer, this role will lead a team of passionate and talented individuals and agency partners", "Key Responsibilities:Partnering with the CMO, develop and execute the organization's 12-month marketing strategy, aligning it with overall business goals and objectives", "This annual calendar will include products, pricing, promotions, sales channels, and messaging", "Translate the marketing plan into Revenue and Expense forecasts", "Continuously assess the return on investment for marketing campaigns and adjust strategies accordingly", "Establish and maintain marketing operations processes to enhance efficiency and agility, fostering strong internal department relationships and coordinating with external vendors", "Product Marketing including new product launch plans, product messaging and prioritization throughout the calendar year", "Public Relations planning, media and influencer relations, develop and execute market facing content, narratives and storytelling, media coverage, and affiliate media support.B2B Marketing including planning and execution of trade shows, events, marketing and sales support materials", "Brand Partnerships, product integrations, and organic social (including establishment of brand ambassador program)", "Lead and mentor a team of marketing professionals and agencies, fostering a culture of creativity, innovation, and collaboration", "Provide regular updates to senior management on the performance of marketing initiatives, budget utilization, and strategic progress"], "Benefits": ["We offer a competitive salary, benefits package, and the opportunity to work with a dynamic team in a positive and supportive work environment"]}, "job_job_title": "Director_of marketing", "job_posting_language": "en", "job_onet_soc": "11202100", "job_onet_job_zone": "4"}