{"job_id": "71GcT7BUn_pvq0RFAAAAAA==", "employer_name": "Camgian", "employer_logo": null, "employer_website": "http://www.camgian.com", "employer_company_type": null, "job_publisher": "Jooble", "job_employment_type": "FULLTIME", "job_title": "Senior AI Engineer", "job_apply_link": "https://jooble.org/jdp/-5480952774840873514", "job_apply_is_direct": false, "job_apply_quality_score": 0.5355, "apply_options": [{"publisher": "Jooble", "apply_link": "https://jooble.org/jdp/-5480952774840873514", "is_direct": false}], "job_description": "Camgian is looking to expand its development organization with the addition of a Senior AI Engineer. We are focused on applying state-of-the-art Artificial Intelligence, Machine Learning, Computer Vision, and Deep Learning technologies to advance decision support products in the government and commercial markets. This is a hands-on technical position that involves the development, training, and validation of AI, ML, CV & DL based algorithms and models. Teamwork, flexibility, and willingness to continuously learn new concepts & technologies are critical requirements for this position. Candidate must demonstrate strong technical, leadership, and communication skills and must be able to effectively lead a small to medium sized team.\n\nQualifications\nBachelor\u2019s Degree (Computer Science, Computer Engineering, Statistics, or Mathematics)\nProficiency in Python with a strong programming background\nStrong Knowledge in AI, ML, and DL theory and concepts\nExperience developing, training, and validating AI models to solve real world problems\n5+ years progressive professional experience\nUnited States Citizenship\n\nDesired Skills\nMaster\u2019s or PhD in a computer science related discipline\nExperience with developing and deploying ML models into products and services\nExperience with AI frameworks such as TensorFlow, PyTorch, scikit-learn and/or OpenCV strongly desired\nExperience with tools such as NumPy, SciPy, Pandas, Matplotlib, MATLAB\nStrong analytical skills and creative problem solving ability\nUnderstanding of Agile development methodology\nExcellent written and verbal communication skills\n\nResponsibilities\nArchitect, design, develop, and test critical product features and sub-systems ensuring high quality\nLead a team of engineers in algorithm/model design and development\nProvide mentorship and guidance to junior engineers\nTrack project/product milestones and releases ensuring schedule and budget are met\nPrepare for and hold technical reviews to present your work to the company\nPractice agile development focused on methodologies such as continuous integration\nLead continuous process and productivity improvements in the team\nEngage in professional development activities to enhance your skillset\n\nExceptional work ethic, willingness to learn, tenacity not to quit, aptitude to surpass, and strong desire to work in a fast-paced environment are necessary for success. Collaboration and cross pollination with other teams will be frequent; thus communication, openness, and willingness to share both success and failure is a must. We are a team-centric organization, there are no individuals, we win and lose together.\n\nCamgian offers a competitive salary, fun work environment, fringe benefits, and an equity opportunity.\n\nCamgian Culture and Core Value Traits\nAbility to work as part of a team while maintaining independent thinking\nSelf-driven and self-starter in addition to excellent communication skills\nThinking outside the box and an aptitude for innovation and problem solving\nAlways willing to explore the other side of fear, be challenged and to crave cutting edge technologies", "job_is_remote": false, "job_posted_at_timestamp": 1710566030, "job_posted_at_datetime_utc": "2024-03-16T05:13:50.000Z", "job_city": "New York", "job_state": "NY", "job_country": "US", "job_latitude": 40.712776, "job_longitude": -74.005974, "job_benefits": null, "job_google_link": "https://www.google.com/search?gl=us&hl=en&rciv=jb&q=ai+engineer&start=10&ibp=htl;jobs#fpstate=tldetail&htivrt=jobs&htiq=ai+engineer&htidocid=71GcT7BUn_pvq0RFAAAAAA%3D%3D", "job_offer_expiration_datetime_utc": "2024-04-16T06:38:32.000Z", "job_offer_expiration_timestamp": 1713249512, "job_required_experience": {"no_experience_required": false, "required_experience_in_months": 60, "experience_mentioned": true, "experience_preferred": false}, "job_required_skills": null, "job_required_education": {"postgraduate_degree": false, "professional_certification": false, "high_school": false, "associates_degree": false, "bachelors_degree": false, "degree_mentioned": true, "degree_preferred": false, "professional_certification_mentioned": false}, "job_experience_in_place_of_education": false, "job_min_salary": null, "job_max_salary": null, "job_salary_currency": null, "job_salary_period": null, "job_highlights": {"Qualifications": ["Teamwork, flexibility, and willingness to continuously learn new concepts & technologies are critical requirements for this position", "Candidate must demonstrate strong technical, leadership, and communication skills and must be able to effectively lead a small to medium sized team", "Bachelor\u2019s Degree (Computer Science, Computer Engineering, Statistics, or Mathematics)", "Proficiency in Python with a strong programming background", "Strong Knowledge in AI, ML, and DL theory and concepts", "Experience developing, training, and validating AI models to solve real world problems", "5+ years progressive professional experience", "United States Citizenship", "Master\u2019s or PhD in a computer science related discipline", "Experience with developing and deploying ML models into products and services", "Experience with tools such as NumPy, SciPy, Pandas, Matplotlib, MATLAB", "Strong analytical skills and creative problem solving ability", "Understanding of Agile development methodology", "Excellent written and verbal communication skills", "Exceptional work ethic, willingness to learn, tenacity not to quit, aptitude to surpass, and strong desire to work in a fast-paced environment are necessary for success", "Collaboration and cross pollination with other teams will be frequent; thus communication, openness, and willingness to share both success and failure is a must", "Ability to work as part of a team while maintaining independent thinking", "Self-driven and self-starter in addition to excellent communication skills", "Thinking outside the box and an aptitude for innovation and problem solving", "Always willing to explore the other side of fear, be challenged and to crave cutting edge technologies"], "Responsibilities": ["Architect, design, develop, and test critical product features and sub-systems ensuring high quality", "Lead a team of engineers in algorithm/model design and development", "Provide mentorship and guidance to junior engineers", "Track project/product milestones and releases ensuring schedule and budget are met", "Prepare for and hold technical reviews to present your work to the company", "Practice agile development focused on methodologies such as continuous integration", "Lead continuous process and productivity improvements in the team", "Engage in professional development activities to enhance your skillset"]}, "job_job_title": "Engineer", "job_posting_language": "en", "job_onet_soc": "15111100", "job_onet_job_zone": "5"}