{"job_id": "7TERCUuZXtKHGUoLAAAAAA==", "employer_name": "Transamerica", "employer_logo": "https://www.accuquote.com/wp-content/uploads/2015/11/TA_LFT_rgb.jpg", "employer_website": "http://www.transamerica.com", "employer_company_type": "Finance", "job_publisher": "LinkedIn", "job_employment_type": "FULLTIME", "job_title": "Director Strategic Partnerships - Employee Benefits", "job_apply_link": "https://www.linkedin.com/jobs/view/director-strategic-partnerships-employee-benefits-at-transamerica-3813297634", "job_apply_is_direct": false, "job_apply_quality_score": 0.7319, "apply_options": [{"publisher": "LinkedIn", "apply_link": "https://www.linkedin.com/jobs/view/director-strategic-partnerships-employee-benefits-at-transamerica-3813297634", "is_direct": false}, {"publisher": "Indeed", "apply_link": "https://www.indeed.com/viewjob?jk=e528186af2562cf7", "is_direct": false}, {"publisher": "Jobgether", "apply_link": "https://jobgether.com/offer/65d29b1306daf9374a00af29-director-strategic-partnerships---employee-benefits", "is_direct": false}, {"publisher": "Talentify", "apply_link": "https://www.talentify.io/job/director-strategic-partnerships-employee-benefits---transamerica-r20051872", "is_direct": false}, {"publisher": "Jobright AI", "apply_link": "https://jobright.ai/jobs/info/65b2a9a185649f6b3e8d0211", "is_direct": false}], "job_description": "Job Family\n\nRegional / Field Sales\n\nAbout Us\n\nAt Transamerica, hard work, innovative thinking, and personal accountability are qualities we honor and reward. We understand the potential unleashed by leveraging the talents of a diverse workforce. We embrace an environment where employees enjoy a balance between their careers, families, communities, and personal interests.\n\nUltimately, we appreciate the uniqueness of a company where talented professionals work collaboratively in a positive environment \u2014 one focused on helping people look forward and plan for the best life possible while providing tools and solutions that make it easier to get there.\n\n\u202f \u202f\n\nTransamerica is a part of Aegon, an integrated, diversified, international financial services group. The Aegon companies employ over 21,500 people and have approximately 31.7 million customers.* For more information, visit\u202fwww.transamerica.com.\n\nWho We Are\n\n\u202f\n\nTransamerica has been making financial services available to the many, not just the few, for more than 100 years. We\u2019re a leading provider of life insurance, retirement, and investment solutions, serving millions of customers throughout the United States. Transamerica\u2019s dedicated professionals focus on helping people live their best lives through saving, investing, and protecting their loved ones. Transamerica is dedicated to building America\u2019s leading middle market life insurance and retirement company, providing a broad range of quality individual life insurance policies, workplace supplemental insurance benefits, workplace retirement plans, individual retirement accounts, and investment products, including mutual funds, annuities, stable value solutions, as well as investment management services.\n\nWhat We Do\n\nTransamerica is organized by lines of business (Life Insurance, Annuities, Mutual Funds, Retirement Plans, and Employee Benefits), which are supported by Transamerica Corporate (Corporate Development; Finance; Internal Audit; Legislative, Regulatory & Policy; Office of the CEO; People and Places; Brand; Corporate Affairs; Risk; and Technology).\n\nJob Description Summary\n\nJob Profile Summary\n\nDevelop executive level strategic partnerships with employee benefits target/stewardship firms. Drive channel connectivity to support the growth of medium-term plan results for Transamerica Employee Benefits group and voluntary products. Act as the subject matter expert on the Transamerica go-to-market strategy.\n\nResponsibilities\n\nJob Description\n\u2022 Develop and evolve relationships with target/stewardship firms, enrollment technology partners, and partnering carriers that drive revenue and value to Transamerica.\n\u2022 Initiate Partner Business Plans: Business overview (markets they serve, product focus, cross over with TA, carrier market share, etc.); annual goals (activity, submitted premium, paid premium); roles and responsibilities; contact mapping.\n\u2022 Develop, manage, and report on firm level activity (quarterly updates), RFP activity, sales, firm supplemental compensation agreement management, and act as liaison for the financial reporting area.\n\u2022 Manage market updates outlining product and service enhancements, state approval updates, third party partnerships (HSA, PTO Exchange, benefit admin partners, tech fee offset partner programs, etc.).\n\u2022 Partner with mid-market, large-market and wholesale-market sales teams on contact mapping, host producer engagement events (product spotlight webinars, educational programs, thought leadership events), and support office level engagement strategies.\n\u2022 Partner with Marketing and Events teams to develop annual calendars for industry and target firm events (thought leadership engagement); manage process, attendees, agendas and appropriate follow up.\n\u2022 Participate in and attend industry association memberships/board and attend annual events.\n\u2022 Work with retirement sales and client executive teams to build foundations for effective cross selling of employee benefits.\n\u2022 Partner with internal Account Management, Marketing, Product, Operations and Actuarial teams to provide client deliverables.\n\u2022 Identify market trends for development of new products, distribution outlets, and segments for Transamerica portfolio.\n\u2022 Meet annual growth targets at firm level (10% annually as an example).\n\nQualifications\n\u2022 Bachelor\u2019s degree in a business-related field or equivalent experience\n\u2022 Eight years of business development or relationship management experience, preferably on a national level\n\u2022 Five years of employee benefits sales experience in the employee benefits industry working with brokers, consultants, agents, and benefits technology platform firms\n\u2022 Thorough knowledge of the employee benefits marketplace\n\u2022 Advanced sales skills to provide consultative solutions\n\u2022 Excellent written/verbal communication and public speaking skills\n\u2022 Self-motivated and innovative thinker\n\u2022 Ability to manage multiple projects and deadlines\n\u2022 Ability to work as part of a team\n\u2022 Proficiency in MS Office (Word, Excel, PowerPoint, Outlook)\n\nPreferred Qualifications\n\u2022 Employee benefits product development experience\n\u2022 Employee benefits administration and enrollment industry experience\n\u2022 Client implementation experience\n\nWorking Conditions\n\u2022 Office of hybrid office/remote environment\n\u2022 Extensive travel (40-60%)\n\nCompensation\n\u2022 Please note that the compensation information that follows is a good faith estimate for this position only and is provided pursuant to applicable pay transparency and compensation posting laws. It is estimated based on what a successful candidate might be paid in certain Company locations.**\n\nThe Salary for this position generally ranges between $85,000 - $110,000 annually. This range is an estimate, based on potential qualifications and operational needs. Salary may vary above and below the stated amounts, as permitted by applicable law.\n\nCommissions:\n\nThis position may be eligible to earn commissions based on applicable sales incentive plan(s). All details pertaining to the calculation and payment of those commissions are available in the individual provisions of the sales incentive plan that applies.\n\nAdditionally, this position is typically eligible for an Annual Bonus based on the Company Bonus Plan/Individual Performance and is at the Company\u2019s discretion.\n\n#IND123\n\nWhat We Offer\n\nFor eligible employees, we offer a comprehensive benefits package designed to support both the personal and financial well-being of our employees.\n\nCompensation Benefits\n\u2022 Competitive Pay\n\u2022 Bonus for Eligible Employees\n\nBenefits Package\n\u2022 Pension Plan\n\u2022 401k Match\n\u2022 Employee Stock Purchase Plan\n\u2022 Tuition Reimbursement\n\u2022 Disability Insurance\n\u2022 Medical Insurance\n\u2022 Dental Insurance\n\u2022 Vision Insurance\n\u2022 Employee Discounts\n\u2022 Career Training & Development Opportunities\n\nHealth and Work/Life Balance Benefits\n\u2022 Paid Time Off starting at 160 hours annually for employees in their first year of service.\n\u2022 Ten (10) paid holidays per year (typically mirroring the New York Stock Exchange (NYSE) holidays).\n\u2022 Be Well Company holistic wellness program, which includes Wellness Coaching and Reward Dollars\n\u2022 Parental Leave \u2013 fifteen (15) days of paid parental leave per calendar year to eligible employees with at least one year of service at the time of birth, placement of an adopted child, or placement of a foster care child.\n\u2022 Adoption Assistance\n\u2022 Employee Assistance Program\n\u2022 College Coach Program\n\u2022 Back-Up Care Program\n\u2022 PTO for Volunteer Hours\n\u2022 Employee Matching Gifts Program\n\u2022 Employee Resource Groups\n\u2022 Inclusion and Diversity Programs\n\u2022 Employee Recognition Program\n\u2022 Referral Bonus Programs\n\u2022 Peer Recognition Program (BRAVO)\n\u2022 As of December 31, 2022\n\nInclusion & Diversity\u202f\n\n\u202f\n\nWe believe our commitment to diversity and inclusion creates a work environment filled with exceptional individuals. We\u2019re thrilled to have been recognized for our efforts through the Human Rights Campaign Corporate Equality Index, Dave Thomas Adoption Friendly Advocate, and several Seramount lists, including the Inclusion Index, 100 Best Companies for Working Parents, Best Companies for Dads, and Top 75 Companies for Executive Women.\n\n\u202f\n\nTo foster a culture of inclusivity throughout our workforce, workplace, and marketplace, Transamerica offers a wide range of diversity and inclusion programs. This includes our company-sponsored, employee-driven Employee Resource Groups (ERGs), which are formed around a shared interest or a common characteristic of diversity. ERGs are open to all employees. They provide a supportive environment to help us better appreciate our similarities and differences and understand how they benefit us all.\n\n\u202f\u202f\n\nGiving Back\u202f\n\n\u202f\n\nWe believe our responsibilities extend beyond our corporate walls. That's why we created the Aegon Transamerica Foundation in 1994. Through a mix of financial grants and the volunteer efforts of our employees, the foundation supports nonprofit organizations focused on the things that matter most to our people in the communities where we live and work.\n\n\u202f\n\nhttps://www.transamerica.com/why-transamerica/aegon-transamerica-foundation\u202f\n\n\u202f\n\nTransamerica\u2019s Parent Company\u202f\n\nAegon acquired the Transamerica business in 1999. Since its start in 1844, Aegon has grown into an international company serving more than 29.5 million people across the globe. It offers investment, protection, and retirement solutions, always with a clear purpose: Helping people live their best lives. As a leading global investor and employer, the company seeks to have a positive impact by addressing critical environmental and societal issues, with a focus on climate change and inclusion and diversity.", "job_is_remote": true, "job_posted_at_timestamp": 1709898585, "job_posted_at_datetime_utc": "2024-03-08T11:49:45.000Z", "job_city": null, "job_state": null, "job_country": "US", "job_latitude": 37.09024, "job_longitude": -95.71289, "job_benefits": ["retirement_savings", "dental_coverage", "paid_time_off", "health_insurance"], "job_google_link": "https://www.google.com/search?gl=us&hl=en&rciv=jb&q=director+of+brand+partnerships&start=60&ibp=htl;jobs#fpstate=tldetail&htivrt=jobs&htiq=director+of+brand+partnerships&htidocid=7TERCUuZXtKHGUoLAAAAAA%3D%3D", "job_offer_expiration_datetime_utc": "2024-04-24T17:20:50.000Z", "job_offer_expiration_timestamp": 1713979250, "job_required_experience": {"no_experience_required": false, "required_experience_in_months": 96, "experience_mentioned": true, "experience_preferred": false}, "job_required_skills": null, "job_required_education": {"postgraduate_degree": false, "professional_certification": false, "high_school": false, "associates_degree": false, "bachelors_degree": true, "degree_mentioned": true, "degree_preferred": true, "professional_certification_mentioned": false}, "job_experience_in_place_of_education": false, "job_min_salary": null, "job_max_salary": null, "job_salary_currency": null, "job_salary_period": null, "job_highlights": {"Qualifications": ["Bachelor\u2019s degree in a business-related field or equivalent experience", "Eight years of business development or relationship management experience, preferably on a national level", "Five years of employee benefits sales experience in the employee benefits industry working with brokers, consultants, agents, and benefits technology platform firms", "Thorough knowledge of the employee benefits marketplace", "Advanced sales skills to provide consultative solutions", "Excellent written/verbal communication and public speaking skills", "Self-motivated and innovative thinker", "Ability to manage multiple projects and deadlines", "Ability to work as part of a team", "Proficiency in MS Office (Word, Excel, PowerPoint, Outlook)"], "Responsibilities": ["Act as the subject matter expert on the Transamerica go-to-market strategy", "Develop and evolve relationships with target/stewardship firms, enrollment technology partners, and partnering carriers that drive revenue and value to Transamerica", "Initiate Partner Business Plans: Business overview (markets they serve, product focus, cross over with TA, carrier market share, etc.); annual goals (activity, submitted premium, paid premium); roles and responsibilities; contact mapping", "Develop, manage, and report on firm level activity (quarterly updates), RFP activity, sales, firm supplemental compensation agreement management, and act as liaison for the financial reporting area", "Manage market updates outlining product and service enhancements, state approval updates, third party partnerships (HSA, PTO Exchange, benefit admin partners, tech fee offset partner programs, etc.)", "Partner with mid-market, large-market and wholesale-market sales teams on contact mapping, host producer engagement events (product spotlight webinars, educational programs, thought leadership events), and support office level engagement strategies", "Partner with Marketing and Events teams to develop annual calendars for industry and target firm events (thought leadership engagement); manage process, attendees, agendas and appropriate follow up", "Participate in and attend industry association memberships/board and attend annual events", "Work with retirement sales and client executive teams to build foundations for effective cross selling of employee benefits", "Partner with internal Account Management, Marketing, Product, Operations and Actuarial teams to provide client deliverables", "Identify market trends for development of new products, distribution outlets, and segments for Transamerica portfolio", "Meet annual growth targets at firm level (10% annually as an example)", "Extensive travel (40-60%)"], "Benefits": ["Please note that the compensation information that follows is a good faith estimate for this position only and is provided pursuant to applicable pay transparency and compensation posting laws", "The Salary for this position generally ranges between $85,000 - $110,000 annually", "This position may be eligible to earn commissions based on applicable sales incentive plan(s)", "All details pertaining to the calculation and payment of those commissions are available in the individual provisions of the sales incentive plan that applies", "Additionally, this position is typically eligible for an Annual Bonus based on the Company Bonus Plan/Individual Performance and is at the Company\u2019s discretion", "For eligible employees, we offer a comprehensive benefits package designed to support both the personal and financial well-being of our employees", "Compensation Benefits", "Competitive Pay", "Bonus for Eligible Employees", "Pension Plan", "401k Match", "Employee Stock Purchase Plan", "Tuition Reimbursement", "Disability Insurance", "Medical Insurance", "Dental Insurance", "Vision Insurance", "Employee Discounts", "Career Training & Development Opportunities", "Health and Work/Life Balance Benefits", "Paid Time Off starting at 160 hours annually for employees in their first year of service", "Ten (10) paid holidays per year (typically mirroring the New York Stock Exchange (NYSE) holidays)", "Be Well Company holistic wellness program, which includes Wellness Coaching and Reward Dollars", "Parental Leave \u2013 fifteen (15) days of paid parental leave per calendar year to eligible employees with at least one year of service at the time of birth, placement of an adopted child, or placement of a foster care child", "Adoption Assistance", "Employee Assistance Program", "College Coach Program", "Back-Up Care Program", "PTO for Volunteer Hours", "Employee Matching Gifts Program", "Employee Resource Groups", "Employee Recognition Program", "Referral Bonus Programs", "Peer Recognition Program (BRAVO)"]}, "job_job_title": "Director", "job_posting_language": "en", "job_onet_soc": "11311100", "job_onet_job_zone": "4", "job_naics_code": "524113", "job_naics_name": "Direct Life Insurance Carriers"}