{"job_id": "VuoTnhQ8vdxQybeYAAAAAA==", "employer_name": "Dexerto", "employer_logo": "https://encrypted-tbn0.gstatic.com/images?q=tbn:ANd9GcTcq7gcF8p3-BMkQ72LGmcHmbQExBItn2slQkZJ&s=0", "employer_website": null, "employer_company_type": null, "job_publisher": "LinkedIn", "job_employment_type": "FULLTIME", "job_title": "Digital Media Sales & Brand Partnerships Manager", "job_apply_link": "https://www.linkedin.com/jobs/view/digital-media-sales-brand-partnerships-manager-at-dexerto-3748543455", "job_apply_is_direct": false, "job_apply_quality_score": 0.6388, "apply_options": [{"publisher": "LinkedIn", "apply_link": "https://www.linkedin.com/jobs/view/digital-media-sales-brand-partnerships-manager-at-dexerto-3748543455", "is_direct": false}, {"publisher": "Salary.com", "apply_link": "https://www.salary.com/job/dexerto/senior-media-sales-brand-partnerships-manager/j202403070514582024476", "is_direct": false}, {"publisher": "Www.dnnyheter24h.com", "apply_link": "https://www.dnnyheter24h.com/?refId=Xl8PGqCAGHv%2FprvIWyuMBQ%3D%3D&trackingId=KWN6%2FzB7vRkj6Tt2JbeBRQ%3D%3D&position=13&pageNum=0&trk=public_jobs_jserp-result_search-card&_=%2Fjobs%2Fview%2Fdigital-media-sales-brand-partnerships-manager-at-dexerto-3748543455%23KJWqMdlUlBn8PPpbXBTujI7xcY8uGFCs", "is_direct": false}], "job_description": "Embrace your passion for gaming and esports, and play a crucial role in shaping the future of digital media and entertainment at Dexerto. We're currently seeking a talented Digital Media Sales & Brand Partnerships Manager. We're looking for someone with a strong media sales background, ideally within the publisher or agency sphere, to join our dynamic team.\n\nIn this role, you'll have the opportunity to work remotely and immerse yourself in the digital media landscape, creating game-changing collaborations with top brands and agencies. The ideal candidate should have a minimum of 5 years of media sales experience, a knack for building lasting relationships, and an extensive network of warm contacts who are eager to learn about your new role and our captivating story.\n\nWhile qualities like hard work and dedication are appreciated, what truly sets you apart is your unwavering passion for our industry and a proven track record of securing significant deals.\n\nKey Highlights\n\u2022 This is a remote position.\n\u2022 You should have at least 5 years of media sales experience.\n\u2022 Knowledge and understanding of the digital publisher landscape are essential.\n\u2022 Your responsibilities include generating revenue, nurturing relationships, and acting as a brand ambassador.\n\u2022 You'll collaborate with our global team and report to the Head of Sales.\n\nAbout Dexerto\n\nDexerto stands as an award-winning media company at the forefront of gaming and entertainment culture. Our mission is to be the leading destination for engaging and informative coverage of all things gaming and entertainment. By partnering with major brands like Kelloggs, Sony, Red Bull, and Volvo, we captivate audiences worldwide through groundbreaking campaigns.\n\nRole And Responsibilities\n\u2022 Drive revenue through advertising, content, events, influencer marketing, and tailored offerings.\n\u2022 Leverage your network to identify potential leads in the gaming and online digital entertainment culture.\n\u2022 Implement cutting-edge advertising solutions on Dexerto.com, delivering measurable results for clients.\n\u2022 Represent Dexerto with integrity and expertise, acting as a valuable resource for clients and agencies.\n\u2022 Consult with clients, understand their business needs, and craft comprehensive sales solutions.\n\u2022 Collaborate with global teams across product, content, sales, marketing, and creative.\n\u2022 Stay ahead of the curve, mastering programmatic advertising and the ever-evolving digital media landscape.\n\u2022 Thrive under deadlines, prioritizing tasks to support a global team.\n\u2022 Cultivate exceptional client and partner relationships.\n\u2022 Exceed quarterly business goals by effectively managing the advertiser pipeline.\n\nJob Requirements\n\u2022 Possess at least 5 years of experience in a similar role (agency-side experience is a plus).\n\u2022 While a bachelor's degree is preferred, experience and results take precedence.\n\u2022 Understanding of the gaming and influencer digital landscape is vital.\n\u2022 Strategic thinking, persuasive selling, and effective communication skills are crucial.\n\u2022 Willingness to go the extra mile, even beyond conventional working hours.\n\u2022 Demonstrate hunger for success and a drive to grow personally and professionally.\n\u2022 Bring forth a continuous stream of proactive ideas and solutions.\n\u2022 Be a compelling presenter, with exceptional PowerPoint and communication skills.\n\u2022 Present yourself confidently, whether in a remote or in-person setting.\n\nAt Dexerto, we believe in the power of passion and experience in the gaming and esports industry. We invite you to join us on our mission to revolutionize media and entertainment. Let's embark on this exciting journey together!", "job_is_remote": true, "job_posted_at_timestamp": 1698226309, "job_posted_at_datetime_utc": "2023-10-25T09:31:49.000Z", "job_city": null, "job_state": "KS", "job_country": "US", "job_latitude": 39.0119, "job_longitude": -98.484245, "job_benefits": null, "job_google_link": "https://www.google.com/search?gl=us&hl=en&rciv=jb&q=manager+of+brand+partnerships&start=60&ibp=htl;jobs#fpstate=tldetail&htivrt=jobs&htiq=manager+of+brand+partnerships&htidocid=VuoTnhQ8vdxQybeYAAAAAA%3D%3D", "job_offer_expiration_datetime_utc": "2024-04-22T09:31:50.000Z", "job_offer_expiration_timestamp": 1713778310, "job_required_experience": {"no_experience_required": false, "required_experience_in_months": 60, "experience_mentioned": true, "experience_preferred": true}, "job_required_skills": null, "job_required_education": {"postgraduate_degree": false, "professional_certification": false, "high_school": false, "associates_degree": false, "bachelors_degree": true, "degree_mentioned": true, "degree_preferred": false, "professional_certification_mentioned": false}, "job_experience_in_place_of_education": false, "job_min_salary": null, "job_max_salary": null, "job_salary_currency": null, "job_salary_period": null, "job_highlights": {"Qualifications": ["The ideal candidate should have a minimum of 5 years of media sales experience, a knack for building lasting relationships, and an extensive network of warm contacts who are eager to learn about your new role and our captivating story", "You should have at least 5 years of media sales experience", "Knowledge and understanding of the digital publisher landscape are essential", "Understanding of the gaming and influencer digital landscape is vital", "Strategic thinking, persuasive selling, and effective communication skills are crucial", "Willingness to go the extra mile, even beyond conventional working hours", "Demonstrate hunger for success and a drive to grow personally and professionally", "Bring forth a continuous stream of proactive ideas and solutions", "Be a compelling presenter, with exceptional PowerPoint and communication skills", "Present yourself confidently, whether in a remote or in-person setting"], "Responsibilities": ["Your responsibilities include generating revenue, nurturing relationships, and acting as a brand ambassador", "You'll collaborate with our global team and report to the Head of Sales", "Drive revenue through advertising, content, events, influencer marketing, and tailored offerings", "Leverage your network to identify potential leads in the gaming and online digital entertainment culture", "Implement cutting-edge advertising solutions on Dexerto.com, delivering measurable results for clients", "Represent Dexerto with integrity and expertise, acting as a valuable resource for clients and agencies", "Consult with clients, understand their business needs, and craft comprehensive sales solutions", "Collaborate with global teams across product, content, sales, marketing, and creative", "Stay ahead of the curve, mastering programmatic advertising and the ever-evolving digital media landscape", "Thrive under deadlines, prioritizing tasks to support a global team", "Cultivate exceptional client and partner relationships", "Exceed quarterly business goals by effectively managing the advertiser pipeline"]}, "job_job_title": "Partnerships manager", "job_posting_language": "en", "job_onet_soc": "11201100", "job_onet_job_zone": "4"}