{"job_id": "lntfQ1j82NGFVr3BAAAAAA==", "employer_name": "Abarca Health", "employer_logo": "https://encrypted-tbn0.gstatic.com/images?q=tbn:ANd9GcSYlX752ZEM1Y8C5AbfLybSucv0EMHuVUEZYPTy&s=0", "employer_website": "http://www.abarcahealth.com", "employer_company_type": null, "job_publisher": "Glassdoor", "job_employment_type": "FULLTIME", "job_title": "Business Development Consultant", "job_apply_link": "https://www.glassdoor.com/job-listing/business-development-consultant-abarca-health-JV_KO0,31_KE32,45.htm?jl=1009082528195", "job_apply_is_direct": true, "job_apply_quality_score": 0.6563, "apply_options": [{"publisher": "Glassdoor", "apply_link": "https://www.glassdoor.com/job-listing/business-development-consultant-abarca-health-JV_KO0,31_KE32,45.htm?jl=1009082528195", "is_direct": true}, {"publisher": "Simplify", "apply_link": "https://simplify.jobs/p/d006047a-ebee-499f-afeb-77e015727895/Business-Development-Consultant", "is_direct": false}, {"publisher": "LinkedIn", "apply_link": "https://www.linkedin.com/jobs/view/business-development-consultant-at-abarca-health-3810352119", "is_direct": false}, {"publisher": "LazyApply", "apply_link": "https://lazyapply.com/jobpreview/job_2c1087c30c506720", "is_direct": true}, {"publisher": "Indeed", "apply_link": "https://www.indeed.com/viewjob?jk=2c1087c30c506720", "is_direct": true}, {"publisher": "Jobgether", "apply_link": "https://jobgether.com/offer/65ba24b73122baffeb106e1e-business-development-consultant", "is_direct": false}, {"publisher": "Jobright AI", "apply_link": "https://jobright.ai/jobs/info/65aaae9362a6927de071d745", "is_direct": false}, {"publisher": "Www.newsnewshouse.com", "apply_link": "https://www.newsnewshouse.com/?refId=3t8UUhreVCJEVKxfcZuWIA%3D%3D&trackingId=0diCrHnBXBaincl8TkULAA%3D%3D&position=13&pageNum=0&trk=public_jobs_jserp-result_search-card&_=%2Fjobs%2Fview%2Fbusiness-development-consultant-at-abarca-health-3810352119%23KJWqMdlUlBn8PPpbXBTujI7xcY8uGFCs", "is_direct": false}], "job_description": "What you'll do\n\nIn a few words\u2026\n\nAbarca is igniting a revolution in healthcare. We built our company on the belief that with smarter technology we are redefining pharmacy benefits, but this is just the beginning\u2026\n\nOur Sales and Business Development gurus are the welcoming heralds for any potential client! They're entrusted with developing the strategy operational relationships that are needed to extend our superior quality, processes, and aid to new beneficiaries. They handle everything related to marketing our value proposition, proposal management, emphasizing our broad line of products and supporting all services our potential clients are seeking.\n\nWe are seeking a highly motivated and skilled Business Development Consultant to join our dynamic business development team at Abarca Health. As a Business Development Consultant, you will be the client facing representative for Abarca to support our high-profile clients with all their request for proposal (RFP) needs. This includes answering RFP questions, providing necessary documentation and exhibits, managing project deadlines, and coordinating meetings. You will interface with everyone at the organization. This role requires occasional travel. Must be willing to travel as needed and work Pacific Standard time zone (8:00 AM \u2013 5:00 PM PST).\n\nThe fundamentals for the job\u2026\n\u2022 Management of all contract obligations related to sales and business development for the client\n\u2022 Management of high-profile client RFPs\n\u2022 Building strong relationships with clients to maintain a high client satisfaction\n\u2022 Communicating with clients by phone, through email and face to face ensures their needs are understood and addressed\n\u2022 Supporting the client's growth and marketing strategy by developing unique go to market strategies and building brand awareness for the client\n\u2022 Travel as needed to support finalist or sales presentation, or client needed meetings\n\u2022 Overseeing product evaluation needs from client\n\u2022 Responsible of doing market research\n\u2022 Establishing and monitoring business metrics\n\u2022 Generating data and reports to illustrate client management (volume of RFP questions managed, total RFPs, win/loss ratios, etc.)\n\u2022 Collaborating with various internal departments to ensure they fulfill all customer requests\n\u2022 Resolving complaints and keeping track of all processes that pertain to the client's desires\n\u2022 Acting as the client's representative to ensure their demands are met with a focus on improving the customer experience\n\u2022 All other duties as assigned\n\nWhat we expect of you\n\nThe bold requirements\u2026\n\u2022 Bachelor's Degree or Master's Degree in Healthcare Administration or Management, Marketing or Pharmacy. (In lieu of a degree, equivalent, relevant work experience may be considered).\n\u2022 3+ years of experience in sales, business development, account management, or pharmacy with a focus in managed care, healthcare, or pharmacy benefit management.\n\u2022 Experience collaborating with multi-functional teams to develop a customer-specific proposal strategy.\n\u2022 Experience creating new proposal text by meeting with subject matter experts or using reference documents.\n\u2022 Experience with Salesforce\n\u2022 Experience with Ombud or other Request for Proposal (RFP) software management tools\n\u2022 Excellent oral and written communication skills.\n\u2022 Experience with presentations and public speaking\n\u2022 Must be technology savvy with robust experience working with all Microsoft products\n\u2022 Strong customer service and interpersonal skills for dealing with different types of customers and clients\n\u2022 Satisfactory problem-solving skills to help resolve customer complaints or needs\n\u2022 Exceptional analytical skills for interpreting client data\n\u2022 Advanced contract management & negotiation skills\n\u2022 Strong organizational skills and attention to detail\n\u2022 Time management and multitasking skills to handle multiple tasks and clients at once\n\u2022 We are proud to offer a flexible hybrid work model which will require certain on-site work days (Puerto Rico Location Only)\n\nNice to haves\u2026\n\u2022 Tableau experience.\n\u2022 Bilingual fluency in English and Spanish.\n\nPhysical requirements\u2026\n\u2022 Must be able to access and navigate each department at the organization's facilities.\n\u2022 Sedentary work that primarily involves sitting/standing.\n\nAt Abarca we value and celebrate diversity. Diversity, equity, inclusion, and belonging are guiding principles of Abarca and ensure Abarca's workforce reflects the communities it serves. We are proud to provide equal employment opportunities to all employees and applicants for employment and prohibit discrimination and harassment of any type without regard to race, color, religion, age, sex, national origin, disability status, medical condition, genetic information, protected veteran status, sexual orientation, gender identity or expression, or any other characteristic protected by federal, state, or local laws.\n\nAbarca Health LLC is an equal employment opportunity employer and participates in E-Verify. \"Applicant must be a United States' citizen. Abarca Health LLC does not sponsor employment visas at this time\"\n\nThe above description is not intended to limit the scope of the job or to exclude other duties not mentioned. It is not a final set of specifications for the position. It's simply meant to give readers an idea of what the role entails.\n\n#LI-AMBT #LI-REMOTE", "job_is_remote": true, "job_posted_at_timestamp": 1708300800, "job_posted_at_datetime_utc": "2024-02-19T00:00:00.000Z", "job_city": null, "job_state": null, "job_country": "US", "job_latitude": 37.09024, "job_longitude": -95.71289, "job_benefits": null, "job_google_link": "https://www.google.com/search?gl=us&hl=en&rciv=jb&q=business+development+consultant&start=0&ibp=htl;jobs#fpstate=tldetail&htivrt=jobs&htiq=business+development+consultant&htidocid=lntfQ1j82NGFVr3BAAAAAA%3D%3D", "job_offer_expiration_datetime_utc": "2024-07-11T00:00:00.000Z", "job_offer_expiration_timestamp": 1720656000, "job_required_experience": {"no_experience_required": false, "required_experience_in_months": null, "experience_mentioned": true, "experience_preferred": false}, "job_required_skills": null, "job_required_education": {"postgraduate_degree": false, "professional_certification": false, "high_school": false, "associates_degree": false, "bachelors_degree": false, "degree_mentioned": true, "degree_preferred": true, "professional_certification_mentioned": false}, "job_experience_in_place_of_education": false, "job_min_salary": null, "job_max_salary": null, "job_salary_currency": null, "job_salary_period": null, "job_highlights": {"Qualifications": ["Must be willing to travel as needed and work Pacific Standard time zone (8:00 AM \u2013 5:00 PM PST)", "Bachelor's Degree or Master's Degree in Healthcare Administration or Management, Marketing or Pharmacy", "(In lieu of a degree, equivalent, relevant work experience may be considered)", "3+ years of experience in sales, business development, account management, or pharmacy with a focus in managed care, healthcare, or pharmacy benefit management", "Experience collaborating with multi-functional teams to develop a customer-specific proposal strategy", "Experience creating new proposal text by meeting with subject matter experts or using reference documents", "Experience with Salesforce", "Experience with Ombud or other Request for Proposal (RFP) software management tools", "Excellent oral and written communication skills", "Experience with presentations and public speaking", "Must be technology savvy with robust experience working with all Microsoft products", "Strong customer service and interpersonal skills for dealing with different types of customers and clients", "Satisfactory problem-solving skills to help resolve customer complaints or needs", "Exceptional analytical skills for interpreting client data", "Advanced contract management & negotiation skills", "Strong organizational skills and attention to detail", "Time management and multitasking skills to handle multiple tasks and clients at once", "We are proud to offer a flexible hybrid work model which will require certain on-site work days (Puerto Rico Location Only)", "Tableau experience", "Bilingual fluency in English and Spanish", "Must be able to access and navigate each department at the organization's facilities", "\"Applicant must be a United States' citizen"], "Responsibilities": ["As a Business Development Consultant, you will be the client facing representative for Abarca to support our high-profile clients with all their request for proposal (RFP) needs", "This includes answering RFP questions, providing necessary documentation and exhibits, managing project deadlines, and coordinating meetings", "You will interface with everyone at the organization", "This role requires occasional travel", "Management of all contract obligations related to sales and business development for the client", "Management of high-profile client RFPs", "Building strong relationships with clients to maintain a high client satisfaction", "Communicating with clients by phone, through email and face to face ensures their needs are understood and addressed", "Supporting the client's growth and marketing strategy by developing unique go to market strategies and building brand awareness for the client", "Travel as needed to support finalist or sales presentation, or client needed meetings", "Overseeing product evaluation needs from client", "Responsible of doing market research", "Establishing and monitoring business metrics", "Generating data and reports to illustrate client management (volume of RFP questions managed, total RFPs, win/loss ratios, etc.)", "Collaborating with various internal departments to ensure they fulfill all customer requests", "Resolving complaints and keeping track of all processes that pertain to the client's desires", "Acting as the client's representative to ensure their demands are met with a focus on improving the customer experience", "All other duties as assigned"]}, "job_job_title": "Development consultant", "job_posting_language": "en", "job_onet_soc": "41401400", "job_onet_job_zone": null}